question,expected_answer,source,retrieved_context,generated_answer,total_latency_ms,prompt_tokens,completion_tokens,total_tokens
"If the Capital Sum Insured for the Personal Accident Cover is ₹15 lakh and the policy pays 50% of the Capital Sum Insured for the loss of one limb or sight of one eye, how much compensation would the insured receive? Show the calculation.","Compensation = 50% × ₹15,00,000 = ₹7,50,000. Therefore, the insured would receive ₹7,50,000 as compensation for the loss of one limb or sight of one eye.",,"===== REPORTS =====

  id                                         title                                                                                                                                                                                                                                                                                                                                                                                                                                                                                                                                                                                                                                                                                                                                                                                                                                                                                                                                                                                                                                                                                                                                                                                                                                                                                                                                                                                                                                                                                                                                                                                                                                                                                                                                                                                                                                                                                                                                                                                                                                                                                                                                                                                                                                                                                                                                                                                                                                                                                                                                                                                                                                                                                                                                                                                                                                                                                                                                                                                                                                                                                                                                                                                                                                                                                                                                                                                                                                                                                                                                                                                                                                                                                                                                                                                                                                                                                                                                                                                                                                                                                                                                                                                                                                                                                                                                                                                                                                                                                                                        content
0  4             ICICI Lombard Insurance Community  # ICICI Lombard Insurance Community\n\nThe ICICI Lombard Insurance community encompasses various entities that are deeply interconnected through insurance policies and coverage provisions. Primary entities include the Insured Person, ICICI Lombard General Insurance Company, hospitals, and various benefit extensions such as Daily Cash and Ambulance Cover. The community functions with contractual relationships and obligations, where the insured individuals maintain rights and responsibilities under their policies, which are crucial in ensuring proper insurance coverage and claims processing.\n\n## Critical Role of Insured Persons\n\nInsured Persons are at the core of the ICICI Lombard Insurance community, representing individuals who are covered under insurance policies. These individuals have the right to claim benefits for a range of medical expenses, including hospitalization and ambulance services due to accidents. Under the insurance policy, the Insured Person also has the responsibility to report any claims or changes in their risk profile to the company to maintain coverage validity. This relationship defines the fundamental purpose of insurance: to provide financial security during unforeseen medical incidents [Data: Entities (212); Relationships (230, 617)].\n\n## Significance of ICICI Lombard General Insurance Company\n\nICICI Lombard General Insurance Company is the main entity providing insurance coverage to the Insured Persons within this community. As a prominent provider in India, the company outlines specific terms in insurance policies, enabling Insured Persons to receive financial protection against medical expenses and accidents. The company facilitates the claims process, which is essential for ensuring that the Insured Persons can navigate their recovery and financial obligations effectively following incidents covered under the policy [Data: Entities (466); Relationships (617)].\n\n## Role of Hospitals in Healthcare Access\n\nHospitals are vital in the ICICI Lombard community as they are the institutions where Insured Persons receive treatment following accidents or medical emergencies. The relationship between hospitals and Insured Persons is founded on the need for medical care and the need to process insurance claims for hospitalization. The involvement of hospitals underscores the importance of complying with quality standards and regulations outlined in the Clinical Establishments Act, which ensures trust in the healthcare provision within the community [Data: Entities (173); Relationships (223)].\n\n## Hospitalization Benefits and Coverage\n\nHospitalization is a critical aspect for Insured Persons, as it triggers various claims to be filed with ICICI Lombard for financial support against medical expenses incurred during inpatient care. Provisions such as Hospital Daily Cash and Post-Hospitalization Medical Expenses reflect the need for comprehensive coverage, offering financial relief to Insured Persons during their recovery phase. These aspects of the policy are designed to alleviate the economic burden of medical care following unexpected accidents [Data: Entities (496, 258); Relationships (286, 677)].\n\n## Claim Procedures and Documentation\n\nThe community is structured around explicit procedures that Insured Persons must follow to successfully submit insurance claims. This includes filling out the Claim Form and adhering to the Claim Procedure, necessary for processing requests for reimbursement of medical expenses. A clear understanding and compliance with these protocols are crucial for effective claims management, ensuring that Insured Persons receive timely financial support for their medical needs arising from accidents [Data: Entities (153, 598); Relationships (167)].\n\n## Implications of Cancellations and Fraudulent Claims\n\nThe cancellation of policies and the presence of fraudulent claims represent critical challenges within the ICICI Lombard community. Fraudulent claims can lead to penalties and a forfeiture of benefits under an insurance policy, emphasizing the need for honesty and transparency in all dealings with the insurer. Such measures ensure that the sustainability of the insurance model remains intact, protecting both the company and the insured individuals from losses [Data: Entities (38); Relationships (43, 720)].
1  5  Insurance Regulation and Liability Framework                                                                                                                                                                                                                                                                                                 # Insurance Regulation and Liability Framework\n\nThis community consists primarily of the Insurer, the Motor Vehicles Act, 1988, and the Workmen’s Compensation Act, with their interrelations defining vehicle insurance and employee liability coverage in India. The Insurer provides foundational services under these regulatory frameworks, ensuring compliance with various legal obligations while managing risks related to motor vehicle operations and workplace injuries.\n\n## Insurer's Role in Vehicle Coverage\n\nThe Insurer plays a fundamental role by offering comprehensive insurance coverage for vehicles against various risks such as theft, accidents, and environmental damages. This coverage is detailed in policies that specify liability terms, ensuring vehicle owners are adequately protected and any claims are managed efficiently. The insurer is obliged to follow the regulations specified in the Motor Vehicles Act, 1988, which governs the operational standards, ensuring their services align with legal requirements [Data: Entities (57); Relationships (56, 100)].\n\n## Motor Vehicles Act, 1988's Impact on Insurance\n\nThe Motor Vehicles Act, 1988 establishes the legal framework within which the Insurer operates. It necessitates compliance from insurers regarding vehicle registration, insurance requirements, and liability coverage. By imposing specific standards and regulations, this Act ensures that insurers fulfill their responsibilities towards policyholders, promoting road safety and minimizing risks associated with vehicle use. The Act also addresses the obligations of both vehicle operators and insurers, effectively integrating their responsibilities [Data: Entities (96); Relationships (100, 122)].\n\n## Workmen’s Compensation Act and Employment Liabilities\n\nThe Workmen’s Compensation Act provides critical legal guidelines for employee compensation in the event of workplace injuries. It outlines the Insurer's responsibility to cover liabilities under this Act, ensuring that workers are compensated without needing to prove employer negligence. This regulatory framework is vital in protecting workers' rights and promoting a safe working environment, making the insurer's role pivotal in managing these liabilities effectively [Data: Entities (75, 383); Relationships (126, 449)].\n\n## Compliance with Regulatory Requirements\n\nThe Insurer is bound to comply with various legal requirements established by regulations such as the Motor Vehicles Act and the Workmen's Compensation Act. This compliance not only ensures that the insurer operates within legal boundaries but also protects the interests of policyholders, enforcing standards that guarantee adequate compensation for vehicle damages and workplace injuries. Such regulatory adherence is fundamental in maintaining public trust in the insurance landscape [Data: Relationships (100, 449)].\n\n## Potential Risks and Their Impact\n\nVarious risks are recognized by the insurer, including damage due to explosions, theft, and environmental factors such as storms and inundation. These risks are delineated in the insurance policy, which outlines specific coverage areas. Understanding these risks is critical, as they directly affect the insurer's liability and the financial protection offered to policyholders. The insurer's approach to managing these risks significantly influences its operational strategy and policy effectiveness [Data: Entities (65, 68, 70, 76); Relationships (763, 774)].\n\n## Claims Management Process\n\nThe claims management process is a vital aspect of the insurer's responsibilities, particularly in the context of the Motor Vehicles Act and the Workmen's Compensation Act. Efficient claims processing ensures that policyholders receive compensation timely for losses incurred, reinforcing the insurer's credibility in the market. This process is guided by specific policy stipulations and regulatory compliance, highlighting the importance of a streamlined approach to managing claims [Data: Entities (57); Relationships (449, 100)].

===== RELATIONSHIPS =====

     id                            source                         target                                                                                                                                                                                                                                                                                                                                                                                                                                                                                                                                                                                                                                                                                                                                                                                                                                                                                                                                                                                                                                                                                                                                                  description weight links  in_context
0   450                       DISABLEMENT                   COMPENSATION                                                                                                                                                                                                                                                                                                                                                                                                                                                                                                                                                                                                                                                                                                                                                                                                                                                                                                                                                                                                                                                   Permanent total disablement is a condition under which compensation is paid based on the policy provisions    1.0     1        True
1    95                           INSURER                         PERSON                                                                                                                                                                                                                                                                                                                                                                                                                                                                                                                                                                                                                                                                                                                                                                                                                                                                                                                                                                                                                                        The insurer has responsibilities in providing coverage for the liabilities of paid drivers, conductors, and cleaners.    8.0     7        True
2   452                           INSURER                   COMPENSATION                                                                                                                                                                                                                                                                                                                                                                            The insurer plays a crucial role in providing financial protection and peace of mind to policyholders. In the event of an accident covered by the insurance policy, the insurer is responsible for paying compensation to the insured or their legal representatives. This ensures that individuals or their beneficiaries receive the necessary support to recover from the financial burdens that may arise due to the accident. The compensation process is a fundamental aspect of the insurer's obligations, highlighting their commitment to safeguarding the interests of those they have contracted to protect. Ultimately, the insurer's responsibility to provide compensation underscores the importance of having an insurance policy in place for unforeseen events.   16.0     7        True
3    65                           INSURER        PERSONAL ACCIDENT COVER                                                                                                                                                                                                                                                                                                                                                                                                                                                                                                                                                                                                                                                                                                                                                                                                                                                                                                                                                                                                                                            The insurer provides personal accident cover as part of the insurance policy for those using the insured vehicle.    5.0     7        True
4   447                           INSURER                         IMT 15                                                                                                                                                                                                                                                                                                                                                                                                                                                                                                                                                                                                                                                                                                                                                                                                                                                                                                                                                                                                                                                                   The insurer provides personal accident coverage details in IMT 15 for insured individuals.    8.0     7        True
5    71         CAPITAL SUM INSURED (CSI)                        INSURER                                                                                                                                                                                                                                                                                                                                                                                                                                                                                                                                                                                                                                                                                                                                                                                                                                                                                                                                                                                                                            Capital Sum Insured (CSI) determines the maximum amount the insurer is liable to pay for injuries per individual under the policy    6.0     7        True
6   457                COMPENSATION LIMIT                        INSURER                                                                                                                                                                                                                                                                                                                                                                                                                                                                                                                                                                                                                                                                                                                                                                                                                                                                                                                                                                                                                                                            The insurer sets a compensation limit within which claims must be settled according to the policy    1.0     7        True
7   485                         SECTION I                        INSURER                                                                                                                                                                                                                                                                                                                                                                                                                                                                                                                                                                                                                                                                                                                                                                                                                                                                                                                                                                                                                Section I sets forth the obligations and coverage details that the insurer must follow when processing claims related to the insured vehicle.    7.0     7        True
8   653                    INSURED PERSON                    EXTENSION 5                                                                                                                                                                                                                                                                                                                                                                                                                                                                                                                                                                                                                                                                                                                                                                                                                                                                                                                                                                                                                                                                   Extension 5 pertains specifically to the Insured Person and limits on claims they can make    6.0     5        True
9   874                    INSURED PERSON     EMERGENCY MEDICAL EXPENSES                                                                                                                                                                                                                                                                                                                                                                                                                                                                                                                                                                                                                                                                                                                                                                                                                                                                                                                                                                                                                                         The Insured Person can claim reimbursement for Emergency Medical Expenses incurred due to injuries from an accident.    8.0     5        True
10  658                         BENEFIT 5                 INSURED PERSON                                                                                                                                                                                                                                                                                                                                                                                                                                                                                                                                                                                                                                                                                                                                                                                                                                                                                                                                                                                                                                                Benefit 5 provides compensation to the Insured Person for daily hospital stays related to accidental injuries    1.0     5        True
11  287                    INSURED PERSON                AMBULANCE COVER                                                                                                                                                                                                                                                                                                                                                                                                                                                                                                                                                                                                                                                                                                                                                                                                                                                                                                                                                                                                                                                        The Insured Person may utilize Ambulance Cover for transportation to a hospital following an Accident    1.0     5        True
12  675                    INSURED PERSON        PAYMENT OF COMPENSATION                                                                                                                                                                                                                                                                                                                                                                                                                                                                                                                                                                                                                                                                                                                                                                                                                                                                                                                                                                                                                                           The Insured Person may receive PAYMENT OF COMPENSATION for injuries or illnesses covered by the policy provisions.    5.0     5        True
13   15                            POLICY                   COMPENSATION                                                                                                                                                                                                                                                                                                                                                                                                                                                                                                                                                                                                                                                                                                                                                                                                                                                                                                                                                                                                                                                                                     The Policy stipulates the Compensation to be provided for covered losses    8.0     3        True
14  646                            POLICY                    EXTENSION 5                                                                                                                                                                                                                                                                                                                                                                                                                                                                                                                                                                                                                                                                                                                                                                                                                                                                                                                                                                                                                                                                        Extension 5 outlines the benefits for Permanent Partial Disablement under the Policy.    1.0     3        True
15  645                            POLICY                    EXTENSION 4                                                                                                                                                                                                                                                                                                                                                                                                                                                                                                                                                                                                                                                                                                                                                                                                                                                                                                                                                                                                                                                                Extension 4 specifies coverage for Permanent Total Disablement as a benefit under the Policy.    8.0     3        True
16  719                           COMPANY                   COMPENSATION                                                                                                                                                                                                                                                                                                                                                                                                                                                                                                                                                                                                                                                                                        The Company is tasked with administering Compensation to the Insured Person for valid claims made under the Policy. This includes providing compensation for losses incurred as a result of accidents, in alignment with the stipulations outlined in the policy. The Company's role is fundamentally to ensure that claims made by the Insured Person are evaluated and compensated fairly, thereby fulfilling the obligations set forth in the insurance agreement.   16.0     2        True
17  238                           COMPANY                      FRANCHISE                                                                                                                                                                                                                                                                                                                                                                                                                                                                                                                                                                                                                                                                                                                                                                                                                                                                                                                                                                                                                                                                              The company defines franchise limits in the context of their insurance coverage    1.0     2        True
18  454                          ACCIDENT                   COMPENSATION                                                                                                                                                                                                                                                                                                                                                                                                                                                                                                                                                                                                                                                                                                                                                                                                                                                                                                                                                                                                                                                                     An accident causes injuries that necessitate compensation payment to the affected person    1.0     2        True
19  285                          ACCIDENT     EMERGENCY MEDICAL EXPENSES                                                                                                                                                                                                                                                                                                                                                                                                                                                                                                                                                                                                                                                                                                                                                                                                                                                                                                                                                                                                                                                                             Emergency Medical Expenses arise directly from injuries sustained in an Accident    8.0     2        True
20  410                     BODILY INJURY                   COMPENSATION                                                                                                                                                                                                                                                                                                                                                                                                                                                                                                                                                                                                                                                                                                                                                                                                                                                                                                                                                                                                                                                    Compensation is available for losses due to bodily injury claims under the terms of the insurance policy.    7.0     2        True
21  796                             LIMBS                  BODILY INJURY                                                                                                                                                                                                                                                                                                                                                                                                                                                                                                                                                                                                                                                                                                                                                                                                                                                                                                                                                                                                                                                  Loss of limbs is a specific example of a bodily injury eligible for compensation under the insurance policy    9.0     2        True
22  433           PERSONAL ACCIDENT COVER                        INSURED                                                                                                                                                                                                                                                                                                                                                                                                                                                                                                                                                                                                                                                                                                                                                                                                                                                                                                                                                                                                                                                         The Personal Accident Cover applies to the Insured as the owner-driver under the terms of the policy    1.0     1        True
23  442                           VEHICLE                         PERSON                                                                                                                                                                                                                                                                                                                                                                                                                                                                                                                                                                                                                                                                                                                                                                                                                                                                                                                                                                                     The vehicle is designed or configured for use by persons including those who may require mobility assistance due to disabilities such as blindness or mental challenges.    5.0     1        True
24  120                            PERSON                  MOTOR VEHICLE                                                                                                                                                                                                                                                                                                                                                                                                                                                                                                                                                                                                                                                                                                                                                                                                                                                                                                                                                                                                                                                              A person driving the Motor Vehicle carries responsibilities under the contract with the insurer    6.0     1        True
25   68           PERSONAL ACCIDENT COVER                INSURED VEHICLE                                                                                                                                                                                                                                                                                                                                                                                                                                                                                                                                                                                                                                                                                                                                                                                                                                                                                                                                                                                                     Personal Accident Cover is specifically related to the insured vehicle as it outlines the compensation terms for injuries occurring during its operation    8.0     1        True
26   72                      COMPENSATION                VEHICLE INSURED                                                                                                                                                                                                                                                                                                                                                                                                                                                                                                                                                                                                                                                                                                                                                                                                                                                                                                                                                                                                                                             Compensation is to be provided for injuries that occur involving the vehicle insured as stipulated in the policy    7.0     1        True
27  380                      OWNER-DRIVER                   COMPENSATION                                                                                                                                                                                                                                                                                                                                                                                                                                                                                                                                                                                                                                                                                                                                                                                                                                                                                                                                                                                                                                                       The Owner-Driver is eligible to receive COMPENSATION for injuries or death as per the Insurance Policy    1.0     1        True
28  409                             DEATH                   COMPENSATION  DEATH and COMPENSATION are closely linked in the context of insurance policies, particularly when it comes to accidents. Under certain circumstances, compensation may be payable in the event of death caused by an accident, provided that the claim adheres to the specific terms outlined in the insurance policy. This stipulation ensures that beneficiaries or dependents of the deceased can receive financial support following such tragic events, contingent upon the conditions set forth by the insurer.\n\nAdditionally, the death of any passenger involved in an accident also triggers the provision for compensation according to the terms of the insurance policy. This means that if a passenger suffers a fatality, the policy may cover compensation for their death, offering a financial safety net in these unfortunate circumstances. \n\nIn summary, both DEATH and COMPENSATION are integral elements within the framework of insurance policies, particularly relating to accidents, ensuring that adequate financial support is available to those affected by such losses, as long as the conditions of the policy are met.   16.0     1        True
29  789           PERSONAL ACCIDENT COVER                          HIRER                                                                                                                                                                                                                                                                                                                                                                                                                                                                                                                                                                                                                                                                                                                                                                                                                                                                                                                                                                                                                        The Personal Accident Cover applies to unnamed hirers, providing compensation for injuries sustained while using the insured vehicle.    8.0     1        True
30  119                          EMPLOYEE                         PERSON                                                                                                                                                                                                                                                                                                                                                                                                                                                                                                                                                                                                                                                                                                                                                                                                                                                                                                                                                                                                                                                                  The Employee is defined under the policy provisions as potentially having legal liabilities    4.0     1        True
31  164                  CUSTOMER SUPPORT                         PERSON                                                                                                                                                                                                                                                                                                                                                                                                                                                                                                                                                                                                                                                                                                                                                                                                                                                                                                                                                                                                                                                 Individuals can reach out to customer support through various channels for assistance with insurance claims.    7.0     1        True
32   73                      COMPENSATION  PAID DRIVER/CLEANER/CONDUCTOR                                                                                                                                                                                                                                                                                                                                                                                                                                                                                                                                                                                                                                                                                                                                                                                                                                                                                                                                                                                                                                               Compensation covers paid drivers/cleaners/conductors for injuries incurred while operating the insured vehicle    1.0     1        True
33  163                            PERSON               TOLL-FREE NUMBER                                                                                                                                                                                                                                                                                                                                                                                                                                                                                                                                                                                                                                                                                                                                                                                                                                                                                                                                                                                                                                                         Individuals or drivers should use the toll-free number to communicate with ICICI Lombard for claims.    5.0     1        True
34  165                            PERSON               CLAIM INTIMATION                                                                                                                                                                                                                                                                                                                                                                                                                                                                                                                                                                                                                                                                                                                                                                                                                                                                                                                                                                                                                                                            Individuals must engage in claim intimation to process their insurance claims with ICICI Lombard.    6.0     1        True
35  166                            PERSON                            FIR                                                                                                                                                                                                                                                                                                                                                                                                                                                                                                                                                                                                                                                                                                                                                                                                                                                                                                                                                                                                                                                       The involved individuals in an accident need to file an FIR for legal acknowledgement of the incident.    6.0     1        True
36  443                            PERSON    MENTALLY CHALLENGED PERSONS                                                                                                                                                                                                                                                                                                                                                                                                                                                                                                                                                                                                                                                                                                                                                                                                                                                                                                                                                                                                                                         Policies may provide coverage for risks affecting mentally challenged persons using the specially designed vehicles.    6.0     1        True
37  444                            PERSON                  BLIND PERSONS                                                                                                                                                                                                                                                                                                                                                                                                                                                                                                                                                                                                                                                                                                                                                                                                                                                                                                                                                                                                                                            Coverage is provided within the policy for risks associated with blind persons using specially modified vehicles.    1.0     1        True
38   70  UNNAMED HIRER/PILLION PASSENGERS        PERSONAL ACCIDENT COVER                                                                                                                                                                                                                                                                                                                                                                                                                                                                                                                                                                                                                                                                                                                                                                                                                                                                                                                                                                                                                                                  Unnamed hirers and pillion passengers are included in the terms of Personal Accident Cover for compensation    1.0     1        True
39  790           PERSONAL ACCIDENT COVER              PILLION PASSENGER                                                                                                                                                                                                                                                                                                                                                                                                                                                                                                                                                                                                                                                                                                                                                                                                                                                                                                                                                                                                                              The Personal Accident Cover is applicable to unnamed pillion passengers for injuries incurred while riding the insured vehicle.    8.0     1        True
40  791                        ANY PERSON        PERSONAL ACCIDENT COVER                                                                                                                                                                                                                                                                                                                                                                                                                                                                                                                                                                                                                                                                                                                                                                                                                                                                                                                                                                                                                                 Any person involved with the insured vehicle is entitled to the Personal Accident Cover for injuries sustained during usage.    1.0     1        True
41   63                            IMT 15     WORKMEN'S COMPENSATION ACT                                                                                                                                                                                                                                                                                                                                                                                                                                                                                                                                                                                                                                                                                                                                                                                                                                                                                                                                                                                                     IMT 15 references the Workmen's Compensation Act, indicating the coverage of those employed and specifies conditions for compensation based on this Act.    4.0     1        True
42  637                       SUM INSURED                       BENEFITS                                                                                                                                                                                                                                                                                                                                                                                                                                                                                                                                                                                                                                                                                                                                                                                                                                                                                                                                                                                                                        The Sum Insured is the financial cap that defines the extent of available Benefits provided to the Insured Person for covered events.    1.0     1        True

===== ENTITIES =====

     id                      entity                                                                                                                                                                                                                                                                                                                                                                                                                                                                                                                                                                                                                                                                                                                                                                                                                                                                                                                                                                                                                                                                                                                                                                                                                                                                                                                                                                                                                                            description number of relationships  in_context
0    76     PERSONAL ACCIDENT COVER                                                                                                                                                                                                                                                                                                                                                                                                                                                                       Personal Accident Cover is an insurance provision designed to offer compensation for bodily injuries incurred by specific individuals linked to the insured vehicle, adhering to the particular conditions delineated in the policy. This coverage primarily focuses on providing financial support to those who sustain injuries while operating or riding in the insured vehicle.\n\nThe coverage applies to the insured individual, which may include the owner-driver and potentially other designated passengers within the vehicle at the time of the accident. It encompasses a range of benefits aimed at addressing the repercussions of accidents that result in bodily harm. \n\nOverall, Personal Accident Cover serves as an essential safety net for policyholders, ensuring that they receive assistance in the event of personal injuries sustained during vehicle-related incidents, depending on the terms outlined within their individual policy agreements.                       7        True
1   387          COMPENSATION LIMIT                                                                                                                                                                                                                                                                                                                                                                                                                                                                                                                                                                                                                                                                                                                                                                                                                                                                                                                                                                                                                                                                                                                                                                                                                                                                                                            Compensation limit refers to the maximum amount an insurer is liable to pay for injuries or damages, as stipulated in the policy.)(""entity""                       1        True
2    81   CAPITAL SUM INSURED (CSI)                                                                                                                                                                                                                                                                                                                                                                                                                                                                                                                                                                                                                                                                                                                                                                                                                                                                                                                                                                                                                                                                                                                                                                                                                                                                                                             Capital Sum Insured (CSI) is the maximum liability of the insurer for a covered individual per incident, detailed in the insurance policy.                       1        True
3   562                       LIMBS                                                                                                                                                                                                                                                                                                                                                                                                                                                                                                                                                                                                                                                                                                                                                                                                                                                                                                                                                                                                                                                                                                                                                                                                                                                                                                                     Refers to physical extremities of the body whose loss or injury qualifies for compensation under the scale provided in the policy.                       1        True
4   224                 SUM INSURED                                                                                                                                                                                                                                                                                                                                                                                                                                       The term ""Sum Insured"" pertains to the maximum compensation limit established within an insurance policy, which specifies the benefits payable to the insured individual. This concept is fundamental in insurance coverage, as it establishes the upper threshold of financial protection offered to the policyholder. Specifically, the Sum Insured serves as a crucial factor in determining the payouts in the event of a claim.\n\nIn the context of vehicle insurance, Sum Insured denotes the highest amount that an insurer is willing to pay in the event of loss or damage to the insured vehicle as outlined in the policy. This ensures that the policyholder understands the extent of their coverage and the potential financial support they can expect should they experience a qualifying incident.\n\nOverall, the Sum Insured serves as a pivotal element in both general and vehicle insurance, guiding the financial commitments of the insurer and the expectations of the insured person.                       1        True
5   509     PAYMENT OF COMPENSATION                                                                                                                                                                                                                                                                                                                                                                                                                                                                                                                                                                                                                                                                                                                                                                                                                                                                                                                                                                                                                                                                                                                                                                                                                                                                         The process by which financial reimbursement is provided to the Insured Person for claims concerning injuries, illnesses, or disabilities as outlined in the insurance policy.                       1        True
6   384                 DISABLEMENT                                                                                                                                                                                                                                                                                                                                                                                                                                                                                                                                                                                                                                                                                                                                                                                                                                                                                                                                                                                                                                                                                                                                                                                                                                                                                                         Permanent total disablement refers to serious injuries resulting in the inability to work, triggering compensation under the insurance policy.                       1        True
7    16                COMPENSATION  Compensation is defined as the financial payment made by the Company, or insurer, for losses or damages incurred by the Insured under the terms of an insurance policy. It encompasses several scenarios, primarily focused on injuries sustained by individuals, including drivers and passengers involved in vehicle incidents. \n\nThe primary function of Compensation is to provide financial indemnity to those affected by accidents, which may involve bodily injury, property damage, or even death. This compensation serves to alleviate the financial burden faced by injured persons or their legal representatives as dictated by the specific guidelines laid out in the insurance policy.\n\nCompensation not only targets personal injuries sustained during vehicular accidents but also extends to cover legal liabilities for injuries incurred by employees operating motor vehicles in the course of their duties. The payments made by the insurer aim to fulfill the obligations of the policy, ensuring that the Insured Person or their representatives receive appropriate financial restitution for losses suffered due to various incidents.\n\nIn summary, Compensation is a broad term that applies to payments made by the insurer in response to claims filed under insurance policies, providing essential support for individuals facing financial strain resulting from injuries or damage incurred in accidents.                      10        True
8   482                 EXTENSION 5                                                                                                                                                                                                                                                                                                                                                                                                                                                                                                                                           Extension 5 is a specific provision that caters to the benefits associated with Permanent Partial Disablement for the Insured Person under the policy. This extension outlines the financial support and advantages accessible to individuals who qualify for coverage due to partial disability resulting from covered events. Furthermore, Extension 5 stipulates the sum insured applicable for claims made under particular circumstances related to the Insured Person. Thus, it provides clarity on the fiscal limits and conditions under which claims can be filed, ensuring that the Insured Person understands their entitlements and the associated coverage they possess in the event of a qualifying incident. Overall, Extension 5 serves to enhance the policy by clearly delineating benefits and financial protections available to the Insured Person facing permanent partial disability.                       2        True
9   481                 EXTENSION 4                                                                                                                                                                                                                                                                                                                                                                                                                                                                                                                                                                                                                                                                                                                                                                                                                                                                                                                                                                                                                                                                                                                                                                                                                                                                                                                                 Extension 4 details benefits for Permanent Total Disablement as part of the insurance coverage for the Insured Person.                       1        True
10  492                   BENEFIT 5                                                                                                                                                                                                                                                                                                                                                                                                                                                                                                                                      Benefit 5 is a provision that delineates the Company’s maximum liability concerning hospitalization for an Insured Person. It explicitly specifies the limits of coverage applicable to days of hospital confinement. Additionally, Benefit 5 encompasses the Accidental Hospital Confinement Allowance, which stipulates that the Insured Person will receive daily payments during hospitalization specifically due to injuries sustained from accidents. This benefit ensures financial support for individuals confined to a hospital as a direct result of accidental injuries, reinforcing the Company’s commitment to providing adequate coverage for medical needs arising from such incidents. The dual focus of Benefit 5 on liability limitations and financial assistance highlights its importance in safeguarding the health and well-being of insured individuals during unforeseen circumstances.                       1        True
11  257  EMERGENCY MEDICAL EXPENSES                                                                                                                                                                                                                                                                                                                                                                                                                                                                                                                                                                                                                                                                                                                                                                                                                                                                                                                                                                                                                                                                                                                                                                                                                                                                                                                        Expenses incurred for treatment of bodily injuries sustained by the Insured Person and/or occupants in relation to an accident.                       2        True
12  379                      PERSON                                                                                                                                                                                                                                                                                                                                                                                                                                                                                                                                                                                                                                                                                                                        The term ""PERSON"" refers to individuals who are entitled to compensation for injuries resulting from vehicle incidents. While the descriptions indicate that the discussions involve references to these individuals, no specific names are provided in the text. The coverage includes any named individual who may be insured under the relevant policy. This specifically encompasses those who have been affected by personal accidents related to the vehicle in question. In summary, the entity ""PERSON"" is associated with unnamed individuals eligible for injury compensation in the context of vehicle-related accidents, emphasizing the importance of coverage for all insured parties involved in such incidents.                      10        True
13  259             AMBULANCE COVER                                                                                                                                                                                                                                                                                                                                                                                                                                                                                                                                                                                                                                                                                                                                                                                                                                                                                                                                                                                                                                                                                                                                                                                                                                                                                                                             A benefit under the insurance policy for arranging and reimbursing transportation to a medical facility after an accident.                       1        True
14   73                      IMT 15                                                                                                                                                                             IMT 15 is a specific insurance policy that delineates the conditions under which personal accident coverage is applicable for the insured individuals. This coverage is activated during several scenarios, including the mounting and dismounting from the insured vehicle as well as while traveling in it. The policy is designed to offer protection to the insured or named individuals specified in the policy, ensuring they receive personal accident cover in the outlined situations.\n\nHowever, it is important to note that this coverage specifically excludes paid drivers or cleaners. This means that while the insured and other named persons are protected under IMT 15, any professional drivers or individuals employed to clean the vehicle do not qualify for this personal accident coverage. The conditions set forth in IMT 15 serve to clarify the scope and limitations of the insurance protection provided to individuals against personal accidents related to the insured vehicle. \n\nIn summary, IMT 15 details the personal accident coverage available for named insured persons while engaging with the vehicle, specifically during mounting, dismounting, and travel, but it does not extend coverage to paid drivers or cleaners.                       2        True
15  218                   FRANCHISE                                                                                                                                                                                                                                                                                                                                                                                                                                                                                                                                                                                                                                                                                                                                                                                                                                                                                                                                                                                                                                                                                                                                                                                                                                                                                                                                                A minimum amount of loss that must be incurred before insurance coverage applies under certain benefits                       1        True
16  398                   SECTION I                                                                                                                                                                                                                                                                                                                                                                                                                                                                                                                                                                                                                                                                                                                                                                                                                                                                                                                                                                                                                                                                                                                                                                                                                                                                                                                            Section I of the policy details the terms and conditions regarding the coverage for damages or loss to the insured vehicle.                       1        True

===== SOURCES =====

   id                                                                                                                                                                                                                                                                                                                                                                                                                                                                                                                                                                                                                                                                                                                                                                                                                                                                                                                                                                                                                                                                                                                                                                                                                                                                                                                                                                                                                                                                                                                                                                                                                                                                                                                                                                                                                                                                                                                                                                                                                                                                                                                                                                                                                                                                                                                                                                                                                                                                                                                                                                                                                                                                                                                                                                                                                                                                                                                                                                                                                                                                                                                                                                                                                                                                                                                                                                                                                                                                                                                                                                                                                                                                                                                                                                                                                                                                                                                                                                                                                                                                                                                                                                                                                                                                                                                                                                                                                                                                                                                                                                                                                                                                                                                                                                                                                                                                                                                                                                                                                                                                                                                                                                                                                                                                                                                                                                                                                                                                                                                                                                                                                                                                                                                                                                                                                                                                                                                                                                                                                                                                                                                       text
0   9                                                                                                                                                                                                                                                                                                                     ... ** persons/passengers are in the\n     vehicle insured at the time of occurrence of such injury.\nSubject otherwise to the terms exceptions conditions and\nlimitations of this policy.\n* The Capital Sum Insured (CSI) per passenger is to be inserted.\n** The registered sitting capacity of the vehicle insured is to be\ninserted.\n\n17.  IMT. 17. PERSONAL ACCIDENT COVER TO PAID\nDRIVERS, CLEANERS AND CONDUCTORS: (Applicable to all\nclasses of vehicles)\n\nIn consideration of the payment of an additional premium, it is\nhereby understood and agreed that the insurer undertakes to\npay compensation on the scale provided below for bodily injury\nas hereinafter deﬁned sustained by the paid driver/\ncleaner/conductor in the employ of the insured in direct\nconnection with the vehicle insured whilst mounting into\ndismounting from or traveling in the insured vehicle and caused\nby violent accidental external and visible means which\nindependently of any other cause shall within six calendar\nmonths of the occurrence of such injury result in :\n Nature of injury                          Scale of\n                              CompensaƟon\n (I)  Death                         100%\n (ii) Loss of two limbs or sight of two       100%\n    eyes or one limb and sight of one eye\n  (iii) Loss of one limb or sight of one eye     50%\n (iv) Permanent total disablement from     100%\n     injuries other than named above\n\nProvided always that\nI.   Compensation shall be payable under only one of the items\n       (I) to (iv) above in respect of any such person arising out of\n    any one occurrence and total liability of the insurer shall not\n     in the aggregate exceed the sum of `____* during any one\n    period of insurance in respect of any such person.\nII.  No compensation shall be payable in respect of death or\n     injury directly or indirectly wholly or in part arising or\n     resulting from or traceable to\n     (a) intentional self injury suicide or attempted suicide\n        physical defect or inﬁrmity or (b) an accident\n       happening whilst such person is under the inﬂuence of\n         intoxicating liquor or drugs.\nIII.  Such compensation shall be payable only with the\n    approval of the insured named in the policy and directly to\n    the injured person or his/ her legal representative(s) whose\n     receipt shall be a full discharge in respect of the injury of\n    such person.\nSubject otherwise to the terms exceptions conditions and\nlimitations of this policy.\n* The Capital Sum Insured (CSI) per person is to be inserted.\n18. IMT. 18. PERSONAL ACCIDENT TO UNNAMED HIRER\nAND UNNAMED PILLION PASSENGERS (Applicable to\nMotorised Two wheelers with or without side Car)\nIn consideration of the payment of an additional premium it is\nhereby understood and agreed that the insurer undertakes to\npay compensation to any unnamed hirer/driver/any unnamed\npillion/sidecar passenger* on the scale provided below for\nbodily injury caused by violent, accidental, external and visible\nmeans whilst mounting into/onto and/or dismounting from or\ntraveling in/on the vehicle insured which independently of any\nother cause shall within three calendar months of the\noccurrence of such injury results in :\n\n Nature of injury                          Scale of\n                              CompensaƟon\n (I)  Death                         100%\n (ii) Loss of two limbs or sight of two       100%\n    eyes or one limb and sight of one eye\n  (iii) Loss of one limb or sight of one eye     50%\n (iv) Permanent total disablement from     100%\n     injuries other than named above\nProvided always that:\nI.   Compensation shall be payable under only one of the items\n        (i) to (iv) above in respect of any such person arising out of\n    any one occurrence and total liability of the insurer shall not\n     in the aggregate exceed the sum of `______** during any\n    one period of insurance in respect of any such person.\nII.  No compensation shall be payable in respect of death or\n     injury directly or indirectly wholly or in part arising or\n     resulting from or traceable to (a) intentional self injury\n     suicide or attempted suicide physical defect or inﬁrmity or\n     (b) an accident happening whilst such person is under the\n    inﬂuence of intoxicating liquor or drugs.\nIII.  Such compensation shall be payable only with the\n    approval of the insured named in the policy and directly to\n     the injured person or his/her legal representative(s) whose\n     receipt shall be a full discharge in respect of the injury of\n    such person.\nIV.  Not more than ...................... persons/passengers are in the\n     vehicle insured at the time of occurrence of such injury.\nSubject otherwise to the terms exceptions conditions and\nlimitations of this policy.\n* Delete if P.A. cover for unnamed pillion/side car passenger is\nnot taken.\n** The Capital Sum Insured (CSI) per passenger is to be inserted.\n19.  IMT. 19. COVER FOR VEHICLES IMPORTED WITHOUT\nCUSTOMS DUTY\nNotwithstanding anything to the contrary contained in this\npolicy it is hereby understood and agreed that in the event of\nloss or damage to the vehicle insured and/or its accessories\nnecessitating the supply of a part not obtainable from stocks\nheld in the country in which the vehicle insured is held for repair\nor in the event of the insurer exercising the option under\n...................... * to pay in cash the amount of the loss or damage the\nliability of the insurer in respect of any such part shall
1   8                                                                                                                                                                                                                                                                                                             Vehicles)\nIt is hereby understood and agreed that the insurer shall not be\nliable in respect of the vehicle insured while it is being used\nelsewhere than on site to which the public have no general right\nof access and the vehicle is not required to be registered under\nthe Motor Vehicles Act, 1988.\n15.  IMT. 15. PERSONAL ACCIDENT COVER TO THE INSURED\nOR ANY NAMED PERSON OTHER THAN PAID DRIVER OR\nCLEANER (Applicable to private cars including three wheelers\nrated as private cars and motorized two wheelers with or\nwithout side car [not for hire or reward)\n\nIn consideration of the payment of an additional premium it is\nhereby agreed and understood that the Company undertakes to\npay compensation on the scale provided below for bodily injury\nas hereinafter deﬁned sustained by the insured person in direct\nconnection with the vehicle insured or whilst mounting and\ndismounting from or traveling in vehicle insured and caused by\nviolent accidental external and visible means which\nindependently of any other cause shall within six calendar\nmonths of the occurrence of such injury result in:-\n\n Nature of injury                          Scale of\n                              CompensaƟon\n (I)  Death                         100%\n (ii) Loss of two limbs or sight of two       100%\n    eyes or one limb and sight of one eye\n  (iii) Loss of one limb or sight of one eye     50%\n (iv) Permanent total disablement from     100%\n     injuries other than named above\n\nProvided always that\n\nI.    Compensation shall be payable under only one of the\n     items (i) to (iv) above in respect of any such person arising\n     out of any one occurrence and total liability of the insurer\n      shall not in the aggregate exceed the sum of `.......* during\n     any one period of insurance in respect of any such person.\n\nII.   No compensation shall be payable in respect of death or\n      injury directly or indirectly wholly or in part arising or\n      resulting from or traceable to (a) intentional self injury\n      suicide or attempted suicide physical defect or inﬁrmity or\n      (b) an accident happening whilst such person is under the\n     inﬂuence of intoxicating liquor or drugs.\n\nIII.   Such compensation shall be payable only with the\n     approval of the insured named in the policy and directly to\n     the injured person or his/her legal representative(s) whose\n      receipt shall be a full discharge in respect of the injury of\n     such person.\n\nSubject otherwise to the terms exceptions conditions and\nlimitations of this policy.\n\n* The Capital Sum Insured (CSI) per passenger is to be inserted.\n\n16.  IMT. 16. PERSONAL ACCIDENT TO UNNAMED\nPASSENGERS OTHER THAN INSURED AND THE PAID\nDRIVER AND CLEANER (For vehicles rated as Private cars\nand Motorised two wheelers (not for hire or reward) with or\nwithout side car)\n\nIn consideration of the payment of an additional premium it is\nhereby understood and agreed that the insurer undertakes to\npay compensation on the scale provided below for bodily\ninjuries hereinafter deﬁned sustained by any passenger other\nthan the insured and/or the paid driver attendant or cleaner\nand/or a person in the employ of the insured coming within the\nscope of the Workmen’ Compensation Act, 1923 and\nsubsequent amendments of the said Act and engaged in and\nupon the service of the insured at the time such injury is\nsustained whilst mounting into, dismounting from or traveling in\nthe insured motor car and caused by violent, accidental,\nexternal and visible means which independently of any other\ncause shall within three calendar months of the occurrence of\nsuch injury result in :\n\n    Nature of injury                          Scale of\n                                 CompensaƟon\n        (I)  Death                         100%\n        (ii) Loss of two limbs or sight of two       100%\n       eyes or one limb and sight of one eye\n        (iii) Loss of one limb or sight of one eye     50%\n      (iv) Permanent total disablement from     100%\n         injuries other than named above\n\nProvided always that:-\nI.   Compensation shall be payable under only one of the items\n        (i) to (iv) above in respect of any such person arising out of\n    any one occurrence and total liability of the insurer shall not\n     in the aggregate exceed the sum of `____* during any one\n     period of insurance in respect of any such person.\nII.  No compensation shall be payable in respect of death or\n     injury directly or indirectly wholly or in part arising or\n     resulting from or traceable to (a) intentional self injury\n     suicide or attempted suicide physical defect or inﬁrmity or\n     (b) an accident happening whilst such person is under the\n    inﬂuence of intoxicating liquor or drugs.\nIII.  Such compensation shall be payable only with the\n    approval of the insured named in the policy and directly to\n     the injured person or his/her legal representative(s) whose\n     receipt shall be a full discharge in respect of the injury of\n    such person.\nIV.  Not more than................... ** persons/passengers are in the\n     vehicle insured at the time of occurrence of such injury.\nSubject otherwise to the terms exceptions conditions and\nlimitations of this policy.\n* The Capital Sum Insured (CSI) per passenger is to be inserted.\n** The registered sitting capacity of the vehicle insured is to be\ninserted.\n\n17.  IMT. 17. PERSONAL ACCIDENT COVER TO PAID\nDRIVERS, CLEANERS AND CONDUCTORS: (Applicable to all\nclasses
2  57                                                                                                                                                                                                          EMENT\n       It  is hereby understood and agreed that (hereinafter\n    referred to as the Lessors) are the Owners of the vehicle\n    insured and that the vehicle insured is the subject of a Lease\n    Agreement made between the Lessor on the one part and\n    the insured on the other part and it is further understood\n   and agreed that the Lessors are interested in any monies\n    which but for this Endorsement would be payable to the\n    insured under this policy in respect of such loss or damage\n    to the vehicle insured as cannot be made good by repair\n    and/or replacement of parts and such monies shall be\n    paid to the Lessors as long as they are the Owners of the\n    vehicle insured and their receipt shall be a full and final\n    discharge to the insurer in respect of such loss or damage.\n       It is also understood and agreed that notwithstanding any\n    provision in the Leasing Agreement to the contrary, this\n    policy is issued to the insured namely  as the principal\n    party and not as agent or trustee and nothing herein\n    contained shall be construed as constituting the insured\n   an agent or trustee for the Lessors or as an assignment\n    (whether legal or equitable) by the insured to the Lessors,\n    of his rights benefits and claims under this policy and\n    further nothing herein shall be construed as creating or\n    vesting any right in the Owner/Lessor to sue the insurer\n     in any capacity whatsoever for any alleged breach of its\n    obligations hereunder.\n       It is further declared and agreed that for the purpose\n    of the Personal Accident Cover  for the owner-driver\n    granted under this policy, the insured named in the policy\n     will continue to be deemed as the owner-driver subject\n    to compliance of provisions of the policy relating to this\n    cover.\n   Save as by this Endorsement expressly agreed nothing\n    herein shall modify or affect the rights and liabilities of the\n    insured or the insurer respectively under or in connection\n    with this Policy. Subject otherwise to the terms exceptions\n    conditions and limitations of this policy.\n7.  IMT. 7. Vehicles subject to Hypothecation Agreement\n       It is hereby declared and agreed that the vehicle insured\n     is pledged to/hypothecated with. (hereinafter referred to\n    as the Pledgee) and it is further understood and agreed\n    that the Pledgee is interested in any monies which but\n     for this Endorsement would be payable to the insured\n    under this policy in respect of such loss or damage to the\n    vehicle insured as cannot be made good by repair and/\n    or replacement of parts and such monies shall be paid to\n    the Pledgee as long as they are the Pledgee of the vehicle\n    insured and their receipt shall be a full and final discharge\n    to the insurer in respect of such loss or damage.\n       It is further declared and agreed that for the purpose\n    of the Personal Accident Cover  for the owner-driver\n    granted under this policy, the insured named in the policy\n     will continue to be deemed as the owner-driver subject\n    to compliance of provisions of the policy relating to this\n    cover.\n   Save as by this Endorsement expressly agreed that nothing\n    herein shall modify or affect the rights or liabilities of the\n    Insured or the Insurer respectively under or in connection\n    with this Policy or any term, provision or condition thereof.\n    Subject otherwise to the terms exceptions conditions and\n     limitations of this policy.\n8.  IMT. 8. DISCOUNT FOR MEMBERSHIP OF RECOGNISED\n   AUTOMOBILE ASSOCIATIONS (PRIVATE CARS AND\n   MOTORISED TWO WHEELERS ONLY)\n       It is hereby understood and agreed that in consideration\n    of insured’s membership of ......** a discount in premium\n    of `............* is allowed to the insured hereunder from\n         ...  /...  /....... It is further understood and agreed that if the\n    insured ceases to be a member of the above mentioned\n    association during the currency of this Policy the insured\n     shall immediately notify the insurer accordingly and refund\n    to the insurer a proportionate amount of the discount\n    allowed on this account for the unexpired period of the\n    cover.\n    Subject otherwise to the terms exceptions conditions and\n     limitations of the policy\n    *For full policy period, the full tariff discount to be inserted.\n    For mid-term membership, prorata proportion of the tariff\n    discount for the unexpired policy period is to be inserted.\n     **Insert name of the concerned Automobile Association.\n9.  IMT. 9. DISCOUNT FOR VINTAGE CARS (Applicable to\n    Private Cars only)\n       It is hereby understood and agreed that in consideration\n    of the insured car having been certified as a Vintage Car\n    by the Vintage and Classic Car Club of India, a discount\n    of ` ......................* is allowed to the insured from ......../.........\n         /...........\n    Subject otherwise to the terms exceptions conditions and\n     limitations of the policy\n   *Amount  calculated as per  tariff  provision  is  to be\n     inserted. For mid-term certification as Vintage Car pro-\n    rata proportion of tariff discount for the unexpired period\n     is to be inserted.\n10. IMT. 10. INSTALLATION OF ANTI-THEFT DEVICE (Not\n    applicable to Motor Trade Policies)\n     In consideration of certification by *that an Anti-Theft\n    device approved by Automobile Research Association\n    of India (ARAI), Pune has been installed  in the  vehicle\n    insured  herein a premium  discount  of `............** is\n    hereby
3  61   compensation shall be payable only with the\n        approval of the insured named in the policy and directly\n         to the injured person or his/her legal representative(s)\n       whose receipt shall be a full discharge in respect of\n        the injury of such person.\n        Subject otherwise to the terms exceptions conditions\n       and limitations of this policy.\n       *The Capital Sum Insured (CSI) per person is to be\n         inserted.\n17. IMT. 18. PERSONAL ACCIDENT TO UNNAMED HIRER\n   AND UNNAMED PILLION PASSENGERS (Applicable to\n    Motorised Two wheelers with or without side Car)\n     In consideration of the payment of an additional premium\n       it  is hereby understood and agreed that the insurer\n    undertakes to pay compensation to any unnamed hirer/\n    driver/any unnamed  pillion/sidecar passenger* on the\n    scale provided below for bodily injury caused by violent,\n    accidental, external and visible means whilst mounting\n    into/onto and/or dismounting from or traveling in/on the\n    vehicle insured which independently of any other cause\n     shall within three calendar months of the occurrence of\n    such injury results in:\n\n                                         Scale of    Nature of injury                                     Compensation\n        (i) Death                     100%\n         (ii) Loss of two limbs or sight of two\n       eyes or one Limb and sight of one   100%\n        eye.\n         (iii) Loss of one limb or sight of one eye 50%\n       (iv) Permanent total disablement from                               100%          injuries other than named above.\n\n    Provided always that:\n        I.   Compensation shall be payable under only one of the\n        items (i) to (iv) above in respect of any such person\n         arising out of any one occurrence and total liability of\n        the insurer shall not in the aggregate exceed the sum\n         of `............** during any one period of insurance in\n        respect of any such person.\n        II.  No compensation shall be payable in respect of death\n         or injury directly or indirectly wholly or in part arising\n         or resulting from or traceable to (a) intentional self\n         injury suicide or attempted suicide physical defect\n         or infirmity or (b) an accident happening whilst such\n        person is under the influence of intoxicating liquor or\n        drugs.\n        III.  Such compensation shall be payable only with the\n        approval of the insured named in the policy and directly\n         to the injured person or his/her legal representative(s)\n       whose receipt shall be a full discharge in respect of\n        the injury of such person.\n     IV.  Not more than persons/passengers are in the vehicle\n        insured at the time of occurrence of such injury.\n        Subject otherwise to the terms exceptions conditions\n       and limitations of this policy.\n        *Delete  if P.A. cover for unnamed pillion/side car\n       passenger is not taken.\n        **The Capital Sum Insured (CSI) per passenger is to\n       be inserted.\n18. IMT. 19. COVER FOR VEHICLES IMPORTED WITHOUT\n   CUSTOMS DUTY\n    Notwithstanding anything  to  the  contrary contained\n     in this policy it is hereby understood and agreed that in\n    the event of loss or damage to the vehicle insured and/\n    or its accessories necessitating the supply of a part not\n    obtainable from stocks held in the country in which the\n    vehicle insured is held for repair or in the event of the\n    insurer exercising the option under, * to pay in cash the\n   amount of the loss or damage the liability of the insurer in\n    respect of any such part shall be limited to :-\n        I.   a)  The price quoted in the latest catalogue or the\n             price list issued by the Manufacturer or his Agent\n              for the country in which the vehicle insured is\n            held for repair less depreciation applicable; OR\n         b)    If no such catalogue or price list exists the price\n                  list obtaining at the Manufacturer’s Works plus\n            the reasonable cost of transport otherwise than\n           by air to the country in which the vehicle insured\n                is held for repair and the amount of the relative\n            import duty less depreciation applicable under\n            the Policy; and\n        II.  The reasonable cost of fitting such parts.\n        Subject otherwise to the terms conditions limitations\n       and exceptions of this Policy.\n         *Insert ‘Condition 3’ in the case of the Private Car and\n        Motorsied Two Wheeler Policies and ‘Condition 4’ in\n        the case of Commercial Vehicles Policy.\n19. IMT. 20. REDUCTION IN THE LIMIT OF LIABILITY FOR\n   PROPERTY DAMAGE\n       It is hereby understood and agreed that notwithstanding\n    anything to the contrary contained  in the policy the\n    insurers liability is limited to ` 6000/- (Rupees six thousand\n    only) for damage to property other than the property\n    belonging to the insured or held in trust or in custody or\n    control of the insured. In consideration of this reduction in\n    the limit of liability a reduction in premium of `............*\n     is hereby made to the insured. Subject otherwise to the\n    terms conditions limitations and exceptions of the policy.\n    *To insert ` 100 for Private car, Per year\n20. IMT. 21. SPECIAL EXCLUSIONS AND COMPULSORY\n   DEDUCTIBLE (Applicable to  all Commercial Vehicles\n    excluding taxis and motorized two wheelers carrying\n    passengers for hire or reward.)\n    Notwithstanding anything  to  the  contrary contained\n    herein it is hereby understood and agreed that\n        I.   Special Exclusions Except in the case of Total Loss\n         of the vehicle insured, the insurer","To determine the compensation amount for the loss of one limb or sight of one eye under the Personal Accident Cover, we can follow a straightforward calculation based on the provided Capital Sum Insured.

### Given Data
- **Capital Sum Insured (CSI)**: ₹15 lakh (or ₹1,500,000)
- **Percentage for loss of one limb or sight of one eye**: 50%

### Calculation Steps
1. **Calculate 50% of the Capital Sum Insured**:
   \[
   \text{Compensation} = \text{CSI} \times \left(\frac{50}{100}\right) = ₹15,00,000 \times 0.50
   \]

2. **Perform the calculation**:
   \[
   \text{Compensation} = ₹15,00,000 \times 0.50 = ₹7,50,000
   \]

### Final Result
The insured would receive a compensation of **₹7,50,000** for the loss of one limb or sight of one eye.",5980.78,,,
"If the Capital Sum Insured is ₹15 lakh and the insured suffers permanent total disablement, which is compensated at 100%, how much compensation would be payable? Show the calculation.","Compensation = 100% × ₹15,00,000 = ₹15,00,000. Therefore, the insurer would pay ₹15,00,000.",,"===== REPORTS =====

  id                                     title                                                                                                                                                                                                                                                                                                                                                                                                                                                                                                                                                                                                                                                                                                                                                                                                                                                                                                                                                                                                                                                                                                                                                                                                                                                                                                                                                                                                                                                                                                                                                                                                                                                                                                                                                                                                                                                                                                                                                                                                                                                                                                                                                                                                                                                                                                                                                                                                                                                                                                                                                                                                                                                                                                                                                                                                                                                                                                                                                                                                                                                                                                                                                                                                                                                                                                                                                                                                                                                                                                                                                                                                                                                                                                                                                                                                                                                                                                                                                                                                                                                                                                                                                                                                                                                                                                                                                                                                                                                                                                                                                                                                                                                                                                                                                                                                                                                                                                                                                                                                                                                                                                                                                                                                                                                                                                                                                                                                                                                                                                                                                                                                                                                                                                                                         content
0  0  Motor Vehicle Insurance Community Report  # Motor Vehicle Insurance Community Report\n\nThe report encompasses the interrelated entities forming the Motor Vehicle Insurance community, including various aspects such as vehicle coverage, compensation mechanisms, and documentation required for claims. The entities are connected through insurance policies that dictate the terms under which risks are covered and claims can be processed, highlighting both legal and operational frameworks in motor insurance.\n\n## Vehicle Coverage under Insurance Policies.\n\nThe primary entity, Vehicle Insured, denotes any automobile covered under an insurance policy, safeguarding against risks associated with accidents and damages. Insurance policies can vary widely, stipulating individual terms and conditions including premium payments and coverage limits, which create a structured approach for compensating policyholders in case of incidents. The relationships indicate that each vehicle insured is linked to an insurer that evaluates the risks before issuing a policy, emphasizing the importance of thorough risk assessment in this community [Data: Entities (82); Relationships (469)].\n\n## Importance of Compensation Mechanisms.\n\nThe community utilizes a structured compensation framework that outlines financial payments for losses arising from vehicular incidents. The Compensation entity encapsulates payments for bodily injuries, damages, and legal liabilities that may occur with insured vehicles, providing essential financial support to affected parties. This mechanism ensures that victims of accidents are reimbursed, thus enforcing a balance between operational safety and financial responsibility, underlined by explicit claims provisions within insurance policies [Data: Entities (16, 72); Relationships (410)].\n\n## Diverse Types of Insurance Claims.\n\nClaims in this community can stem from various events, including bodily injury, vehicle damage, and even incidents leading to death. Each type of claim is governed by specific guidelines defined in insurance policies, influencing how claimants can seek financial restitution. As highlighted, the need for supporting documents such as Medical Certificates and Disability Certificates underlines the rigorous substantiation needed for each type of insurance claim, promoting responsible and fair processing of claims amidst diverse circumstances [Data: Entities (23, 359, 685); Relationships (393, 409)].\n\n## Role of Alternative Fuel Technologies.\n\nThe inclusion of equipment like the CNG/LPG Kit in insured vehicles introduces an environmentally friendly dimension to the community. Policies extending coverage to such kits further highlight the increased emphasis on sustainable practices within vehicular insurance. This aspect caters to a growing segment of vehicle owners who prioritize cleaner fuel options, thus expanding the insurance landscape to adapt to ecological concerns while ensuring adequate coverage against potential damages [Data: Entities (95); Relationships (91)].\n\n## Legal and Regulatory Compliance.\n\nThe interplay between various entities such as insurance policies and national standards showcases the legal framework safeguarding motor vehicle insurance practices. The stipulations defined under the policies ensure compliance with relevant legislative requirements, including those related to the Ministry of Defence, ensuring protection for drivers employed in contexts that involve state support. This relationship underscores the necessity for insurers to align with regulatory bodies, thus reinforcing accountability and legal adherence to best practices in insurance [Data: Entities (86); Relationships (112)].\n\n## Documentation Challenges in Claim Processing.\n\nThe efficiency of claim processing is heavily reliant on the submission of complete and accurate documentation, as outlined in claims protocols. Instances of missing documents can significantly delay the approval of claims, emphasizing the importance of thoroughness in the claims process. The requirement for items such as PAN Cards, NEFT Mandate Forms, and Treatment Papers further complicates the landscape, where claimant compliance directly influences claim outcomes [Data: Entities (517, 700); Relationships (696, 684)].\n\n## Impact of Violent Accidents.\n\nViolent Accidents, defined as incidents resulting in bodily injury or death due to clear external causes, trigger specific discussions around insurance compensation. The community must account for these incidents distinctly, given their serious implications for policyholders. The insurance policies incorporated often include stipulations that outline how such cases are managed financially, which is crucial for maintaining public trust and ensuring that obligations are met promptly in dire situations [Data: Entities (354); Relationships (377)].\n\n## Interconnection with the Motor Trade.\n\nEntities involved in the Motor Trade, including dealers and service providers, interact closely with the motor vehicle insurance community by facilitating purchases and servicing of insured vehicles. This interrelationship enhances the overall value of motor vehicle insurance, as service providers ensure that vehicles remain compliant and functional under the respective insurance policies. Furthermore, the alignment of motor vehicle insurance with industry trends in vehicle sales and repairs plays a pivotal role in maintaining competitive and responsive market conditions [Data: Entities (133, 141); Relationships (152)].
1  4         ICICI Lombard Insurance Community                                                                                                                                                                                                                                                                                                                                                                                                                                                                                                                                                                                                                                                                                                                                                                                                                                                                                                                                                                                                                                                                                                                                                                                                                   # ICICI Lombard Insurance Community\n\nThe ICICI Lombard Insurance community encompasses various entities that are deeply interconnected through insurance policies and coverage provisions. Primary entities include the Insured Person, ICICI Lombard General Insurance Company, hospitals, and various benefit extensions such as Daily Cash and Ambulance Cover. The community functions with contractual relationships and obligations, where the insured individuals maintain rights and responsibilities under their policies, which are crucial in ensuring proper insurance coverage and claims processing.\n\n## Critical Role of Insured Persons\n\nInsured Persons are at the core of the ICICI Lombard Insurance community, representing individuals who are covered under insurance policies. These individuals have the right to claim benefits for a range of medical expenses, including hospitalization and ambulance services due to accidents. Under the insurance policy, the Insured Person also has the responsibility to report any claims or changes in their risk profile to the company to maintain coverage validity. This relationship defines the fundamental purpose of insurance: to provide financial security during unforeseen medical incidents [Data: Entities (212); Relationships (230, 617)].\n\n## Significance of ICICI Lombard General Insurance Company\n\nICICI Lombard General Insurance Company is the main entity providing insurance coverage to the Insured Persons within this community. As a prominent provider in India, the company outlines specific terms in insurance policies, enabling Insured Persons to receive financial protection against medical expenses and accidents. The company facilitates the claims process, which is essential for ensuring that the Insured Persons can navigate their recovery and financial obligations effectively following incidents covered under the policy [Data: Entities (466); Relationships (617)].\n\n## Role of Hospitals in Healthcare Access\n\nHospitals are vital in the ICICI Lombard community as they are the institutions where Insured Persons receive treatment following accidents or medical emergencies. The relationship between hospitals and Insured Persons is founded on the need for medical care and the need to process insurance claims for hospitalization. The involvement of hospitals underscores the importance of complying with quality standards and regulations outlined in the Clinical Establishments Act, which ensures trust in the healthcare provision within the community [Data: Entities (173); Relationships (223)].\n\n## Hospitalization Benefits and Coverage\n\nHospitalization is a critical aspect for Insured Persons, as it triggers various claims to be filed with ICICI Lombard for financial support against medical expenses incurred during inpatient care. Provisions such as Hospital Daily Cash and Post-Hospitalization Medical Expenses reflect the need for comprehensive coverage, offering financial relief to Insured Persons during their recovery phase. These aspects of the policy are designed to alleviate the economic burden of medical care following unexpected accidents [Data: Entities (496, 258); Relationships (286, 677)].\n\n## Claim Procedures and Documentation\n\nThe community is structured around explicit procedures that Insured Persons must follow to successfully submit insurance claims. This includes filling out the Claim Form and adhering to the Claim Procedure, necessary for processing requests for reimbursement of medical expenses. A clear understanding and compliance with these protocols are crucial for effective claims management, ensuring that Insured Persons receive timely financial support for their medical needs arising from accidents [Data: Entities (153, 598); Relationships (167)].\n\n## Implications of Cancellations and Fraudulent Claims\n\nThe cancellation of policies and the presence of fraudulent claims represent critical challenges within the ICICI Lombard community. Fraudulent claims can lead to penalties and a forfeiture of benefits under an insurance policy, emphasizing the need for honesty and transparency in all dealings with the insurer. Such measures ensure that the sustainability of the insurance model remains intact, protecting both the company and the insured individuals from losses [Data: Entities (38); Relationships (43, 720)].

===== RELATIONSHIPS =====

     id                         source                                   target                                                                                                                                                                                                                                                                                                                                                                                                                                                                                                                                                                                                                                                                                                                                                                                                                                                                                                                                                                                                                                                                                                                                                  description weight links  in_context
0   450                    DISABLEMENT                             COMPENSATION                                                                                                                                                                                                                                                                                                                                                                                                                                                                                                                                                                                                                                                                                                                                                                                                                                                                                                                                                                                                                                                   Permanent total disablement is a condition under which compensation is paid based on the policy provisions    1.0     1        True
1   653                 INSURED PERSON                              EXTENSION 5                                                                                                                                                                                                                                                                                                                                                                                                                                                                                                                                                                                                                                                                                                                                                                                                                                                                                                                                                                                                                                                                   Extension 5 pertains specifically to the Insured Person and limits on claims they can make    6.0     4        True
2   658                      BENEFIT 5                           INSURED PERSON                                                                                                                                                                                                                                                                                                                                                                                                                                                                                                                                                                                                                                                                                                                                                                                                                                                                                                                                                                                                                                                Benefit 5 provides compensation to the Insured Person for daily hospital stays related to accidental injuries    1.0     4        True
3   675                 INSURED PERSON                  PAYMENT OF COMPENSATION                                                                                                                                                                                                                                                                                                                                                                                                                                                                                                                                                                                                                                                                                                                                                                                                                                                                                                                                                                                                                                           The Insured Person may receive PAYMENT OF COMPENSATION for injuries or illnesses covered by the policy provisions.    5.0     4        True
4   710                 INSURED PERSON                               DISABILITY                                                                                                                                                                                                                                                                                                                                                                                                                                                                                                                                                                                                                                                                                                                                                                                                                                                                                                                                                                                                                                                          The Insured Person may file a claim in the event of a disability that affects their ability to work    1.0     4        True
5   688                       CLAIMANT                   DISABILITY CERTIFICATE                                                                                                                                                                                                                                                                                                                                                                                                                                                                                                                                                                                                                                                                                                                                                                                                                                                                                                                                                                                                                                           The claimant must present a Disability Certificate when filing a claim related to disability caused by an accident    7.0     4        True
6   693    PERMANENT TOTAL DISABLEMENT                                 CLAIMANT                                                                                                                                                                                                                                                                                                                                                                                                                                                                                                                                                                                                                                                                                                                                                                                                                                                                                                                                                                                                                                               Claims for Permanent Total Disablement must be substantiated by the claimant through appropriate documentation    8.0     4        True
7   694  PERMANENT PARTIAL DISABLEMENT                                 CLAIMANT                                                                                                                                                                                                                                                                                                                                                                                                                                                                                                                                                                                                                                                                                                                                                                                                                                                                                                                                                                                                                                               The claimant may file for insurance benefits related to Permanent Partial Disablement with necessary documents    8.0     4        True
8   695    TEMPORARY TOTAL DISABLEMENT                                 CLAIMANT                                                                                                                                                                                                                                                                                                                                                                                                                                                                                                                                                                                                                                                                                                                                                                                                                                                                                                                                                                                                                                       In the event of Temporary Total Disablement, the claimant must provide relevant medical documentation for their claims    8.0     4        True
9   452                        INSURER                             COMPENSATION                                                                                                                                                                                                                                                                                                                                                                            The insurer plays a crucial role in providing financial protection and peace of mind to policyholders. In the event of an accident covered by the insurance policy, the insurer is responsible for paying compensation to the insured or their legal representatives. This ensures that individuals or their beneficiaries receive the necessary support to recover from the financial burdens that may arise due to the accident. The compensation process is a fundamental aspect of the insurer's obligations, highlighting their commitment to safeguarding the interests of those they have contracted to protect. Ultimately, the insurer's responsibility to provide compensation underscores the importance of having an insurance policy in place for unforeseen events.   16.0     3        True
10   71      CAPITAL SUM INSURED (CSI)                                  INSURER                                                                                                                                                                                                                                                                                                                                                                                                                                                                                                                                                                                                                                                                                                                                                                                                                                                                                                                                                                                                                            Capital Sum Insured (CSI) determines the maximum amount the insurer is liable to pay for injuries per individual under the policy    6.0     3        True
11  457             COMPENSATION LIMIT                                  INSURER                                                                                                                                                                                                                                                                                                                                                                                                                                                                                                                                                                                                                                                                                                                                                                                                                                                                                                                                                                                                                                                            The insurer sets a compensation limit within which claims must be settled according to the policy    1.0     3        True
12   15                         POLICY                             COMPENSATION                                                                                                                                                                                                                                                                                                                                                                                                                                                                                                                                                                                                                                                                                                                                                                                                                                                                                                                                                                                                                                                                                     The Policy stipulates the Compensation to be provided for covered losses    8.0     3        True
13  646                         POLICY                              EXTENSION 5                                                                                                                                                                                                                                                                                                                                                                                                                                                                                                                                                                                                                                                                                                                                                                                                                                                                                                                                                                                                                                                                        Extension 5 outlines the benefits for Permanent Partial Disablement under the Policy.    1.0     3        True
14  645                         POLICY                              EXTENSION 4                                                                                                                                                                                                                                                                                                                                                                                                                                                                                                                                                                                                                                                                                                                                                                                                                                                                                                                                                                                                                                                                Extension 4 specifies coverage for Permanent Total Disablement as a benefit under the Policy.    8.0     3        True
15  719                        COMPANY                             COMPENSATION                                                                                                                                                                                                                                                                                                                                                                                                                                                                                                                                                                                                                                                                                        The Company is tasked with administering Compensation to the Insured Person for valid claims made under the Policy. This includes providing compensation for losses incurred as a result of accidents, in alignment with the stipulations outlined in the policy. The Company's role is fundamentally to ensure that claims made by the Insured Person are evaluated and compensated fairly, thereby fulfilling the obligations set forth in the insurance agreement.   16.0     2        True
16  238                        COMPANY                                FRANCHISE                                                                                                                                                                                                                                                                                                                                                                                                                                                                                                                                                                                                                                                                                                                                                                                                                                                                                                                                                                                                                                                                              The company defines franchise limits in the context of their insurance coverage    1.0     2        True
17  410                  BODILY INJURY                             COMPENSATION                                                                                                                                                                                                                                                                                                                                                                                                                                                                                                                                                                                                                                                                                                                                                                                                                                                                                                                                                                                                                                                    Compensation is available for losses due to bodily injury claims under the terms of the insurance policy.    7.0     2        True
18  796                          LIMBS                            BODILY INJURY                                                                                                                                                                                                                                                                                                                                                                                                                                                                                                                                                                                                                                                                                                                                                                                                                                                                                                                                                                                                                                                  Loss of limbs is a specific example of a bodily injury eligible for compensation under the insurance policy    9.0     2        True
19  780                        INSURED                              HANDICAPPED                                                                                                                                                                                                                                                                                                                                                                                                                                                                                                                                                                                                                                                                                                                                                                                                                                                                                                                                                                                                                                                 The insured may include handicapped individuals who have taken out the insurance policy for adapted vehicles    6.0     1        True
20  454                       ACCIDENT                             COMPENSATION                                                                                                                                                                                                                                                                                                                                                                                                                                                                                                                                                                                                                                                                                                                                                                                                                                                                                                                                                                                                                                                                     An accident causes injuries that necessitate compensation payment to the affected person    1.0     1        True
21  393         DISABILITY CERTIFICATE                            ICICI LOMBARD                                                                                                                                                                                                                                                                                                                                                                                                                                                                                                                                                                                                                                                                                                                                                                                                                                                                                                                                                                                                                                                      A Disability Certificate is required by ICICI Lombard to process claims for permanent total disablement    7.0     1        True
22   72                   COMPENSATION                          VEHICLE INSURED                                                                                                                                                                                                                                                                                                                                                                                                                                                                                                                                                                                                                                                                                                                                                                                                                                                                                                                                                                                                                                             Compensation is to be provided for injuries that occur involving the vehicle insured as stipulated in the policy    7.0     1        True
23  380                   OWNER-DRIVER                             COMPENSATION                                                                                                                                                                                                                                                                                                                                                                                                                                                                                                                                                                                                                                                                                                                                                                                                                                                                                                                                                                                                                                                       The Owner-Driver is eligible to receive COMPENSATION for injuries or death as per the Insurance Policy    1.0     1        True
24  409                          DEATH                             COMPENSATION  DEATH and COMPENSATION are closely linked in the context of insurance policies, particularly when it comes to accidents. Under certain circumstances, compensation may be payable in the event of death caused by an accident, provided that the claim adheres to the specific terms outlined in the insurance policy. This stipulation ensures that beneficiaries or dependents of the deceased can receive financial support following such tragic events, contingent upon the conditions set forth by the insurer.\n\nAdditionally, the death of any passenger involved in an accident also triggers the provision for compensation according to the terms of the insurance policy. This means that if a passenger suffers a fatality, the policy may cover compensation for their death, offering a financial safety net in these unfortunate circumstances. \n\nIn summary, both DEATH and COMPENSATION are integral elements within the framework of insurance policies, particularly relating to accidents, ensuring that adequate financial support is available to those affected by such losses, as long as the conditions of the policy are met.   16.0     1        True
25   73                   COMPENSATION            PAID DRIVER/CLEANER/CONDUCTOR                                                                                                                                                                                                                                                                                                                                                                                                                                                                                                                                                                                                                                                                                                                                                                                                                                                                                                                                                                                                                                               Compensation covers paid drivers/cleaners/conductors for injuries incurred while operating the insured vehicle    1.0     1        True
26  591                     CO-PAYMENT  ICICI LOMBARD GENERAL INSURANCE COMPANY                                                                                                                                                                                                                                                                                                                                                                                                                                                                                                                                                                                                                                                                                                                                                                                                                                                                                                                                                                                                                                                     ICICI Lombard General Insurance Company specifies co-payment clauses in their health insurance policies.    5.0     1        True
27  464              VEHICLE INSURANCE                               TOTAL LOSS                                                                                                                                                                                                                                                                                                                                                                                                                                                                                                                                                                                                                                                                                                                                                                                                                                                                                                                                                                                                                                                                                  Total loss is a specific condition addressed in vehicle insurance policies.    8.0     1        True
28  637                    SUM INSURED                                 BENEFITS                                                                                                                                                                                                                                                                                                                                                                                                                                                                                                                                                                                                                                                                                                                                                                                                                                                                                                                                                                                                                        The Sum Insured is the financial cap that defines the extent of available Benefits provided to the Insured Person for covered events.    1.0     1        True

===== ENTITIES =====

     id                         entity                                                                                                                                                                                                                                                                                                                                                                                                                                                                                                                                                                                                                                                                                                                                                                                                                                                                                                                                                                                                                                                                                                                                                                                                                                                                                                                                                                                                                                            description number of relationships  in_context
0   384                    DISABLEMENT                                                                                                                                                                                                                                                                                                                                                                                                                                                                                                                                                                                                                                                                                                                                                                                                                                                                                                                                                                                                                                                                                                                                                                                                                                                                                                         Permanent total disablement refers to serious injuries resulting in the inability to work, triggering compensation under the insurance policy.                       1        True
1   481                    EXTENSION 4                                                                                                                                                                                                                                                                                                                                                                                                                                                                                                                                                                                                                                                                                                                                                                                                                                                                                                                                                                                                                                                                                                                                                                                                                                                                                                                                 Extension 4 details benefits for Permanent Total Disablement as part of the insurance coverage for the Insured Person.                       1        True
2   518    PERMANENT TOTAL DISABLEMENT                                                                                                                                                                                                                                                                                                                                                                                                                                                                                                                                                                                                                                                                                                                                                                                                                                                                                                                                                                                                                                                                                                                                                                                                                                                                              Permanent Total Disablement is an event where an individual is unable to work permanently due to injury, which is a condition that can trigger specific insurance claims.                       1        True
3   519  PERMANENT PARTIAL DISABLEMENT                                                                                                                                                                                                                                                                                                                                                                                                                                                                                                                                                                                                                                                                                                                                                                                                                                                                                                                                                                                                                                                                                                                                                                                                                                                                          Permanent Partial Disablement refers to a situation where an individual has a lasting injury that partially limits their ability to work, influencing their insurance claims.                       1        True
4    81      CAPITAL SUM INSURED (CSI)                                                                                                                                                                                                                                                                                                                                                                                                                                                                                                                                                                                                                                                                                                                                                                                                                                                                                                                                                                                                                                                                                                                                                                                                                                                                                                             Capital Sum Insured (CSI) is the maximum liability of the insurer for a covered individual per incident, detailed in the insurance policy.                       1        True
5   482                    EXTENSION 5                                                                                                                                                                                                                                                                                                                                                                                                                                                                                                                                           Extension 5 is a specific provision that caters to the benefits associated with Permanent Partial Disablement for the Insured Person under the policy. This extension outlines the financial support and advantages accessible to individuals who qualify for coverage due to partial disability resulting from covered events. Furthermore, Extension 5 stipulates the sum insured applicable for claims made under particular circumstances related to the Insured Person. Thus, it provides clarity on the fiscal limits and conditions under which claims can be filed, ensuring that the Insured Person understands their entitlements and the associated coverage they possess in the event of a qualifying incident. Overall, Extension 5 serves to enhance the policy by clearly delineating benefits and financial protections available to the Insured Person facing permanent partial disability.                       2        True
6   224                    SUM INSURED                                                                                                                                                                                                                                                                                                                                                                                                                                       The term ""Sum Insured"" pertains to the maximum compensation limit established within an insurance policy, which specifies the benefits payable to the insured individual. This concept is fundamental in insurance coverage, as it establishes the upper threshold of financial protection offered to the policyholder. Specifically, the Sum Insured serves as a crucial factor in determining the payouts in the event of a claim.\n\nIn the context of vehicle insurance, Sum Insured denotes the highest amount that an insurer is willing to pay in the event of loss or damage to the insured vehicle as outlined in the policy. This ensures that the policyholder understands the extent of their coverage and the potential financial support they can expect should they experience a qualifying incident.\n\nOverall, the Sum Insured serves as a pivotal element in both general and vehicle insurance, guiding the financial commitments of the insurer and the expectations of the insured person.                       1        True
7   387             COMPENSATION LIMIT                                                                                                                                                                                                                                                                                                                                                                                                                                                                                                                                                                                                                                                                                                                                                                                                                                                                                                                                                                                                                                                                                                                                                                                                                                                                                                            Compensation limit refers to the maximum amount an insurer is liable to pay for injuries or damages, as stipulated in the policy.)(""entity""                       1        True
8   509        PAYMENT OF COMPENSATION                                                                                                                                                                                                                                                                                                                                                                                                                                                                                                                                                                                                                                                                                                                                                                                                                                                                                                                                                                                                                                                                                                                                                                                                                                                                         The process by which financial reimbursement is provided to the Insured Person for claims concerning injuries, illnesses, or disabilities as outlined in the insurance policy.                       1        True
9   478    TEMPORARY TOTAL DISABLEMENT                                                                                                                                                                                                                                                                                                                                                                                                                                                                                                                                                                                                                                                                                                          Temporary Total Disablement (TTD) refers to a condition in which an insured individual is incapacitated from working due to an injury, as defined by the terms of their insurance policy. This situation arises when an individual sustains an injury that prevents them from performing their job duties for a time. In such cases, the individual is eligible to make claims for medical benefits and compensation to support them during their recovery period. TTD is typically limited to a temporary duration, emphasizing that the individual's inability to work is not permanent. The insurance policy specifies the terms under which TTD applies, including the nature of the injury and the expected duration of the disablement.                       1        True
10   16                   COMPENSATION  Compensation is defined as the financial payment made by the Company, or insurer, for losses or damages incurred by the Insured under the terms of an insurance policy. It encompasses several scenarios, primarily focused on injuries sustained by individuals, including drivers and passengers involved in vehicle incidents. \n\nThe primary function of Compensation is to provide financial indemnity to those affected by accidents, which may involve bodily injury, property damage, or even death. This compensation serves to alleviate the financial burden faced by injured persons or their legal representatives as dictated by the specific guidelines laid out in the insurance policy.\n\nCompensation not only targets personal injuries sustained during vehicular accidents but also extends to cover legal liabilities for injuries incurred by employees operating motor vehicles in the course of their duties. The payments made by the insurer aim to fulfill the obligations of the policy, ensuring that the Insured Person or their representatives receive appropriate financial restitution for losses suffered due to various incidents.\n\nIn summary, Compensation is a broad term that applies to payments made by the insurer in response to claims filed under insurance policies, providing essential support for individuals facing financial strain resulting from injuries or damage incurred in accidents.                      10        True
11  492                      BENEFIT 5                                                                                                                                                                                                                                                                                                                                                                                                                                                                                                                                      Benefit 5 is a provision that delineates the Company’s maximum liability concerning hospitalization for an Insured Person. It explicitly specifies the limits of coverage applicable to days of hospital confinement. Additionally, Benefit 5 encompasses the Accidental Hospital Confinement Allowance, which stipulates that the Insured Person will receive daily payments during hospitalization specifically due to injuries sustained from accidents. This benefit ensures financial support for individuals confined to a hospital as a direct result of accidental injuries, reinforcing the Company’s commitment to providing adequate coverage for medical needs arising from such incidents. The dual focus of Benefit 5 on liability limitations and financial assistance highlights its importance in safeguarding the health and well-being of insured individuals during unforeseen circumstances.                       1        True
12  562                          LIMBS                                                                                                                                                                                                                                                                                                                                                                                                                                                                                                                                                                                                                                                                                                                                                                                                                                                                                                                                                                                                                                                                                                                                                                                                                                                                                                                     Refers to physical extremities of the body whose loss or injury qualifies for compensation under the scale provided in the policy.                       1        True
13  359         DISABILITY CERTIFICATE                                                                                                                                                                                                                                                                                                                                                                                                                                                                                                                                                                                                                                                                                                                                                                                                                                                                                                                                                                                                                                                                                                                                                                                                                                                                                                       A Disability Certificate is a legal document issued by an authorized civil surgeon to confirm the percentage of disability for insurance claims.                       2        True
14  391                     TOTAL LOSS                                                                                                                                                                                                                                                                                                                                                                                                                                                                                                                                                                                                                                                                                                                                                                                                                                                                                                                                                                                                                                                                                                                                                                                                                                                                                                                 Total loss refers to a significant event in vehicle insurance where the insured vehicle is completely destroyed or cannot be repaired.                       1        True
15  448                     CO-PAYMENT                                                                                                                                                                                                                                                                                                                                                                                                                                                                                                                                                                                                                                                                                                                                                                                                                                                                                                                                                                                                                                                                                                                                                                                                                                                                     Co-payment is a requirement in health insurance policies where the insured bears a specific percentage of the claim amount, as defined by ICICI Lombard General Insurance Company.                       1        True
16  556                    HANDICAPPED                                                                                                                                                                                                                                                                                                                                                                                                                                                                                                                                                                                                                                                                                                                                                                                                                                                                                                                                                                                                                                                                                                                                                                                                                                                                                                                                           Individuals with physical disabilities for whom the vehicle insurance is specifically designed and modified.                       1        True
17  218                      FRANCHISE                                                                                                                                                                                                                                                                                                                                                                                                                                                                                                                                                                                                                                                                                                                                                                                                                                                                                                                                                                                                                                                                                                                                                                                                                                                                                                                                                A minimum amount of loss that must be incurred before insurance coverage applies under certain benefits                       1        True
18  530                     DISABILITY                                                                                                                                                                                                                                                                                                                                                                                                                                                                                                                                                                                                                                                                                                                                                                                                                                                                                                                                                                                                                                                                                                                                                                                                                                                                                           Disability refers to physical or mental impairment that affects the Insured Person's ability to work or perform daily activities, which may lead to a claim.                       1        True

===== SOURCES =====

   id                                                                                                                                                                                                                                                                                                                                                                                                                                                                                                                                                                                                                                                                                                                                                                                                                                                                                                                                                                                                                                                                                                                                                                                                                                                                                                                                                                                                                                                                                                                                                                                                                                                                                                                                                                                                                                                                                                                                                                                                                                                                                                                                                                                                                                                                                                                                                                                                                                                                                                                                                                                                                                                                                                                                                                                                                                                                                                                                                                                                                                                                                                                                                                                                                                                                                                                                                                                                                                                                                                                                                                                                                                                                                                                                                                                                                                                                                                                                                                                                                                                                                                                                                                                                                                                                                                                                                                                                                                                                                                                                                                                                                                                                                                                                                                                                                                                                                                                                                                                                                                                                                                                                                                                                                                                                                                                                                                                                                                                                                                                                                                                                                                                                                                                                                                                                                                                                                                                                                                                                                                                                                                                                                                                                                       text
0  60           to the injured person or his/her legal representative(s)\n       whose receipt shall be a full discharge in respect of\n        the injury of such person.\n        Subject otherwise to the terms exceptions conditions\n       and limitations of this policy.\n       *The Capital Sum Insured (CSI) per passenger is to be\n         inserted.\n15. IMT.  16.  PERSONAL  ACCIDENT  TO  UNNAMED\n   PASSENGERS OTHER THAN INSURED AND THE PAID\n   DRIVER AND CLEANER (For vehicles rated as Private\n    cars and Motorised two wheelers (not for hire or reward)\n    with or without side car)\n     In consideration of the payment of an additional premium\n       it  is hereby understood and agreed that the insurer\n    undertakes to pay compensation on the scale provided\n    below for bodily injuries hereinafter defined sustained\n    by any passenger other than the insured and/or the paid\n     driver attendant or cleaner and/or a person in the employ\n    of the insured coming within the scope of the Workmen’s\n    Compensation Act, 1923 and subsequent amendments\n    of the said Act and engaged in and upon the service of\n    the insured at the time such injury is sustained whilst\n    mounting into, dismounting from or traveling in the insured\n    motor car and caused by violent, accidental, external and\n     visible means which independently of any other cause\n     shall within three calendar months of the occurrence of\n    such injury result in:\n\n                                         Scale of    Nature of injury                                     Compensation\n        (i) Death                     100%\n         (ii) Loss of two limbs or sight of two\n       eyes or one Limb and sight of one   100%\n        eye.\n         (iii) Loss of one limb or sight of one eye 50%\n       (iv) Permanent total disablement from                               100%          injuries other than named above.\n\n    Provided always that:-\n        I.   Compensation shall be payable under only one of the\n        items (i) to (iv) above in respect of any such person\n         arising out of any one occurrence and total liability of\n        the insurer shall not in the aggregate exceed the sum\n         of `............* during any one period of insurance in\n        respect of any such person.\n        II.  No compensation shall be payable in respect of death\n         or injury directly or indirectly wholly or in part arising\n         or resulting from or traceable to (a) intentional self\n         injury suicide or attempted suicide physical defect\n         or infirmity or (b) an accident happening whilst such\n        person is under the influence of intoxicating liquor or\n        drugs.\n        III.  Such compensation shall be payable only with the\n        approval of the insured named in the policy and directly\n         to the injured person or his/her legal representative(s)\n       whose receipt shall be a full discharge in respect of\n        the injury of such person.\n     IV.  Not more than. ** persons/passengers are in the\n         vehicle insured at the time  of  occurrence  of  such\n          injury. Subject otherwise to the terms exceptions\n        conditions and limitations of this policy.\n       *The Capital Sum Insured (CSI) per passenger is to be\n         inserted.\n        **The registered sitting capacity of the vehicle insured\n           is to be inserted.\n16. IMT.  17. PERSONAL ACCIDENT COVER TO PAID\n   DRIVERS, CLEANERS AND CONDUCTORS: (Applicable\n    to all classes of vehicles)\n     In consideration of the payment of an additional premium,\n       it  is hereby understood and agreed that the insurer\n    undertakes to pay compensation on the scale provided\n    below for bodily injury as hereinafter defined sustained\n    by the paid driver/cleaner/conductor in the employ of the\n    insured in direct connection with the vehicle insured whilst\n    mounting into dismounting from or traveling in the insured\n    vehicle and caused by violent accidental external and\n     visible means which independently of any other cause\n     shall within six calendar months of the occurrence of such\n     injury result in:\n\n                                         Scale of    Nature of injury                                     Compensation\n        (i) Death                     100%\n         (ii) Loss of two limbs or sight of two\n       eyes or one Limb and sight of one   100%\n        eye.\n         (iii) Loss of one limb or sight of one eye 50%\n       (iv) Permanent total disablement from                               100%          injuries other than named above.\n\n    Provided always that\n        I.   Compensation shall be payable under only one of the\n        items (i) to (iv) above in respect of any such person\n         arising out of any one occurrence and total liability of\n        the insurer shall not in the aggregate exceed the sum\n         of `............* during any one period of insurance in\n        respect of any such person.\n        II.  No compensation shall be payable in respect of death\n         or injury directly or indirectly wholly or in part arising or\n         resulting from or traceable to (a) intentional self injury\n         suicide or attempted suicide physical defect or infirmity\n         or (b) an accident happening whilst such person is\n        under the influence of intoxicating liquor or drugs.\n        III.  Such compensation shall be payable only with the\n        approval of the insured named in the policy and directly\n         to the injured person or his/her legal representative(s)\n       whose receipt shall be a full discharge in respect of\n        the injury of such person.\n        Subject otherwise to the terms exceptions conditions\n       and limitations of this policy.\n       *The Capital Sum Insured (CSI) per person is to be\n         inserted.\n17. IMT. 18. PERSONAL ACCIDENT TO UNNAM
1  89                                                                                                                                                                                                                                                                                                                                                                                                                                                                                                                                                                                                                                                                                                                                      that  the\ndetailed account  of  the expenses  incurred\nalong  with   all  the  supporting   bills  and\ndocuments,  substantiating  such  expenses,\nshall be submitted to and approved by the\nCompany.\nExtension 2: Medical Benefits Extension\nIn consideration of the payment of additional\npremium, the Company hereby agrees, subject\nto  the  terms,  conditions  and  exclusions\napplicable  to  this  Section and  the  terms,\nconditions, general exclusions stated  in the\nPolicy to extend the cover available under\nSection A to reimburse the Medical Expenses\nincurred during Hospitalisation, subject to a\nmaximum of Rs.    (as    specified   under\nbenefit  amount   against   Extension    2),\nreasonably  and  necessarily  incurred  and\nexpended,  during  the  Policy  Period/Policy\nYear, for the treatment of the Insured Person\non  the   written  advice   of  the  Medical\nPractitioner,  in connection with any Insured\nEvent covered under Section A of Part I of the\nmade by the Insured Person and admitted by\nthe Company.\nNotwithstanding anything to the contrary stated\nherein the Company shall be liable to make\npayment  under  this  extension  only   if  the\nHospitalisation commences within 7 days of\noccurrence of such Accident and the Insured\nPerson  undergoes  Hospital  Confinement,\nexceeding consecutive days.\nFurther,   it  is a condition precedent  to the\npayment of such Medical Expenses that the\nMedical Practitioner's detailed account shall be\nsubmitted to and is approved by the Company.\nHowever the Company's total  liability, under\nthis extension, for payment of  all claims in\naggregate for the Policy Period/Policy Year\nshall not exceed the Sum Insured as stated\nagainst Extension 2 in Part I of the Schedule as\napplicable to such Insured Person.\nExtension  3:  Hospital  Daily  Allowance\nExtension\nIn consideration of the payment of additional\npremium, the Company hereby agrees, subject\nto  the  terms,  conditions  and  exclusions\napplicable  to  this  Section and  the  terms,\nconditions, general exclusions stated  in the\nPolicy to extend the cover available under\nSection A to pay an allowance as mentioned,\nin Extension 3 of Part  I to the Schedule, for\neach day  of  Hospital Confinement as an\ninpatient   in  a   Hospital  consequent   to\nPermanent   Total   Disablement/Permanent\nPartial     Disablement/Temporary     Total\nDisablement as covered under Section A of\nPart I of the Schedule to this Policy for which a\nclaim  is made by the Insured Person and\nadmitted by the Company.\nNotwithstanding anything to the contrary stated\nherein the Company shall not be liable to pay\nfor any claim arising under this Extension 3\nwithin the first __consecutive days of Hospital\nconfinement  (as  specified  under  benefit\namount against this Extension),\nProvided the Company shall be liable to make\npayment under this Extension 3 only  if such\nHospital Confinement occurs within 7 days of\noccurrence of such Accident.\nHowever the Company's maximum liability for\npayment of a claim under this Extension 3\narising out of an Accident resulting in Hospital\nConfinement   shall  not  e ceed  da s   of\nHospital  Confinement.  (as  specified  under\nbenefit amount against this Extension).\n.\nExtension 4: Permanent Total Disablement\nImprovement Benefit Extension\nIn consideration of the payment of additional\npremium, the Company hereby agrees, subject\nto  the  terms,  conditions  and  exclusions\napplicable  to  this  Section and  the  terms,\nconditions, general exclusions stated  in the\nPolicy to extend the cover available under\nSection A to pay such an additional amount\nwhich  is equal to the amount as indicated\nagainst Extension 4 in Part I of Schedule, to the\nInsured  Person  for  any  Permanent  Total\nDisablement suffered by the Insured Person as\ncovered under Section A  of Part  I  of the\nSchedule to this Policy for which a claim is\nmade by the Insured Person and admitted by\nthe Company. However the Company's liability\nfor payment of all claims under this extension\nin aggregate for Policy Period/Policy Year in no\ncase shall exceed the Sum Insured as stated\nagainst Extension 4 in Part I of the Schedule\nhereto as applicable to such Insured Person.\nExtension     5:    Permanent     Partial\nDisablement    Improvement     Benefit\nExtension\nIn consideration of the payment of additional\npremium, the Company hereby agrees, subject\nto  the  terms,  conditions  and  exclusions\napplicable  to  this  Section and  the  terms,\nconditions, general exclusions stated  in the\nPolicy to extend the cover available under\nSection A to pay such an additional amount\nwhich  is equal to the amount as indicated\nagainst Extension 5 in Part I of Schedule, to the\nInsured  Person  for  a  Permanent  Partial\nDisablement suffered by the Insured Person as\ncovered under Section A  of Part  I  of the\nSchedule to this Policy for which a claim is\nmade by the Insured Person and admitted by\nthe Company.\nHowever, the Company's liability for payment\nof all claims under this extension in aggregate\nfor Policy Period/Policy Year in no case shall\nexceed the Sum Insured as stated against\nExtension 5 in Part I of the Schedule hereto as\napplicable
2  95                                                                                                                                                                                                                                                                                                                                                                                                                                                                                                                                                                                                                                                                                                                                                                                                                                                                                                                                                                                                                                                                                                                                    •  Viscera     Analysis     Report/\n           Chemical     analysis     report/\n            Forensic Science Lab report -  If\n             applicable - notarized/ Attested by\n            gazetted officer]\n        g)  Other Document as per Case details\n             - Copy  of  Treatment  papers;   if\n           hospitalized,    Website     Links/\n        Newspaper      cuttings,     Other\n          references\n        h)   If claim amount is more than 1lakh,\n       AML Documents - Pan Card Copy,\n         Residence Proof, 2 Passport size\n          colour photos of claimant\n            i)  Cancel Cheque with NEFT Mandate\n         form - duly filled in by the claimant\n        and bank\n            j)  Any other document as required by\n          the Company or Company's TPA to\n          investigate   the  Claim   or  Our\n           obligation to make payment for it\n     2.  In   case   of   Permanent   Total\n      Disablement/Permanent       Partial\n      Disablement &  Permanent  Total\n      Disablement  Improvement  Benefit\n      Extension/Permanent         Partial\n      Disablement  Improvement  Benefit\n      Extension\n        a) PA Claim form duly filled & signed by\n          Insured/ Claimant\n         b)  Policy Copy\n         c) MLC OR F.I.R.OR PANCHNAMA-\n           Notarised/ Attested by a gazetted\n            officer\nd)  Disability Certificate issued by Authorised\n     civil surgeon- Original/ Notarised/ Attested\n   by a gazetted officer\n •  Treatment papers, X-rays films / laboratory\n    test reports and other diagnostic reports to\n   support  the  claim  and  percentage  of\n    disability\ne)  Medical report\nf)  Colour Photograph of the injured reflecting\n    disability\ng)   If claim amount> 1lakh, AML Documents -\n   Pan Card Copy,\n   Residence Proof, 2 Passport size colour\n   photos of claimant\nh) Other Document as per Case details - Copy\n    of  Treatment  papers;     if   hospitalised,\n   Website Links/ Newspaper cuttings,\n   Other references\ni)  Cancel Cheque with NEFT Mandate form -\n    duly filled in by the claimant\nj)  Any other document as required by the\n   Company or Company's TPA to investigate\n   the  Claim  or  Our  obligation  to make\n   payment for it\n3.  In case of Temporary Total Disablement\n   resulting from an Injury\na)  Policy Copy\nb)  Claim form  duly  filled & signed by the\n   claimant\nc)  FIR/ MLC - attested by a gazetted officer\nd) Copy of treatment papers and diagnostic\n    reports     like    Discharge    summary,\n    consultation  and  follow-up  records  etc\n   (which would support the claim) - attested\n   by a gazetted officer/ stamped by hospital\n    authority\ne)  Original   Medical   Certificate   [Medical\n    Practitioner's   certificate  confirming  the\n    Injury and advising rest/ unfit to work for\n    specified number of days (confirming  'to'\n   and 'from' date]\nf)  Original  Fitness  Certificate   -  (Medical\n    Practitioner's certificate confirming the date\n   from which Injured can join back his duties)\n     - after the fitness date has been achieved\n  g)  Original Employee Cum Leave Certificate\n    from the employer\n  h)   If claim amount is more than 1lakh, AML\n    Documents  - Pan Card Copy, Residence\n     Proof, 2 Passport size colour photos  of\n     claimant  Cancel  Cheque  and  NEFT\n    Mandate form - duly filled in by the claimant\n  i)  Any other document as required by the\n    Company or Company's TPA to investigate\n     the  Claim  or  Our  obligation  to make\n    payment for it\n4.  Carriage of dead body / funeral expenses\n     / repatriation of remains\n   i)  Documents as enumerated under Section 7\n     B1(i) of the Policy related to lnsured\n     Person's death\n   ii)  Original receipts of expenses incurred for\n     carriage of dead body / funeral expenses /\n     repatriation of remains\n   iii)  If claim amount is more than 1lakh, AML\n    Documents  - Pan Card Copy, Residence\n     Proof, 2 Passport size colour photos  of\n     claimant\n  iv) Cancel Cheque and NEFT Mandate form -\n     duly filled in by the claimant\n  v)  Any other document as required by the\n    Company or Company's TPA to investigate\n     the  Claim  or  Our  obligation  to make\n    payment for it\n  5.  Medical Benefit\n  a)  Policy Copy\n  b)  All documents related to Death/ PTD / PPD/\n    TTD, as the case may be\n  c)  Medical report\n  d)  Prescriptions\n  e)  Medical & Investigation Bills\n  f)  Discharge Card\n  g)   If claim amount is more than 1lakh, AML\n    Documents  - Pan Card Copy, Residence\n     Proof, 2 Passport size colour photos  of\n     claimant\n  h)  Cancel Cheque and NEFT Mandate form -\n     duly filled in by the claimant\n   i)  Any other document as required by the\n    Company or Company's TPA to investigate\n     the  Claim  or  Our  obligation
3   9                                                                                                                                                                                                                                                                                                                                                                                                                     ... ** persons/passengers are in the\n     vehicle insured at the time of occurrence of such injury.\nSubject otherwise to the terms exceptions conditions and\nlimitations of this policy.\n* The Capital Sum Insured (CSI) per passenger is to be inserted.\n** The registered sitting capacity of the vehicle insured is to be\ninserted.\n\n17.  IMT. 17. PERSONAL ACCIDENT COVER TO PAID\nDRIVERS, CLEANERS AND CONDUCTORS: (Applicable to all\nclasses of vehicles)\n\nIn consideration of the payment of an additional premium, it is\nhereby understood and agreed that the insurer undertakes to\npay compensation on the scale provided below for bodily injury\nas hereinafter deﬁned sustained by the paid driver/\ncleaner/conductor in the employ of the insured in direct\nconnection with the vehicle insured whilst mounting into\ndismounting from or traveling in the insured vehicle and caused\nby violent accidental external and visible means which\nindependently of any other cause shall within six calendar\nmonths of the occurrence of such injury result in :\n Nature of injury                          Scale of\n                              CompensaƟon\n (I)  Death                         100%\n (ii) Loss of two limbs or sight of two       100%\n    eyes or one limb and sight of one eye\n  (iii) Loss of one limb or sight of one eye     50%\n (iv) Permanent total disablement from     100%\n     injuries other than named above\n\nProvided always that\nI.   Compensation shall be payable under only one of the items\n       (I) to (iv) above in respect of any such person arising out of\n    any one occurrence and total liability of the insurer shall not\n     in the aggregate exceed the sum of `____* during any one\n    period of insurance in respect of any such person.\nII.  No compensation shall be payable in respect of death or\n     injury directly or indirectly wholly or in part arising or\n     resulting from or traceable to\n     (a) intentional self injury suicide or attempted suicide\n        physical defect or inﬁrmity or (b) an accident\n       happening whilst such person is under the inﬂuence of\n         intoxicating liquor or drugs.\nIII.  Such compensation shall be payable only with the\n    approval of the insured named in the policy and directly to\n    the injured person or his/ her legal representative(s) whose\n     receipt shall be a full discharge in respect of the injury of\n    such person.\nSubject otherwise to the terms exceptions conditions and\nlimitations of this policy.\n* The Capital Sum Insured (CSI) per person is to be inserted.\n18. IMT. 18. PERSONAL ACCIDENT TO UNNAMED HIRER\nAND UNNAMED PILLION PASSENGERS (Applicable to\nMotorised Two wheelers with or without side Car)\nIn consideration of the payment of an additional premium it is\nhereby understood and agreed that the insurer undertakes to\npay compensation to any unnamed hirer/driver/any unnamed\npillion/sidecar passenger* on the scale provided below for\nbodily injury caused by violent, accidental, external and visible\nmeans whilst mounting into/onto and/or dismounting from or\ntraveling in/on the vehicle insured which independently of any\nother cause shall within three calendar months of the\noccurrence of such injury results in :\n\n Nature of injury                          Scale of\n                              CompensaƟon\n (I)  Death                         100%\n (ii) Loss of two limbs or sight of two       100%\n    eyes or one limb and sight of one eye\n  (iii) Loss of one limb or sight of one eye     50%\n (iv) Permanent total disablement from     100%\n     injuries other than named above\nProvided always that:\nI.   Compensation shall be payable under only one of the items\n        (i) to (iv) above in respect of any such person arising out of\n    any one occurrence and total liability of the insurer shall not\n     in the aggregate exceed the sum of `______** during any\n    one period of insurance in respect of any such person.\nII.  No compensation shall be payable in respect of death or\n     injury directly or indirectly wholly or in part arising or\n     resulting from or traceable to (a) intentional self injury\n     suicide or attempted suicide physical defect or inﬁrmity or\n     (b) an accident happening whilst such person is under the\n    inﬂuence of intoxicating liquor or drugs.\nIII.  Such compensation shall be payable only with the\n    approval of the insured named in the policy and directly to\n     the injured person or his/her legal representative(s) whose\n     receipt shall be a full discharge in respect of the injury of\n    such person.\nIV.  Not more than ...................... persons/passengers are in the\n     vehicle insured at the time of occurrence of such injury.\nSubject otherwise to the terms exceptions conditions and\nlimitations of this policy.\n* Delete if P.A. cover for unnamed pillion/side car passenger is\nnot taken.\n** The Capital Sum Insured (CSI) per passenger is to be inserted.\n19.  IMT. 19. COVER FOR VEHICLES IMPORTED WITHOUT\nCUSTOMS DUTY\nNotwithstanding anything to the contrary contained in this\npolicy it is hereby understood and agreed that in the event of\nloss or damage to the vehicle insured and/or its accessories\nnecessitating the supply of a part not obtainable from stocks\nheld in the country in which the vehicle insured is held for repair\nor in the event of the insurer exercising the option under\n...................... * to pay in cash the amount of the loss or damage the\nliability of the insurer in respect of any such part shall","To calculate the compensation payable for permanent total disablement with a Capital Sum Insured (CSI) of ₹15 lakh, where the compensation rate is set at 100%, you can use the following formula:

### Calculation

1. **Capital Sum Insured (CSI)**: ₹15,00,000
2. **Compensation Percentage for Permanent Total Disablement**: 100%

### Formula
Compensation Payable = Capital Sum Insured × Compensation Percentage

### Substituting Values
Compensation Payable = ₹15,00,000 × 100%  
Compensation Payable = ₹15,00,000 × 1  
Compensation Payable = ₹15,00,000

### Conclusion
Therefore, the total compensation payable for permanent total disablement would be **₹15 lakh**.

This calculation is aligned with insurance policy stipulations where permanent total disablement typically triggers full compensation based on the Capital Sum Insured as outlined in relevant data references [Data: Entities (518); Relationships (450)].",4954.30,,,
"If the Capital Sum Insured is ₹15 lakh and the insured loses two limbs or both eyes, which is compensated at 100%, how much more compensation is payable compared to the loss of one limb?","Loss of two limbs/both eyes = 100% × ₹15,00,000 = ₹15,00,000. Loss of one limb = 50% × ₹15,00,000 = ₹7,50,000. Difference = ₹15,00,000 − ₹7,50,000 = ₹7,50,000.",,"===== REPORTS =====

  id                                     title                                                                                                                                                                                                                                                                                                                                                                                                                                                                                                                                                                                                                                                                                                                                                                                                                                                                                                                                                                                                                                                                                                                                                                                                                                                                                                                                                                                                                                                                                                                                                                                                                                                                                                                                                                                                                                                                                                                                                                                                                                                                                                                                                                                                                                                                                                                                                                                                                                                                                                                                                                                                                                                                                                                                                                                                                                                                                                                                                                                                                                                                                                                                                                                                                                                                                                                                                                                                                                                                                                                                                                                                                                                                                                                                                                                                                                                                                                                                                                                                                                                                                                                                                                                                                                                                                                                                                                                                                                                                                                                                                                                                                                                                                                                                                                                                                                                                                                                                                                                                                                                                                                                                                                                                                                                                                                                                                                                                                                                                                                                                                                                                                                                                                                                                         content
0  4         ICICI Lombard Insurance Community                                                                                                                                                                                                                                                                                                                                                                                                                                                                                                                                                                                                                                                                                                                                                                                                                                                                                                                                                                                                                                                                                                                                                                                                                   # ICICI Lombard Insurance Community\n\nThe ICICI Lombard Insurance community encompasses various entities that are deeply interconnected through insurance policies and coverage provisions. Primary entities include the Insured Person, ICICI Lombard General Insurance Company, hospitals, and various benefit extensions such as Daily Cash and Ambulance Cover. The community functions with contractual relationships and obligations, where the insured individuals maintain rights and responsibilities under their policies, which are crucial in ensuring proper insurance coverage and claims processing.\n\n## Critical Role of Insured Persons\n\nInsured Persons are at the core of the ICICI Lombard Insurance community, representing individuals who are covered under insurance policies. These individuals have the right to claim benefits for a range of medical expenses, including hospitalization and ambulance services due to accidents. Under the insurance policy, the Insured Person also has the responsibility to report any claims or changes in their risk profile to the company to maintain coverage validity. This relationship defines the fundamental purpose of insurance: to provide financial security during unforeseen medical incidents [Data: Entities (212); Relationships (230, 617)].\n\n## Significance of ICICI Lombard General Insurance Company\n\nICICI Lombard General Insurance Company is the main entity providing insurance coverage to the Insured Persons within this community. As a prominent provider in India, the company outlines specific terms in insurance policies, enabling Insured Persons to receive financial protection against medical expenses and accidents. The company facilitates the claims process, which is essential for ensuring that the Insured Persons can navigate their recovery and financial obligations effectively following incidents covered under the policy [Data: Entities (466); Relationships (617)].\n\n## Role of Hospitals in Healthcare Access\n\nHospitals are vital in the ICICI Lombard community as they are the institutions where Insured Persons receive treatment following accidents or medical emergencies. The relationship between hospitals and Insured Persons is founded on the need for medical care and the need to process insurance claims for hospitalization. The involvement of hospitals underscores the importance of complying with quality standards and regulations outlined in the Clinical Establishments Act, which ensures trust in the healthcare provision within the community [Data: Entities (173); Relationships (223)].\n\n## Hospitalization Benefits and Coverage\n\nHospitalization is a critical aspect for Insured Persons, as it triggers various claims to be filed with ICICI Lombard for financial support against medical expenses incurred during inpatient care. Provisions such as Hospital Daily Cash and Post-Hospitalization Medical Expenses reflect the need for comprehensive coverage, offering financial relief to Insured Persons during their recovery phase. These aspects of the policy are designed to alleviate the economic burden of medical care following unexpected accidents [Data: Entities (496, 258); Relationships (286, 677)].\n\n## Claim Procedures and Documentation\n\nThe community is structured around explicit procedures that Insured Persons must follow to successfully submit insurance claims. This includes filling out the Claim Form and adhering to the Claim Procedure, necessary for processing requests for reimbursement of medical expenses. A clear understanding and compliance with these protocols are crucial for effective claims management, ensuring that Insured Persons receive timely financial support for their medical needs arising from accidents [Data: Entities (153, 598); Relationships (167)].\n\n## Implications of Cancellations and Fraudulent Claims\n\nThe cancellation of policies and the presence of fraudulent claims represent critical challenges within the ICICI Lombard community. Fraudulent claims can lead to penalties and a forfeiture of benefits under an insurance policy, emphasizing the need for honesty and transparency in all dealings with the insurer. Such measures ensure that the sustainability of the insurance model remains intact, protecting both the company and the insured individuals from losses [Data: Entities (38); Relationships (43, 720)].
1  0  Motor Vehicle Insurance Community Report  # Motor Vehicle Insurance Community Report\n\nThe report encompasses the interrelated entities forming the Motor Vehicle Insurance community, including various aspects such as vehicle coverage, compensation mechanisms, and documentation required for claims. The entities are connected through insurance policies that dictate the terms under which risks are covered and claims can be processed, highlighting both legal and operational frameworks in motor insurance.\n\n## Vehicle Coverage under Insurance Policies.\n\nThe primary entity, Vehicle Insured, denotes any automobile covered under an insurance policy, safeguarding against risks associated with accidents and damages. Insurance policies can vary widely, stipulating individual terms and conditions including premium payments and coverage limits, which create a structured approach for compensating policyholders in case of incidents. The relationships indicate that each vehicle insured is linked to an insurer that evaluates the risks before issuing a policy, emphasizing the importance of thorough risk assessment in this community [Data: Entities (82); Relationships (469)].\n\n## Importance of Compensation Mechanisms.\n\nThe community utilizes a structured compensation framework that outlines financial payments for losses arising from vehicular incidents. The Compensation entity encapsulates payments for bodily injuries, damages, and legal liabilities that may occur with insured vehicles, providing essential financial support to affected parties. This mechanism ensures that victims of accidents are reimbursed, thus enforcing a balance between operational safety and financial responsibility, underlined by explicit claims provisions within insurance policies [Data: Entities (16, 72); Relationships (410)].\n\n## Diverse Types of Insurance Claims.\n\nClaims in this community can stem from various events, including bodily injury, vehicle damage, and even incidents leading to death. Each type of claim is governed by specific guidelines defined in insurance policies, influencing how claimants can seek financial restitution. As highlighted, the need for supporting documents such as Medical Certificates and Disability Certificates underlines the rigorous substantiation needed for each type of insurance claim, promoting responsible and fair processing of claims amidst diverse circumstances [Data: Entities (23, 359, 685); Relationships (393, 409)].\n\n## Role of Alternative Fuel Technologies.\n\nThe inclusion of equipment like the CNG/LPG Kit in insured vehicles introduces an environmentally friendly dimension to the community. Policies extending coverage to such kits further highlight the increased emphasis on sustainable practices within vehicular insurance. This aspect caters to a growing segment of vehicle owners who prioritize cleaner fuel options, thus expanding the insurance landscape to adapt to ecological concerns while ensuring adequate coverage against potential damages [Data: Entities (95); Relationships (91)].\n\n## Legal and Regulatory Compliance.\n\nThe interplay between various entities such as insurance policies and national standards showcases the legal framework safeguarding motor vehicle insurance practices. The stipulations defined under the policies ensure compliance with relevant legislative requirements, including those related to the Ministry of Defence, ensuring protection for drivers employed in contexts that involve state support. This relationship underscores the necessity for insurers to align with regulatory bodies, thus reinforcing accountability and legal adherence to best practices in insurance [Data: Entities (86); Relationships (112)].\n\n## Documentation Challenges in Claim Processing.\n\nThe efficiency of claim processing is heavily reliant on the submission of complete and accurate documentation, as outlined in claims protocols. Instances of missing documents can significantly delay the approval of claims, emphasizing the importance of thoroughness in the claims process. The requirement for items such as PAN Cards, NEFT Mandate Forms, and Treatment Papers further complicates the landscape, where claimant compliance directly influences claim outcomes [Data: Entities (517, 700); Relationships (696, 684)].\n\n## Impact of Violent Accidents.\n\nViolent Accidents, defined as incidents resulting in bodily injury or death due to clear external causes, trigger specific discussions around insurance compensation. The community must account for these incidents distinctly, given their serious implications for policyholders. The insurance policies incorporated often include stipulations that outline how such cases are managed financially, which is crucial for maintaining public trust and ensuring that obligations are met promptly in dire situations [Data: Entities (354); Relationships (377)].\n\n## Interconnection with the Motor Trade.\n\nEntities involved in the Motor Trade, including dealers and service providers, interact closely with the motor vehicle insurance community by facilitating purchases and servicing of insured vehicles. This interrelationship enhances the overall value of motor vehicle insurance, as service providers ensure that vehicles remain compliant and functional under the respective insurance policies. Furthermore, the alignment of motor vehicle insurance with industry trends in vehicle sales and repairs plays a pivotal role in maintaining competitive and responsive market conditions [Data: Entities (133, 141); Relationships (152)].

===== RELATIONSHIPS =====

     id                     source                                   target                                                                                                                                                                                                                                                                                                                                                                                                                                                                                                                                                                                                                                                                                                                                                                                                                                                                                                                                                                                                                                                                                                                                                  description weight links  in_context
0   450                DISABLEMENT                             COMPENSATION                                                                                                                                                                                                                                                                                                                                                                                                                                                                                                                                                                                                                                                                                                                                                                                                                                                                                                                                                                                                                                                   Permanent total disablement is a condition under which compensation is paid based on the policy provisions    1.0     1        True
1   653             INSURED PERSON                              EXTENSION 5                                                                                                                                                                                                                                                                                                                                                                                                                                                                                                                                                                                                                                                                                                                                                                                                                                                                                                                                                                                                                                                                   Extension 5 pertains specifically to the Insured Person and limits on claims they can make    6.0     5        True
2   714             INSURED PERSON                            INSURED ASSET                                                                                                                                                                                                                                                                                                                                                                                                                                                                                                                                                                                                                                                                                                                                                                                                                                                                                                                                                                                                                                                        The Insured Person has a financial interest in the Insured Asset which is covered under their Policy.    1.0     5        True
3   874             INSURED PERSON               EMERGENCY MEDICAL EXPENSES                                                                                                                                                                                                                                                                                                                                                                                                                                                                                                                                                                                                                                                                                                                                                                                                                                                                                                                                                                                                                                         The Insured Person can claim reimbursement for Emergency Medical Expenses incurred due to injuries from an accident.    8.0     5        True
4   658                  BENEFIT 5                           INSURED PERSON                                                                                                                                                                                                                                                                                                                                                                                                                                                                                                                                                                                                                                                                                                                                                                                                                                                                                                                                                                                                                                                Benefit 5 provides compensation to the Insured Person for daily hospital stays related to accidental injuries    1.0     5        True
5   675             INSURED PERSON                  PAYMENT OF COMPENSATION                                                                                                                                                                                                                                                                                                                                                                                                                                                                                                                                                                                                                                                                                                                                                                                                                                                                                                                                                                                                                                           The Insured Person may receive PAYMENT OF COMPENSATION for injuries or illnesses covered by the policy provisions.    5.0     5        True
6   452                    INSURER                             COMPENSATION                                                                                                                                                                                                                                                                                                                                                                            The insurer plays a crucial role in providing financial protection and peace of mind to policyholders. In the event of an accident covered by the insurance policy, the insurer is responsible for paying compensation to the insured or their legal representatives. This ensures that individuals or their beneficiaries receive the necessary support to recover from the financial burdens that may arise due to the accident. The compensation process is a fundamental aspect of the insurer's obligations, highlighting their commitment to safeguarding the interests of those they have contracted to protect. Ultimately, the insurer's responsibility to provide compensation underscores the importance of having an insurance policy in place for unforeseen events.   16.0     4        True
7    71  CAPITAL SUM INSURED (CSI)                                  INSURER                                                                                                                                                                                                                                                                                                                                                                                                                                                                                                                                                                                                                                                                                                                                                                                                                                                                                                                                                                                                                            Capital Sum Insured (CSI) determines the maximum amount the insurer is liable to pay for injuries per individual under the policy    6.0     4        True
8   457         COMPENSATION LIMIT                                  INSURER                                                                                                                                                                                                                                                                                                                                                                                                                                                                                                                                                                                                                                                                                                                                                                                                                                                                                                                                                                                                                                                            The insurer sets a compensation limit within which claims must be settled according to the policy    1.0     4        True
9   485                  SECTION I                                  INSURER                                                                                                                                                                                                                                                                                                                                                                                                                                                                                                                                                                                                                                                                                                                                                                                                                                                                                                                                                                                                                Section I sets forth the obligations and coverage details that the insurer must follow when processing claims related to the insured vehicle.    7.0     4        True
10  719                    COMPANY                             COMPENSATION                                                                                                                                                                                                                                                                                                                                                                                                                                                                                                                                                                                                                                                                                        The Company is tasked with administering Compensation to the Insured Person for valid claims made under the Policy. This includes providing compensation for losses incurred as a result of accidents, in alignment with the stipulations outlined in the policy. The Company's role is fundamentally to ensure that claims made by the Insured Person are evaluated and compensated fairly, thereby fulfilling the obligations set forth in the insurance agreement.   16.0     3        True
11  747           DOUBLE INSURANCE                                  COMPANY                                                                                                                                                                                                                                                                                                                                                                                                                                                                                                                                                                                                                                                                                                                                                                                                                                                                                                                                                                                                                                                                   The presence of Double Insurance can lead to the cancellation of the policy by the Company    1.0     3        True
12  238                    COMPANY                                FRANCHISE                                                                                                                                                                                                                                                                                                                                                                                                                                                                                                                                                                                                                                                                                                                                                                                                                                                                                                                                                                                                                                                                              The company defines franchise limits in the context of their insurance coverage    1.0     3        True
13   15                     POLICY                             COMPENSATION                                                                                                                                                                                                                                                                                                                                                                                                                                                                                                                                                                                                                                                                                                                                                                                                                                                                                                                                                                                                                                                                                     The Policy stipulates the Compensation to be provided for covered losses    8.0     3        True
14  646                     POLICY                              EXTENSION 5                                                                                                                                                                                                                                                                                                                                                                                                                                                                                                                                                                                                                                                                                                                                                                                                                                                                                                                                                                                                                                                                        Extension 5 outlines the benefits for Permanent Partial Disablement under the Policy.    1.0     3        True
15  645                     POLICY                              EXTENSION 4                                                                                                                                                                                                                                                                                                                                                                                                                                                                                                                                                                                                                                                                                                                                                                                                                                                                                                                                                                                                                                                                Extension 4 specifies coverage for Permanent Total Disablement as a benefit under the Policy.    8.0     3        True
16  454                   ACCIDENT                             COMPENSATION                                                                                                                                                                                                                                                                                                                                                                                                                                                                                                                                                                                                                                                                                                                                                                                                                                                                                                                                                                                                                                                                     An accident causes injuries that necessitate compensation payment to the affected person    1.0     2        True
17  285                   ACCIDENT               EMERGENCY MEDICAL EXPENSES                                                                                                                                                                                                                                                                                                                                                                                                                                                                                                                                                                                                                                                                                                                                                                                                                                                                                                                                                                                                                                                                             Emergency Medical Expenses arise directly from injuries sustained in an Accident    8.0     2        True
18  410              BODILY INJURY                             COMPENSATION                                                                                                                                                                                                                                                                                                                                                                                                                                                                                                                                                                                                                                                                                                                                                                                                                                                                                                                                                                                                                                                    Compensation is available for losses due to bodily injury claims under the terms of the insurance policy.    7.0     2        True
19  796                      LIMBS                            BODILY INJURY                                                                                                                                                                                                                                                                                                                                                                                                                                                                                                                                                                                                                                                                                                                                                                                                                                                                                                                                                                                                                                                  Loss of limbs is a specific example of a bodily injury eligible for compensation under the insurance policy    9.0     2        True
20   72               COMPENSATION                          VEHICLE INSURED                                                                                                                                                                                                                                                                                                                                                                                                                                                                                                                                                                                                                                                                                                                                                                                                                                                                                                                                                                                                                                             Compensation is to be provided for injuries that occur involving the vehicle insured as stipulated in the policy    7.0     1        True
21  380               OWNER-DRIVER                             COMPENSATION                                                                                                                                                                                                                                                                                                                                                                                                                                                                                                                                                                                                                                                                                                                                                                                                                                                                                                                                                                                                                                                       The Owner-Driver is eligible to receive COMPENSATION for injuries or death as per the Insurance Policy    1.0     1        True
22  409                      DEATH                             COMPENSATION  DEATH and COMPENSATION are closely linked in the context of insurance policies, particularly when it comes to accidents. Under certain circumstances, compensation may be payable in the event of death caused by an accident, provided that the claim adheres to the specific terms outlined in the insurance policy. This stipulation ensures that beneficiaries or dependents of the deceased can receive financial support following such tragic events, contingent upon the conditions set forth by the insurer.\n\nAdditionally, the death of any passenger involved in an accident also triggers the provision for compensation according to the terms of the insurance policy. This means that if a passenger suffers a fatality, the policy may cover compensation for their death, offering a financial safety net in these unfortunate circumstances. \n\nIn summary, both DEATH and COMPENSATION are integral elements within the framework of insurance policies, particularly relating to accidents, ensuring that adequate financial support is available to those affected by such losses, as long as the conditions of the policy are met.   16.0     1        True
23   73               COMPENSATION            PAID DRIVER/CLEANER/CONDUCTOR                                                                                                                                                                                                                                                                                                                                                                                                                                                                                                                                                                                                                                                                                                                                                                                                                                                                                                                                                                                                                                               Compensation covers paid drivers/cleaners/conductors for injuries incurred while operating the insured vehicle    1.0     1        True
24  591                 CO-PAYMENT  ICICI LOMBARD GENERAL INSURANCE COMPANY                                                                                                                                                                                                                                                                                                                                                                                                                                                                                                                                                                                                                                                                                                                                                                                                                                                                                                                                                                                                                                                     ICICI Lombard General Insurance Company specifies co-payment clauses in their health insurance policies.    5.0     1        True
25  464          VEHICLE INSURANCE                               TOTAL LOSS                                                                                                                                                                                                                                                                                                                                                                                                                                                                                                                                                                                                                                                                                                                                                                                                                                                                                                                                                                                                                                                                                  Total loss is a specific condition addressed in vehicle insurance policies.    8.0     1        True
26  637                SUM INSURED                                 BENEFITS                                                                                                                                                                                                                                                                                                                                                                                                                                                                                                                                                                                                                                                                                                                                                                                                                                                                                                                                                                                                                        The Sum Insured is the financial cap that defines the extent of available Benefits provided to the Insured Person for covered events.    1.0     1        True
27  713                   SURVEYOR                            INSURED ASSET                                                                                                                                                                                                                                                                                                                                                                                                                                                                                                                                                                                                                                                                                                                                                                                                                                                                                                                                                                                                                                  The Surveyor inspects the Insured Asset to determine the extent of the damage prior to the company's decision on the Claim.    7.0     1        True

===== ENTITIES =====

     id                      entity                                                                                                                                                                                                                                                                                                                                                                                                                                                                                                                                                                                                                                                                                                                                                                                                                                                                                                                                                                                                                                                                                                                                                                                                                                                                                                                                                                                                                                            description number of relationships  in_context
0   387          COMPENSATION LIMIT                                                                                                                                                                                                                                                                                                                                                                                                                                                                                                                                                                                                                                                                                                                                                                                                                                                                                                                                                                                                                                                                                                                                                                                                                                                                                                            Compensation limit refers to the maximum amount an insurer is liable to pay for injuries or damages, as stipulated in the policy.)(""entity""                       1        True
1   562                       LIMBS                                                                                                                                                                                                                                                                                                                                                                                                                                                                                                                                                                                                                                                                                                                                                                                                                                                                                                                                                                                                                                                                                                                                                                                                                                                                                                                     Refers to physical extremities of the body whose loss or injury qualifies for compensation under the scale provided in the policy.                       1        True
2    81   CAPITAL SUM INSURED (CSI)                                                                                                                                                                                                                                                                                                                                                                                                                                                                                                                                                                                                                                                                                                                                                                                                                                                                                                                                                                                                                                                                                                                                                                                                                                                                                                             Capital Sum Insured (CSI) is the maximum liability of the insurer for a covered individual per incident, detailed in the insurance policy.                       1        True
3   224                 SUM INSURED                                                                                                                                                                                                                                                                                                                                                                                                                                       The term ""Sum Insured"" pertains to the maximum compensation limit established within an insurance policy, which specifies the benefits payable to the insured individual. This concept is fundamental in insurance coverage, as it establishes the upper threshold of financial protection offered to the policyholder. Specifically, the Sum Insured serves as a crucial factor in determining the payouts in the event of a claim.\n\nIn the context of vehicle insurance, Sum Insured denotes the highest amount that an insurer is willing to pay in the event of loss or damage to the insured vehicle as outlined in the policy. This ensures that the policyholder understands the extent of their coverage and the potential financial support they can expect should they experience a qualifying incident.\n\nOverall, the Sum Insured serves as a pivotal element in both general and vehicle insurance, guiding the financial commitments of the insurer and the expectations of the insured person.                       1        True
4   384                 DISABLEMENT                                                                                                                                                                                                                                                                                                                                                                                                                                                                                                                                                                                                                                                                                                                                                                                                                                                                                                                                                                                                                                                                                                                                                                                                                                                                                                         Permanent total disablement refers to serious injuries resulting in the inability to work, triggering compensation under the insurance policy.                       1        True
5    16                COMPENSATION  Compensation is defined as the financial payment made by the Company, or insurer, for losses or damages incurred by the Insured under the terms of an insurance policy. It encompasses several scenarios, primarily focused on injuries sustained by individuals, including drivers and passengers involved in vehicle incidents. \n\nThe primary function of Compensation is to provide financial indemnity to those affected by accidents, which may involve bodily injury, property damage, or even death. This compensation serves to alleviate the financial burden faced by injured persons or their legal representatives as dictated by the specific guidelines laid out in the insurance policy.\n\nCompensation not only targets personal injuries sustained during vehicular accidents but also extends to cover legal liabilities for injuries incurred by employees operating motor vehicles in the course of their duties. The payments made by the insurer aim to fulfill the obligations of the policy, ensuring that the Insured Person or their representatives receive appropriate financial restitution for losses suffered due to various incidents.\n\nIn summary, Compensation is a broad term that applies to payments made by the insurer in response to claims filed under insurance policies, providing essential support for individuals facing financial strain resulting from injuries or damage incurred in accidents.                      10        True
6   481                 EXTENSION 4                                                                                                                                                                                                                                                                                                                                                                                                                                                                                                                                                                                                                                                                                                                                                                                                                                                                                                                                                                                                                                                                                                                                                                                                                                                                                                                                 Extension 4 details benefits for Permanent Total Disablement as part of the insurance coverage for the Insured Person.                       1        True
7   509     PAYMENT OF COMPENSATION                                                                                                                                                                                                                                                                                                                                                                                                                                                                                                                                                                                                                                                                                                                                                                                                                                                                                                                                                                                                                                                                                                                                                                                                                                                                         The process by which financial reimbursement is provided to the Insured Person for claims concerning injuries, illnesses, or disabilities as outlined in the insurance policy.                       1        True
8   218                   FRANCHISE                                                                                                                                                                                                                                                                                                                                                                                                                                                                                                                                                                                                                                                                                                                                                                                                                                                                                                                                                                                                                                                                                                                                                                                                                                                                                                                                                A minimum amount of loss that must be incurred before insurance coverage applies under certain benefits                       1        True
9   482                 EXTENSION 5                                                                                                                                                                                                                                                                                                                                                                                                                                                                                                                                           Extension 5 is a specific provision that caters to the benefits associated with Permanent Partial Disablement for the Insured Person under the policy. This extension outlines the financial support and advantages accessible to individuals who qualify for coverage due to partial disability resulting from covered events. Furthermore, Extension 5 stipulates the sum insured applicable for claims made under particular circumstances related to the Insured Person. Thus, it provides clarity on the fiscal limits and conditions under which claims can be filed, ensuring that the Insured Person understands their entitlements and the associated coverage they possess in the event of a qualifying incident. Overall, Extension 5 serves to enhance the policy by clearly delineating benefits and financial protections available to the Insured Person facing permanent partial disability.                       2        True
10  492                   BENEFIT 5                                                                                                                                                                                                                                                                                                                                                                                                                                                                                                                                      Benefit 5 is a provision that delineates the Company’s maximum liability concerning hospitalization for an Insured Person. It explicitly specifies the limits of coverage applicable to days of hospital confinement. Additionally, Benefit 5 encompasses the Accidental Hospital Confinement Allowance, which stipulates that the Insured Person will receive daily payments during hospitalization specifically due to injuries sustained from accidents. This benefit ensures financial support for individuals confined to a hospital as a direct result of accidental injuries, reinforcing the Company’s commitment to providing adequate coverage for medical needs arising from such incidents. The dual focus of Benefit 5 on liability limitations and financial assistance highlights its importance in safeguarding the health and well-being of insured individuals during unforeseen circumstances.                       1        True
11  391                  TOTAL LOSS                                                                                                                                                                                                                                                                                                                                                                                                                                                                                                                                                                                                                                                                                                                                                                                                                                                                                                                                                                                                                                                                                                                                                                                                                                                                                                                 Total loss refers to a significant event in vehicle insurance where the insured vehicle is completely destroyed or cannot be repaired.                       1        True
12  257  EMERGENCY MEDICAL EXPENSES                                                                                                                                                                                                                                                                                                                                                                                                                                                                                                                                                                                                                                                                                                                                                                                                                                                                                                                                                                                                                                                                                                                                                                                                                                                                                                                        Expenses incurred for treatment of bodily injuries sustained by the Insured Person and/or occupants in relation to an accident.                       2        True
13  547            DOUBLE INSURANCE                                                                                                                                                                                                                                                                                                                                                                                                                                                                                                                                                                                                                                                                                                                                                                                                                                                                                                                                                                                                                                                                                                                                                                                                                                                                                                               Double Insurance is an event that may cause the Company to cancel the policy if there is existing insurance covering the same liability.                       1        True
14  398                   SECTION I                                                                                                                                                                                                                                                                                                                                                                                                                                                                                                                                                                                                                                                                                                                                                                                                                                                                                                                                                                                                                                                                                                                                                                                                                                                                                                                            Section I of the policy details the terms and conditions regarding the coverage for damages or loss to the insured vehicle.                       1        True
15  532               INSURED ASSET                                                                                                                                                                                                                                                                                                                                                                                                                                                                                                                                                                                                                                                                                                                                                                                                                                                                                                                                                                                                                                                                                                                                                                                                                                                                                                                                              The Insured Asset is the property or item covered under the Policy that may be subject to loss or damage.                       2        True
16  448                  CO-PAYMENT                                                                                                                                                                                                                                                                                                                                                                                                                                                                                                                                                                                                                                                                                                                                                                                                                                                                                                                                                                                                                                                                                                                                                                                                                                                                     Co-payment is a requirement in health insurance policies where the insured bears a specific percentage of the claim amount, as defined by ICICI Lombard General Insurance Company.                       1        True

===== SOURCES =====

    id                                                                                                                                                                                                                                                                                                                                                                                                                                                                                                                                                                                                                                                                                                                                                                                                                                                                                                                                                                                                                                                                                                                                                                                                                                                                                                                                                                                                                                                                                                                                                                                                                                                                                                                                                                                                                                                                                                                                                                                                                                                                                                                                                                                                                                                                                                                                                                                                                                                                                                                                                                                                                                                                                                                                                                                                                                                                                                                                                                                                                                                                                                                                                                                                                                                                                                                                                                                                                                                                                                                                                                                                                                                                                                                                                                                                                                                                                                                                                                                                                                                                                                                                                                                                                                                                                                                                                                                                                                                                                                                                                                                                                                                                                                                                                                                                                                                                                                                                                                                                                                                                                                                                                                                                                                                                                                                                                                                                                                                                                                                                                                                                                                                                                                                                                                                                                                                                                                                                                                                                                                                                                                                       text
0   61   compensation shall be payable only with the\n        approval of the insured named in the policy and directly\n         to the injured person or his/her legal representative(s)\n       whose receipt shall be a full discharge in respect of\n        the injury of such person.\n        Subject otherwise to the terms exceptions conditions\n       and limitations of this policy.\n       *The Capital Sum Insured (CSI) per person is to be\n         inserted.\n17. IMT. 18. PERSONAL ACCIDENT TO UNNAMED HIRER\n   AND UNNAMED PILLION PASSENGERS (Applicable to\n    Motorised Two wheelers with or without side Car)\n     In consideration of the payment of an additional premium\n       it  is hereby understood and agreed that the insurer\n    undertakes to pay compensation to any unnamed hirer/\n    driver/any unnamed  pillion/sidecar passenger* on the\n    scale provided below for bodily injury caused by violent,\n    accidental, external and visible means whilst mounting\n    into/onto and/or dismounting from or traveling in/on the\n    vehicle insured which independently of any other cause\n     shall within three calendar months of the occurrence of\n    such injury results in:\n\n                                         Scale of    Nature of injury                                     Compensation\n        (i) Death                     100%\n         (ii) Loss of two limbs or sight of two\n       eyes or one Limb and sight of one   100%\n        eye.\n         (iii) Loss of one limb or sight of one eye 50%\n       (iv) Permanent total disablement from                               100%          injuries other than named above.\n\n    Provided always that:\n        I.   Compensation shall be payable under only one of the\n        items (i) to (iv) above in respect of any such person\n         arising out of any one occurrence and total liability of\n        the insurer shall not in the aggregate exceed the sum\n         of `............** during any one period of insurance in\n        respect of any such person.\n        II.  No compensation shall be payable in respect of death\n         or injury directly or indirectly wholly or in part arising\n         or resulting from or traceable to (a) intentional self\n         injury suicide or attempted suicide physical defect\n         or infirmity or (b) an accident happening whilst such\n        person is under the influence of intoxicating liquor or\n        drugs.\n        III.  Such compensation shall be payable only with the\n        approval of the insured named in the policy and directly\n         to the injured person or his/her legal representative(s)\n       whose receipt shall be a full discharge in respect of\n        the injury of such person.\n     IV.  Not more than persons/passengers are in the vehicle\n        insured at the time of occurrence of such injury.\n        Subject otherwise to the terms exceptions conditions\n       and limitations of this policy.\n        *Delete  if P.A. cover for unnamed pillion/side car\n       passenger is not taken.\n        **The Capital Sum Insured (CSI) per passenger is to\n       be inserted.\n18. IMT. 19. COVER FOR VEHICLES IMPORTED WITHOUT\n   CUSTOMS DUTY\n    Notwithstanding anything  to  the  contrary contained\n     in this policy it is hereby understood and agreed that in\n    the event of loss or damage to the vehicle insured and/\n    or its accessories necessitating the supply of a part not\n    obtainable from stocks held in the country in which the\n    vehicle insured is held for repair or in the event of the\n    insurer exercising the option under, * to pay in cash the\n   amount of the loss or damage the liability of the insurer in\n    respect of any such part shall be limited to :-\n        I.   a)  The price quoted in the latest catalogue or the\n             price list issued by the Manufacturer or his Agent\n              for the country in which the vehicle insured is\n            held for repair less depreciation applicable; OR\n         b)    If no such catalogue or price list exists the price\n                  list obtaining at the Manufacturer’s Works plus\n            the reasonable cost of transport otherwise than\n           by air to the country in which the vehicle insured\n                is held for repair and the amount of the relative\n            import duty less depreciation applicable under\n            the Policy; and\n        II.  The reasonable cost of fitting such parts.\n        Subject otherwise to the terms conditions limitations\n       and exceptions of this Policy.\n         *Insert ‘Condition 3’ in the case of the Private Car and\n        Motorsied Two Wheeler Policies and ‘Condition 4’ in\n        the case of Commercial Vehicles Policy.\n19. IMT. 20. REDUCTION IN THE LIMIT OF LIABILITY FOR\n   PROPERTY DAMAGE\n       It is hereby understood and agreed that notwithstanding\n    anything to the contrary contained  in the policy the\n    insurers liability is limited to ` 6000/- (Rupees six thousand\n    only) for damage to property other than the property\n    belonging to the insured or held in trust or in custody or\n    control of the insured. In consideration of this reduction in\n    the limit of liability a reduction in premium of `............*\n     is hereby made to the insured. Subject otherwise to the\n    terms conditions limitations and exceptions of the policy.\n    *To insert ` 100 for Private car, Per year\n20. IMT. 21. SPECIAL EXCLUSIONS AND COMPULSORY\n   DEDUCTIBLE (Applicable to  all Commercial Vehicles\n    excluding taxis and motorized two wheelers carrying\n    passengers for hire or reward.)\n    Notwithstanding anything  to  the  contrary contained\n    herein it is hereby understood and agreed that\n        I.   Special Exclusions Except in the case of Total Loss\n         of the vehicle insured, the insurer
1  110                                                                                                                                                                                                                                                                                                 the scale provided\n    below  for  bodily  injury caused by  violent,  accidental,\n     external and visible means whilst mounting into/onto and/\n     or dismounting from or traveling in/on the vehicle insured\n    which independently of any other cause shall within three\n    calendar months of the occurrence of such injury results in :-\n\n Nature of injury                        Scale of\n                                    compensation\n  (i) Death                           100%\n  (ii) Loss of two limbs or sight of two eyes     100%\n or one limb and sight of one eye.\n  (iii) Loss of one limb or sight of one eye       50%\n  (iv) Permanent total disablement from       100%\n injuries other than named above.\nProvided always that:\nI.   Compensation shall be payable under only one of the\n    items (i) to (iv) above in respect of any such person arising\n    out of any one occurrence and total liability of the insurer\n     shall not in the aggregate exceed the sum of `.......** during\n    any one period of insurance in respect of any such person.\nII.  No compensation shall be payable in respect of death\n     or injury directly or indirectly wholly or in part arising or\n     resulting from or traceable to\n     (a) intentional self injury suicide or attempted suicide\n    physical defect or infirmity or\n     (b) an accident happening whilst such person is under the\n     influence of intoxicating liquor or drugs.\nIII.  Such compensation  shall be payable only with the\n    approval of the insured named in the policy and directly\n     to the injured person or his/her legal representative(s)\n   whose receipt shall be a full discharge in respect of the\n     injury of such person.\nIV.  Not more than   ............. persons/passengers are in the\n     vehicle insured at the time of occurrence of such injury.\n    Subject otherwise to the terms exceptions conditions and\n     limitations of this policy.\n     *  Delete   if  P.A.  cover  for unnamed  pillion/side  car\n    passenger is not taken.\n     ** The Capital Sum Insured (CSI) per passenger is to be\n     inserted.\n\n19. IMT. 19. COVER FOR VEHICLES IMPORTED WITHOUT\n   CUSTOMS DUTY\n    Notwithstanding anything  to the contrary contained\n     in this policy it is hereby understood and agreed that in\n    the event of loss or damage to the vehicle insured and/\n     or its accessories necessitating the supply of a part not\n    obtainable from stocks held in the country in which the\n     vehicle insured is held for repair or in the event of the\n     insurer exercising the option under ...., * to pay in cash the\n    amount of the loss or damage the liability of the insurer in\n    respect of any such part shall be limited to :-\n1.   a. The price quoted in the latest catalogue or the price\n      list issued by the Manufacturer or his Agent for the\n    country in which the vehicle insured is held for repair less\n    depreciation applicable; OR\n     b. If no such catalogue or price list exists the price list\n       obtaining  at  the  Manufacturer’s Works  plus  the\n      reasonable cost of transport otherwise than by air\n       to the country in which the vehicle insured is held for\n       repair and the amount of the relative import duty less\n       depreciation applicable under the Policy; and\n2.  The reasonable cost of fitting such parts.\n    Subject otherwise to the terms conditions limitations and\n    exceptions of this Policy.\n     * Insert ‘Condition 3’ in the case of the Private Car and\n    Motorsied Two Wheeler Policies and ‘Condition 4’ in the\n    case of Commercial Vehicles Policy.\n\n20. IMT. 20. REDUCTION IN THE LIMIT OF LIABILITY FOR\n   PROPERTY DAMAGE\n       It is hereby understood and agreed that notwithstanding\n    anything to the contrary contained in the policy the insurers\n      liability is limited to `6000/- (Rupees six thousand only) for\n   damage to property other than the property belonging to the\n     insured or held in trust or in custody or control of the insured.\n     In consideration of this reduction in the limit of liability\n    a reduction in premium of `......* is hereby made to the\n     insured.\n    Subject otherwise to the terms conditions limitations and\n    exceptions of the policy.\n    *To insert `50 for Two wheelers, `100 for private cars `150\n     for Commercial Vehicles- three wheelers and taxis or `200\n     for Commercial Vehicles (excluding three wheelers and taxis).\n\n21. IMT. 21. SPECIAL EXCLUSIONS AND COMPULSORY\n   DEDUCTIBLE (Applicable to  all Commercial Vehicles\n    excluding taxis and motorized two wheelers carrying\n    passengers for hire or reward.)\n    Notwithstanding anything  to the contrary contained\n    herein it is hereby understood and agreed that\n        I.   Special Exclusions\n        Except in the case of Total Loss of the vehicle insured,\n        the insurer shall not be liable under Section I of the\n         policy for loss of or damage to lamps tyres/tubes\n       mudguards bonnet side parts bumpers and paint\n        work.\n        II.  Compulsory Deductible\n     In addition to any amount which the insured may be\n    required to bear under para (a) above the insured shall\n    also bear under section I of the policy in respect of each\n    and every event (including event giving  rise to total\n     loss/constructive total loss/Cash Loss) the first  `.......*of\n    any expenditure(or any less expenditure which may be\n     incurred) for which provision is made under this policy\n    and/or of any expenditure by
2    9                                                                                                                                                                                                                                                                                                                     ... ** persons/passengers are in the\n     vehicle insured at the time of occurrence of such injury.\nSubject otherwise to the terms exceptions conditions and\nlimitations of this policy.\n* The Capital Sum Insured (CSI) per passenger is to be inserted.\n** The registered sitting capacity of the vehicle insured is to be\ninserted.\n\n17.  IMT. 17. PERSONAL ACCIDENT COVER TO PAID\nDRIVERS, CLEANERS AND CONDUCTORS: (Applicable to all\nclasses of vehicles)\n\nIn consideration of the payment of an additional premium, it is\nhereby understood and agreed that the insurer undertakes to\npay compensation on the scale provided below for bodily injury\nas hereinafter deﬁned sustained by the paid driver/\ncleaner/conductor in the employ of the insured in direct\nconnection with the vehicle insured whilst mounting into\ndismounting from or traveling in the insured vehicle and caused\nby violent accidental external and visible means which\nindependently of any other cause shall within six calendar\nmonths of the occurrence of such injury result in :\n Nature of injury                          Scale of\n                              CompensaƟon\n (I)  Death                         100%\n (ii) Loss of two limbs or sight of two       100%\n    eyes or one limb and sight of one eye\n  (iii) Loss of one limb or sight of one eye     50%\n (iv) Permanent total disablement from     100%\n     injuries other than named above\n\nProvided always that\nI.   Compensation shall be payable under only one of the items\n       (I) to (iv) above in respect of any such person arising out of\n    any one occurrence and total liability of the insurer shall not\n     in the aggregate exceed the sum of `____* during any one\n    period of insurance in respect of any such person.\nII.  No compensation shall be payable in respect of death or\n     injury directly or indirectly wholly or in part arising or\n     resulting from or traceable to\n     (a) intentional self injury suicide or attempted suicide\n        physical defect or inﬁrmity or (b) an accident\n       happening whilst such person is under the inﬂuence of\n         intoxicating liquor or drugs.\nIII.  Such compensation shall be payable only with the\n    approval of the insured named in the policy and directly to\n    the injured person or his/ her legal representative(s) whose\n     receipt shall be a full discharge in respect of the injury of\n    such person.\nSubject otherwise to the terms exceptions conditions and\nlimitations of this policy.\n* The Capital Sum Insured (CSI) per person is to be inserted.\n18. IMT. 18. PERSONAL ACCIDENT TO UNNAMED HIRER\nAND UNNAMED PILLION PASSENGERS (Applicable to\nMotorised Two wheelers with or without side Car)\nIn consideration of the payment of an additional premium it is\nhereby understood and agreed that the insurer undertakes to\npay compensation to any unnamed hirer/driver/any unnamed\npillion/sidecar passenger* on the scale provided below for\nbodily injury caused by violent, accidental, external and visible\nmeans whilst mounting into/onto and/or dismounting from or\ntraveling in/on the vehicle insured which independently of any\nother cause shall within three calendar months of the\noccurrence of such injury results in :\n\n Nature of injury                          Scale of\n                              CompensaƟon\n (I)  Death                         100%\n (ii) Loss of two limbs or sight of two       100%\n    eyes or one limb and sight of one eye\n  (iii) Loss of one limb or sight of one eye     50%\n (iv) Permanent total disablement from     100%\n     injuries other than named above\nProvided always that:\nI.   Compensation shall be payable under only one of the items\n        (i) to (iv) above in respect of any such person arising out of\n    any one occurrence and total liability of the insurer shall not\n     in the aggregate exceed the sum of `______** during any\n    one period of insurance in respect of any such person.\nII.  No compensation shall be payable in respect of death or\n     injury directly or indirectly wholly or in part arising or\n     resulting from or traceable to (a) intentional self injury\n     suicide or attempted suicide physical defect or inﬁrmity or\n     (b) an accident happening whilst such person is under the\n    inﬂuence of intoxicating liquor or drugs.\nIII.  Such compensation shall be payable only with the\n    approval of the insured named in the policy and directly to\n     the injured person or his/her legal representative(s) whose\n     receipt shall be a full discharge in respect of the injury of\n    such person.\nIV.  Not more than ...................... persons/passengers are in the\n     vehicle insured at the time of occurrence of such injury.\nSubject otherwise to the terms exceptions conditions and\nlimitations of this policy.\n* Delete if P.A. cover for unnamed pillion/side car passenger is\nnot taken.\n** The Capital Sum Insured (CSI) per passenger is to be inserted.\n19.  IMT. 19. COVER FOR VEHICLES IMPORTED WITHOUT\nCUSTOMS DUTY\nNotwithstanding anything to the contrary contained in this\npolicy it is hereby understood and agreed that in the event of\nloss or damage to the vehicle insured and/or its accessories\nnecessitating the supply of a part not obtainable from stocks\nheld in the country in which the vehicle insured is held for repair\nor in the event of the insurer exercising the option under\n...................... * to pay in cash the amount of the loss or damage the\nliability of the insurer in respect of any such part shall
3   87                                                                                                                                                                                                                                                                                                                                                                                                                                                                                                                                                                                                                                                                               nationalistic, political, racial, religious or\n      other ends.\n\n\nIII.     BENEFITS COVERED UNDER THE\nPOLICY SECTION A\nThe Company hereby agrees, subject to the\nterms,  exclusions  and  conditions  herein\ncontained or otherwise expressed hereon, to\npay to the Insured Person (or his Nominee/\nlegal heir, as the case may be) a sum as\ncompensation on occurrence of any Insured\nEvent, as  specifically described hereunder,\nunder different Benefit(s) (and Extensions -  if\nany) arising due to an Injury sustained by the\nInsured Person during the Policy Period but not\nexceeding the Sum Insured as specified under\nthe respective Benefits (and Extensions  -  if\nany) under Section A.\nBenefit 1: Insured Event - Death resulting\nfrom Accident\nThe Company hereby agrees, subject to the\nterms, conditions and exclusions applicable to\nthis Section 2.1 and the terms, conditions,\ngeneral exclusions stated in the Policy, to pay\nsuch Sum  Insured  as  mentioned  against\nBenefit 1 under Section A of Part  I of the\nSchedule to this Policy, on the occurrence of\ndeath of the Insured Person, provided such\ndeath results solely and directly from an Injury,\nwithin twelve months from the date of Accident\nresulting in such Injury. Provided that the date\nof occurrence of the Accident falls within the\nPolicy Period\nBenefit 2: Insured Event - Permanent Total\nDisablement (PTD) resulting from Accident\nThe Company hereby agrees, subject to the\nterms, conditions and exclusions applicable to\nthis Section 2.2 and the terms, conditions,\ngeneral exclusions stated in the Policy, to pay\nsuch Sum Insured, in the manner indicated\nbelow, on the occurrence of any of the following\nlosses, provide such losses to the Insured\nPerson  are  total and  irrecoverable  losses\nwhich result solely and directly from an Injury,\nwithin twelve months from the date of Accident\nresulting in such Injury. Provided that the date\nof occurrence of the Accident falls within the\nPolicy Period/Policy Year:\n     i)  Loss of Use of both eyes, or Physical\n      Separation/ Loss of Use of two entire\n     hands or two entire feet, or one entire\n     hand and one entire foot, or of such Loss\n      of Use of one eye and such Physical\n      Separation/ Loss of Use of one entire\n     hand or one entire foot, then the Sum\n     Insured  as  stated  under  Benefit  2,\n     Section A in the Part I of the Schedule to\n       this Policy hereto as applicable to such\n     Insured Person.\n     ii)  Physical Separation/ Loss of Use of two\n     hands or two feet, or of one hand and one\n       foot, or of Loss of Use of one eye and\n     Loss of Use of one hand or one foot, then\n      the Sum Insured as stated under Benefit\n      2, Section A in Part I of the Schedule to\n       this Policy hereto as applicable to such\n     Insured Person.\n      iii)   If  such   Injury   shall  as  a   direct\n     consequence thereof, permanently, and\n       totally, disable the Insured Person from\n     engaging   in  any  employment   or\n     occupation     of    any    description\n     whatsoever, then the Sum Insured as\n      stated under Benefit 2, Section A in Part\n         I of the Schedule to this Policy hereto as\n      applicable to such Insured Person.\nBenefit 3: Insured Event - Permanent Partial\nDisablement (PPD) resulting from Accident\nThe Company hereby agrees, subject to the\nterms, conditions and exclusions applicable to\nthis Section and the terms, conditions, general\nexclusions stated in the Policy, to pay such\nSum Insured as mentioned against Benefit 3\nunder Section A of Part I of the Schedule to this\nPolicy as applicable to such Insured Person in\nthe manner indicated below, on the occurrence\nof any of the following losses, provided such\nlosses to the Insured Person are irrecoverable\nlosses and result in Loss of Use or Physical\nSeparation which arises solely and  directly\nfrom an Injury, within twelve months from the\ndate of Accident resulting in such Injury.\nProvided that the date of occurrence of the\nAccident falls within the Policy Period/Policy\nYear.  : Losses covered Percentage of Sum\nInsured\n Sr Losses covered                  Percenta\n   .                                ge of\nNo                         Sum\n   .                                      Insured\n 1. Loss of Use/ Physical Separation:\n   One entire hand                   5\n                                   0\n   One entire foot                    5\n                                   0\n 2. Loss of Use of one eye             5\n                                   0\n 3. Loss of toes – all                  2\n                                   0\n    Great both phalanges              5\n 4. Loss of Use of both ears            50\n 5. Loss of Use of one ear             20\n 6. Loss of four fingers and thumb of    40\n   one hand\n 7. Loss of four fingers                35\n 8. Loss of thumb - both phalanges      25\n   One phalanx                     10\n 9. Loss   of  Index   finger-   three    10\n    phalanges\n   Two phalanges                    8\n   One phalanx                      4\n10. Loss  of  middle  finger   -  three    6\n    phalanges\n   Two phalanges","### Understanding Compensation Terms in Insurance

In insurance policies, the **Capital Sum Insured (CSI)** represents the maximum amount the insurer agrees to pay for specified insured events. In this case, the **CSI is ₹15 lakh** (or ₹1,500,000). 

### Compensation for Losses

According to the outlined compensation scales:

- **Loss of Two Limbs or Both Eyes**: This is compensated at **100%** of the CSI. Therefore, the compensation for this scenario would be:
  
  \[
  \text{Compensation} = \text{CSI} = ₹15,00,000
  \]

- **Loss of One Limb**: This typically compensates at **50%** of the CSI, which calculates as follows:
  
  \[
  \text{Compensation for Loss of One Limb} = \frac{50}{100} \times ₹15,00,000 = ₹7,50,000
  \]

### Comparison of Compensation Amounts

To find out how much more compensation is payable for the loss of two limbs or both eyes compared to the loss of one limb, we can calculate:

\[
\text{Difference in Compensation} = \text{Compensation for Loss of Two Limbs or Both Eyes} - \text{Compensation for Loss of One Limb}
\]

Plugging in the values:

\[
\text{Difference} = ₹15,00,000 - ₹7,50,000 = ₹7,50,000
\]

### Conclusion

Therefore, the compensation amount payable for the loss of two limbs or both eyes is ₹7,50,000 **more** compared to the loss of one limb. This illustrates the significance of the different categories and their corresponding compensation levels as defined in insurance policies.",9012.46,,,
"If the Capital Sum Insured is ₹15 lakh and an injury qualifies for 50% compensation, what percentage of the total compensation remains unpaid under the policy for that claim, and what is its monetary value?","Paid compensation = 50% = ₹7,50,000. Remaining unpaid portion = 50% = ₹7,50,000. Therefore, 50% of the insured amount remains unpaid, equal to ₹7,50,000.",,"===== REPORTS =====

  id                                         title                                                                                                                                                                                                                                                                                                                                                                                                                                                                                                                                                                                                                                                                                                                                                                                                                                                                                                                                                                                                                                                                                                                                                                                                                                                                                                                                                                                                                                                                                                                                                                                                                                                                                                                                                                                                                                                                                                                                                                                                                                                                                                                                                                                                                                                                                                                                                                                                                                                                                                                                                                                                                                                                                                                                                                                                                                                                                                                                                                                                                                                                                                                                                                                                                                                                                                                                                                                                                                                                                                                                                                                                                                                                                                                                                                                                                                                                                                                                                                                                                                                                                                                                                                                                                                                                                                                                                                                                                                                                                                                        content
0  4             ICICI Lombard Insurance Community  # ICICI Lombard Insurance Community\n\nThe ICICI Lombard Insurance community encompasses various entities that are deeply interconnected through insurance policies and coverage provisions. Primary entities include the Insured Person, ICICI Lombard General Insurance Company, hospitals, and various benefit extensions such as Daily Cash and Ambulance Cover. The community functions with contractual relationships and obligations, where the insured individuals maintain rights and responsibilities under their policies, which are crucial in ensuring proper insurance coverage and claims processing.\n\n## Critical Role of Insured Persons\n\nInsured Persons are at the core of the ICICI Lombard Insurance community, representing individuals who are covered under insurance policies. These individuals have the right to claim benefits for a range of medical expenses, including hospitalization and ambulance services due to accidents. Under the insurance policy, the Insured Person also has the responsibility to report any claims or changes in their risk profile to the company to maintain coverage validity. This relationship defines the fundamental purpose of insurance: to provide financial security during unforeseen medical incidents [Data: Entities (212); Relationships (230, 617)].\n\n## Significance of ICICI Lombard General Insurance Company\n\nICICI Lombard General Insurance Company is the main entity providing insurance coverage to the Insured Persons within this community. As a prominent provider in India, the company outlines specific terms in insurance policies, enabling Insured Persons to receive financial protection against medical expenses and accidents. The company facilitates the claims process, which is essential for ensuring that the Insured Persons can navigate their recovery and financial obligations effectively following incidents covered under the policy [Data: Entities (466); Relationships (617)].\n\n## Role of Hospitals in Healthcare Access\n\nHospitals are vital in the ICICI Lombard community as they are the institutions where Insured Persons receive treatment following accidents or medical emergencies. The relationship between hospitals and Insured Persons is founded on the need for medical care and the need to process insurance claims for hospitalization. The involvement of hospitals underscores the importance of complying with quality standards and regulations outlined in the Clinical Establishments Act, which ensures trust in the healthcare provision within the community [Data: Entities (173); Relationships (223)].\n\n## Hospitalization Benefits and Coverage\n\nHospitalization is a critical aspect for Insured Persons, as it triggers various claims to be filed with ICICI Lombard for financial support against medical expenses incurred during inpatient care. Provisions such as Hospital Daily Cash and Post-Hospitalization Medical Expenses reflect the need for comprehensive coverage, offering financial relief to Insured Persons during their recovery phase. These aspects of the policy are designed to alleviate the economic burden of medical care following unexpected accidents [Data: Entities (496, 258); Relationships (286, 677)].\n\n## Claim Procedures and Documentation\n\nThe community is structured around explicit procedures that Insured Persons must follow to successfully submit insurance claims. This includes filling out the Claim Form and adhering to the Claim Procedure, necessary for processing requests for reimbursement of medical expenses. A clear understanding and compliance with these protocols are crucial for effective claims management, ensuring that Insured Persons receive timely financial support for their medical needs arising from accidents [Data: Entities (153, 598); Relationships (167)].\n\n## Implications of Cancellations and Fraudulent Claims\n\nThe cancellation of policies and the presence of fraudulent claims represent critical challenges within the ICICI Lombard community. Fraudulent claims can lead to penalties and a forfeiture of benefits under an insurance policy, emphasizing the need for honesty and transparency in all dealings with the insurer. Such measures ensure that the sustainability of the insurance model remains intact, protecting both the company and the insured individuals from losses [Data: Entities (38); Relationships (43, 720)].
1  5  Insurance Regulation and Liability Framework                                                                                                                                                                                                                                                                                                 # Insurance Regulation and Liability Framework\n\nThis community consists primarily of the Insurer, the Motor Vehicles Act, 1988, and the Workmen’s Compensation Act, with their interrelations defining vehicle insurance and employee liability coverage in India. The Insurer provides foundational services under these regulatory frameworks, ensuring compliance with various legal obligations while managing risks related to motor vehicle operations and workplace injuries.\n\n## Insurer's Role in Vehicle Coverage\n\nThe Insurer plays a fundamental role by offering comprehensive insurance coverage for vehicles against various risks such as theft, accidents, and environmental damages. This coverage is detailed in policies that specify liability terms, ensuring vehicle owners are adequately protected and any claims are managed efficiently. The insurer is obliged to follow the regulations specified in the Motor Vehicles Act, 1988, which governs the operational standards, ensuring their services align with legal requirements [Data: Entities (57); Relationships (56, 100)].\n\n## Motor Vehicles Act, 1988's Impact on Insurance\n\nThe Motor Vehicles Act, 1988 establishes the legal framework within which the Insurer operates. It necessitates compliance from insurers regarding vehicle registration, insurance requirements, and liability coverage. By imposing specific standards and regulations, this Act ensures that insurers fulfill their responsibilities towards policyholders, promoting road safety and minimizing risks associated with vehicle use. The Act also addresses the obligations of both vehicle operators and insurers, effectively integrating their responsibilities [Data: Entities (96); Relationships (100, 122)].\n\n## Workmen’s Compensation Act and Employment Liabilities\n\nThe Workmen’s Compensation Act provides critical legal guidelines for employee compensation in the event of workplace injuries. It outlines the Insurer's responsibility to cover liabilities under this Act, ensuring that workers are compensated without needing to prove employer negligence. This regulatory framework is vital in protecting workers' rights and promoting a safe working environment, making the insurer's role pivotal in managing these liabilities effectively [Data: Entities (75, 383); Relationships (126, 449)].\n\n## Compliance with Regulatory Requirements\n\nThe Insurer is bound to comply with various legal requirements established by regulations such as the Motor Vehicles Act and the Workmen's Compensation Act. This compliance not only ensures that the insurer operates within legal boundaries but also protects the interests of policyholders, enforcing standards that guarantee adequate compensation for vehicle damages and workplace injuries. Such regulatory adherence is fundamental in maintaining public trust in the insurance landscape [Data: Relationships (100, 449)].\n\n## Potential Risks and Their Impact\n\nVarious risks are recognized by the insurer, including damage due to explosions, theft, and environmental factors such as storms and inundation. These risks are delineated in the insurance policy, which outlines specific coverage areas. Understanding these risks is critical, as they directly affect the insurer's liability and the financial protection offered to policyholders. The insurer's approach to managing these risks significantly influences its operational strategy and policy effectiveness [Data: Entities (65, 68, 70, 76); Relationships (763, 774)].\n\n## Claims Management Process\n\nThe claims management process is a vital aspect of the insurer's responsibilities, particularly in the context of the Motor Vehicles Act and the Workmen's Compensation Act. Efficient claims processing ensures that policyholders receive compensation timely for losses incurred, reinforcing the insurer's credibility in the market. This process is guided by specific policy stipulations and regulatory compliance, highlighting the importance of a streamlined approach to managing claims [Data: Entities (57); Relationships (449, 100)].

===== RELATIONSHIPS =====

     id                            source                                   target                                                                                                                                                                                                                                                                                                                                                                                                                                                                                                                                                                                                                                                                                                                                                                                                                                                                                                                                                                                                                                                                                                                                                  description weight links  in_context
0   450                       DISABLEMENT                             COMPENSATION                                                                                                                                                                                                                                                                                                                                                                                                                                                                                                                                                                                                                                                                                                                                                                                                                                                                                                                                                                                                                                                   Permanent total disablement is a condition under which compensation is paid based on the policy provisions    1.0     1        True
1   452                           INSURER                             COMPENSATION                                                                                                                                                                                                                                                                                                                                                                            The insurer plays a crucial role in providing financial protection and peace of mind to policyholders. In the event of an accident covered by the insurance policy, the insurer is responsible for paying compensation to the insured or their legal representatives. This ensures that individuals or their beneficiaries receive the necessary support to recover from the financial burdens that may arise due to the accident. The compensation process is a fundamental aspect of the insurer's obligations, highlighting their commitment to safeguarding the interests of those they have contracted to protect. Ultimately, the insurer's responsibility to provide compensation underscores the importance of having an insurance policy in place for unforeseen events.   16.0     6        True
2    65                           INSURER                  PERSONAL ACCIDENT COVER                                                                                                                                                                                                                                                                                                                                                                                                                                                                                                                                                                                                                                                                                                                                                                                                                                                                                                                                                                                                                                            The insurer provides personal accident cover as part of the insurance policy for those using the insured vehicle.    5.0     6        True
3   447                           INSURER                                   IMT 15                                                                                                                                                                                                                                                                                                                                                                                                                                                                                                                                                                                                                                                                                                                                                                                                                                                                                                                                                                                                                                                                   The insurer provides personal accident coverage details in IMT 15 for insured individuals.    8.0     6        True
4    71         CAPITAL SUM INSURED (CSI)                                  INSURER                                                                                                                                                                                                                                                                                                                                                                                                                                                                                                                                                                                                                                                                                                                                                                                                                                                                                                                                                                                                                            Capital Sum Insured (CSI) determines the maximum amount the insurer is liable to pay for injuries per individual under the policy    6.0     6        True
5   457                COMPENSATION LIMIT                                  INSURER                                                                                                                                                                                                                                                                                                                                                                                                                                                                                                                                                                                                                                                                                                                                                                                                                                                                                                                                                                                                                                                            The insurer sets a compensation limit within which claims must be settled according to the policy    1.0     6        True
6   484                            IMT 22                                  INSURER                                                                                                                                                                                                                                                                                                                                                                                                                                                                                                                                                                                                                                                                                                                                                                                                                                                                                                                                                                                                                                 IMT 22 indicates a specific condition of the vehicle insurance policy which the insurer must adhere to in processing claims.    1.0     6        True
7   719                           COMPANY                             COMPENSATION                                                                                                                                                                                                                                                                                                                                                                                                                                                                                                                                                                                                                                                                                        The Company is tasked with administering Compensation to the Insured Person for valid claims made under the Policy. This includes providing compensation for losses incurred as a result of accidents, in alignment with the stipulations outlined in the policy. The Company's role is fundamentally to ensure that claims made by the Insured Person are evaluated and compensated fairly, thereby fulfilling the obligations set forth in the insurance agreement.   16.0     4        True
8   129                           COMPANY         WORKMEN’S COMPENSATION ACT, 1923                                                                                                                                                                                                                                                                                                                                                                                                                                 The COMPANY is committed to adhering to the provisions of the Workmen’s Compensation Act, 1923, to ensure the safety and welfare of its employees, specifically focusing on paid drivers and conductors. Under this act, the COMPANY indemnifies liabilities related to any injuries that these workers may sustain while performing their duties. This compliance reflects the COMPANY's dedication to safeguarding the well-being of its workforce during their employment, aligning with the legal requirements set forth in the Workmen’s Compensation Act. Through these measures, the COMPANY not only adheres to regulatory standards but also promotes a culture of safety and responsibility within its operations.    8.0     4        True
9   738                LIMIT OF LIABILITY                                  COMPANY                                                                                                                                                                                                                                                                                                                                                                                                                                                                                                                                                                                                                                                                                                                                                                                                                                                                                                                                                                                                                                                                  The Company sets a limit of liability for compensation payouts under its insurance policies    6.0     4        True
10  238                           COMPANY                                FRANCHISE                                                                                                                                                                                                                                                                                                                                                                                                                                                                                                                                                                                                                                                                                                                                                                                                                                                                                                                                                                                                                                                                              The company defines franchise limits in the context of their insurance coverage    1.0     4        True
11   15                            POLICY                             COMPENSATION                                                                                                                                                                                                                                                                                                                                                                                                                                                                                                                                                                                                                                                                                                                                                                                                                                                                                                                                                                                                                                                                                     The Policy stipulates the Compensation to be provided for covered losses    8.0     3        True
12  653                    INSURED PERSON                              EXTENSION 5                                                                                                                                                                                                                                                                                                                                                                                                                                                                                                                                                                                                                                                                                                                                                                                                                                                                                                                                                                                                                                                                   Extension 5 pertains specifically to the Insured Person and limits on claims they can make    6.0     3        True
13  658                         BENEFIT 5                           INSURED PERSON                                                                                                                                                                                                                                                                                                                                                                                                                                                                                                                                                                                                                                                                                                                                                                                                                                                                                                                                                                                                                                                Benefit 5 provides compensation to the Insured Person for daily hospital stays related to accidental injuries    1.0     3        True
14  646                            POLICY                              EXTENSION 5                                                                                                                                                                                                                                                                                                                                                                                                                                                                                                                                                                                                                                                                                                                                                                                                                                                                                                                                                                                                                                                                        Extension 5 outlines the benefits for Permanent Partial Disablement under the Policy.    1.0     3        True
15  675                    INSURED PERSON                  PAYMENT OF COMPENSATION                                                                                                                                                                                                                                                                                                                                                                                                                                                                                                                                                                                                                                                                                                                                                                                                                                                                                                                                                                                                                                           The Insured Person may receive PAYMENT OF COMPENSATION for injuries or illnesses covered by the policy provisions.    5.0     3        True
16  645                            POLICY                              EXTENSION 4                                                                                                                                                                                                                                                                                                                                                                                                                                                                                                                                                                                                                                                                                                                                                                                                                                                                                                                                                                                                                                                                Extension 4 specifies coverage for Permanent Total Disablement as a benefit under the Policy.    8.0     3        True
17  410                     BODILY INJURY                             COMPENSATION                                                                                                                                                                                                                                                                                                                                                                                                                                                                                                                                                                                                                                                                                                                                                                                                                                                                                                                                                                                                                                                    Compensation is available for losses due to bodily injury claims under the terms of the insurance policy.    7.0     2        True
18  796                             LIMBS                            BODILY INJURY                                                                                                                                                                                                                                                                                                                                                                                                                                                                                                                                                                                                                                                                                                                                                                                                                                                                                                                                                                                                                                                  Loss of limbs is a specific example of a bodily injury eligible for compensation under the insurance policy    9.0     2        True
19  433           PERSONAL ACCIDENT COVER                                  INSURED                                                                                                                                                                                                                                                                                                                                                                                                                                                                                                                                                                                                                                                                                                                                                                                                                                                                                                                                                                                                                                                         The Personal Accident Cover applies to the Insured as the owner-driver under the terms of the policy    1.0     1        True
20  454                          ACCIDENT                             COMPENSATION                                                                                                                                                                                                                                                                                                                                                                                                                                                                                                                                                                                                                                                                                                                                                                                                                                                                                                                                                                                                                                                                     An accident causes injuries that necessitate compensation payment to the affected person    1.0     1        True
21   68           PERSONAL ACCIDENT COVER                          INSURED VEHICLE                                                                                                                                                                                                                                                                                                                                                                                                                                                                                                                                                                                                                                                                                                                                                                                                                                                                                                                                                                                                     Personal Accident Cover is specifically related to the insured vehicle as it outlines the compensation terms for injuries occurring during its operation    8.0     1        True
22   72                      COMPENSATION                          VEHICLE INSURED                                                                                                                                                                                                                                                                                                                                                                                                                                                                                                                                                                                                                                                                                                                                                                                                                                                                                                                                                                                                                                             Compensation is to be provided for injuries that occur involving the vehicle insured as stipulated in the policy    7.0     1        True
23  380                      OWNER-DRIVER                             COMPENSATION                                                                                                                                                                                                                                                                                                                                                                                                                                                                                                                                                                                                                                                                                                                                                                                                                                                                                                                                                                                                                                                       The Owner-Driver is eligible to receive COMPENSATION for injuries or death as per the Insurance Policy    1.0     1        True
24  831  WORKMEN’S COMPENSATION ACT, 1923                            MOTOR VEHICLE                                                                                                                                                                                                                                                                                                                                                                                                                                                                                                                                                                                                                                                                                                                                                                                                                                                                                                                                                                                                                                                               The Workmen’s Compensation Act relates to personal injury liability concerning motor vehicles.    5.0     1        True
25  409                             DEATH                             COMPENSATION  DEATH and COMPENSATION are closely linked in the context of insurance policies, particularly when it comes to accidents. Under certain circumstances, compensation may be payable in the event of death caused by an accident, provided that the claim adheres to the specific terms outlined in the insurance policy. This stipulation ensures that beneficiaries or dependents of the deceased can receive financial support following such tragic events, contingent upon the conditions set forth by the insurer.\n\nAdditionally, the death of any passenger involved in an accident also triggers the provision for compensation according to the terms of the insurance policy. This means that if a passenger suffers a fatality, the policy may cover compensation for their death, offering a financial safety net in these unfortunate circumstances. \n\nIn summary, both DEATH and COMPENSATION are integral elements within the framework of insurance policies, particularly relating to accidents, ensuring that adequate financial support is available to those affected by such losses, as long as the conditions of the policy are met.   16.0     1        True
26  789           PERSONAL ACCIDENT COVER                                    HIRER                                                                                                                                                                                                                                                                                                                                                                                                                                                                                                                                                                                                                                                                                                                                                                                                                                                                                                                                                                                                                        The Personal Accident Cover applies to unnamed hirers, providing compensation for injuries sustained while using the insured vehicle.    8.0     1        True
27  812                               IMT         WORKMEN’S COMPENSATION ACT, 1923                                                                                                                                                                                                                                                                                                                                                                                                                                                                                                                                                                                                                                                                                                                                                                                                                                                                                                                                                                                                                                                  IMT provides coverage for legal liabilities arising under the provisions of the Workmen's Compensation Act.    8.0     1        True
28  833         FATAL ACCIDENTS ACT, 1855         WORKMEN’S COMPENSATION ACT, 1923                                                                                                                                                                                                                                                                                                                                                                                                                                                                                                                                                                                                                                                                                                                                                                                                                                                                                                                                                                                                        Both acts provide legal frameworks for compensation related to injury and death of individuals in workplace settings, particularly in transportation.    1.0     1        True
29   33                  DEDUCTION AMOUNT                        INSURANCE COMPANY                                                                                                                                                                                                                                                                                                                                                                                                                                                                                                                                                                                                                                                                                                                                                                                                                                                                                                                                                                                                                                                                     The deduction amount specifies the limits of the Insurance Company's liability in claims    1.0     1        True
30   73                      COMPENSATION            PAID DRIVER/CLEANER/CONDUCTOR                                                                                                                                                                                                                                                                                                                                                                                                                                                                                                                                                                                                                                                                                                                                                                                                                                                                                                                                                                                                                                               Compensation covers paid drivers/cleaners/conductors for injuries incurred while operating the insured vehicle    1.0     1        True
31   79                LIMIT OF LIABILITY                                   DAMAGE                                                                                                                                                                                                                                                                                                                                                                                                                                                                                                                                                                                                                                                                                                                                                                                                                                                                                                                                                                                                                                              The limit of liability defines the maximum payout the insurer is liable for in the event of damage to property.    1.0     1        True
32  591                        CO-PAYMENT  ICICI LOMBARD GENERAL INSURANCE COMPANY                                                                                                                                                                                                                                                                                                                                                                                                                                                                                                                                                                                                                                                                                                                                                                                                                                                                                                                                                                                                                                                     ICICI Lombard General Insurance Company specifies co-payment clauses in their health insurance policies.    5.0     1        True
33   70  UNNAMED HIRER/PILLION PASSENGERS                  PERSONAL ACCIDENT COVER                                                                                                                                                                                                                                                                                                                                                                                                                                                                                                                                                                                                                                                                                                                                                                                                                                                                                                                                                                                                                                                  Unnamed hirers and pillion passengers are included in the terms of Personal Accident Cover for compensation    1.0     1        True
34  790           PERSONAL ACCIDENT COVER                        PILLION PASSENGER                                                                                                                                                                                                                                                                                                                                                                                                                                                                                                                                                                                                                                                                                                                                                                                                                                                                                                                                                                                                                              The Personal Accident Cover is applicable to unnamed pillion passengers for injuries incurred while riding the insured vehicle.    8.0     1        True
35  791                        ANY PERSON                  PERSONAL ACCIDENT COVER                                                                                                                                                                                                                                                                                                                                                                                                                                                                                                                                                                                                                                                                                                                                                                                                                                                                                                                                                                                                                                 Any person involved with the insured vehicle is entitled to the Personal Accident Cover for injuries sustained during usage.    1.0     1        True
36   63                            IMT 15               WORKMEN'S COMPENSATION ACT                                                                                                                                                                                                                                                                                                                                                                                                                                                                                                                                                                                                                                                                                                                                                                                                                                                                                                                                                                                                     IMT 15 references the Workmen's Compensation Act, indicating the coverage of those employed and specifies conditions for compensation based on this Act.    4.0     1        True
37  637                       SUM INSURED                                 BENEFITS                                                                                                                                                                                                                                                                                                                                                                                                                                                                                                                                                                                                                                                                                                                                                                                                                                                                                                                                                                                                                        The Sum Insured is the financial cap that defines the extent of available Benefits provided to the Insured Person for covered events.    1.0     1        True

===== ENTITIES =====

     id                            entity                                                                                                                                                                                                                                                                                                                                                                                                                                                                                                                                                                                                                                                                                                                                                                                                                                                                                                                                                                                                                                                                                                                                                                                                                                                                                                                                                                                                                                                                                                                                                                                        description number of relationships  in_context
0   387                COMPENSATION LIMIT                                                                                                                                                                                                                                                                                                                                                                                                                                                                                                                                                                                                                                                                                                                                                                                                                                                                                                                                                                                                                                                                                                                                                                                                                                                                                                                                                                                                                                                        Compensation limit refers to the maximum amount an insurer is liable to pay for injuries or damages, as stipulated in the policy.)(""entity""                       1        True
1   224                       SUM INSURED                                                                                                                                                                                                                                                                                                                                                                                                                                                                                                                                                                                   The term ""Sum Insured"" pertains to the maximum compensation limit established within an insurance policy, which specifies the benefits payable to the insured individual. This concept is fundamental in insurance coverage, as it establishes the upper threshold of financial protection offered to the policyholder. Specifically, the Sum Insured serves as a crucial factor in determining the payouts in the event of a claim.\n\nIn the context of vehicle insurance, Sum Insured denotes the highest amount that an insurer is willing to pay in the event of loss or damage to the insured vehicle as outlined in the policy. This ensures that the policyholder understands the extent of their coverage and the potential financial support they can expect should they experience a qualifying incident.\n\nOverall, the Sum Insured serves as a pivotal element in both general and vehicle insurance, guiding the financial commitments of the insurer and the expectations of the insured person.                       1        True
2    81         CAPITAL SUM INSURED (CSI)                                                                                                                                                                                                                                                                                                                                                                                                                                                                                                                                                                                                                                                                                                                                                                                                                                                                                                                                                                                                                                                                                                                                                                                                                                                                                                                                                                                                                                                         Capital Sum Insured (CSI) is the maximum liability of the insurer for a covered individual per incident, detailed in the insurance policy.                       1        True
3   509           PAYMENT OF COMPENSATION                                                                                                                                                                                                                                                                                                                                                                                                                                                                                                                                                                                                                                                                                                                                                                                                                                                                                                                                                                                                                                                                                                                                                                                                                                                                                                                                                                                                                     The process by which financial reimbursement is provided to the Insured Person for claims concerning injuries, illnesses, or disabilities as outlined in the insurance policy.                       1        True
4   384                       DISABLEMENT                                                                                                                                                                                                                                                                                                                                                                                                                                                                                                                                                                                                                                                                                                                                                                                                                                                                                                                                                                                                                                                                                                                                                                                                                                                                                                                                                                                                                                                     Permanent total disablement refers to serious injuries resulting in the inability to work, triggering compensation under the insurance policy.                       1        True
5    16                      COMPENSATION                                                                                                                                              Compensation is defined as the financial payment made by the Company, or insurer, for losses or damages incurred by the Insured under the terms of an insurance policy. It encompasses several scenarios, primarily focused on injuries sustained by individuals, including drivers and passengers involved in vehicle incidents. \n\nThe primary function of Compensation is to provide financial indemnity to those affected by accidents, which may involve bodily injury, property damage, or even death. This compensation serves to alleviate the financial burden faced by injured persons or their legal representatives as dictated by the specific guidelines laid out in the insurance policy.\n\nCompensation not only targets personal injuries sustained during vehicular accidents but also extends to cover legal liabilities for injuries incurred by employees operating motor vehicles in the course of their duties. The payments made by the insurer aim to fulfill the obligations of the policy, ensuring that the Insured Person or their representatives receive appropriate financial restitution for losses suffered due to various incidents.\n\nIn summary, Compensation is a broad term that applies to payments made by the insurer in response to claims filed under insurance policies, providing essential support for individuals facing financial strain resulting from injuries or damage incurred in accidents.                      10        True
6   562                             LIMBS                                                                                                                                                                                                                                                                                                                                                                                                                                                                                                                                                                                                                                                                                                                                                                                                                                                                                                                                                                                                                                                                                                                                                                                                                                                                                                                                                                                                                                                                 Refers to physical extremities of the body whose loss or injury qualifies for compensation under the scale provided in the policy.                       1        True
7   492                         BENEFIT 5                                                                                                                                                                                                                                                                                                                                                                                                                                                                                                                                                                                                                                                                                  Benefit 5 is a provision that delineates the Company’s maximum liability concerning hospitalization for an Insured Person. It explicitly specifies the limits of coverage applicable to days of hospital confinement. Additionally, Benefit 5 encompasses the Accidental Hospital Confinement Allowance, which stipulates that the Insured Person will receive daily payments during hospitalization specifically due to injuries sustained from accidents. This benefit ensures financial support for individuals confined to a hospital as a direct result of accidental injuries, reinforcing the Company’s commitment to providing adequate coverage for medical needs arising from such incidents. The dual focus of Benefit 5 on liability limitations and financial assistance highlights its importance in safeguarding the health and well-being of insured individuals during unforeseen circumstances.                       1        True
8   482                       EXTENSION 5                                                                                                                                                                                                                                                                                                                                                                                                                                                                                                                                                                                                                                                                                       Extension 5 is a specific provision that caters to the benefits associated with Permanent Partial Disablement for the Insured Person under the policy. This extension outlines the financial support and advantages accessible to individuals who qualify for coverage due to partial disability resulting from covered events. Furthermore, Extension 5 stipulates the sum insured applicable for claims made under particular circumstances related to the Insured Person. Thus, it provides clarity on the fiscal limits and conditions under which claims can be filed, ensuring that the Insured Person understands their entitlements and the associated coverage they possess in the event of a qualifying incident. Overall, Extension 5 serves to enhance the policy by clearly delineating benefits and financial protections available to the Insured Person facing permanent partial disability.                       2        True
9   218                         FRANCHISE                                                                                                                                                                                                                                                                                                                                                                                                                                                                                                                                                                                                                                                                                                                                                                                                                                                                                                                                                                                                                                                                                                                                                                                                                                                                                                                                                                                                                                                                                            A minimum amount of loss that must be incurred before insurance coverage applies under certain benefits                       1        True
10   85                LIMIT OF LIABILITY                                                                                                                                                                                                                                                                                                                                                                                                                                                                                                                                                                                                                                                                                                                                                                                                                                                                                                  The term ""LIMIT OF LIABILITY"" refers to the specified maximum amount that an insurer is responsible for in the event of a loss or damage to property, excluding the insured vehicle. This limit is crucial in the context of an insurance policy, as it clearly delineates the maximum financial obligation the insurer will fulfill following an accident. Essentially, the limit of liability serves as a financial cap on the coverage provided by the insurance company for various losses or damages. Therefore, it is an integral concept within insurance agreements, helping both insurers and insured parties understand the extent of coverage in the unfortunate event of an accident.                       2        True
11  448                        CO-PAYMENT                                                                                                                                                                                                                                                                                                                                                                                                                                                                                                                                                                                                                                                                                                                                                                                                                                                                                                                                                                                                                                                                                                                                                                                                                                                                                                                                                                                                                 Co-payment is a requirement in health insurance policies where the insured bears a specific percentage of the claim amount, as defined by ICICI Lombard General Insurance Company.                       1        True
12  481                       EXTENSION 4                                                                                                                                                                                                                                                                                                                                                                                                                                                                                                                                                                                                                                                                                                                                                                                                                                                                                                                                                                                                                                                                                                                                                                                                                                                                                                                                                                                                                                                                             Extension 4 details benefits for Permanent Total Disablement as part of the insurance coverage for the Insured Person.                       1        True
13   73                            IMT 15                                                                                                                                                                                                                                                                                                                         IMT 15 is a specific insurance policy that delineates the conditions under which personal accident coverage is applicable for the insured individuals. This coverage is activated during several scenarios, including the mounting and dismounting from the insured vehicle as well as while traveling in it. The policy is designed to offer protection to the insured or named individuals specified in the policy, ensuring they receive personal accident cover in the outlined situations.\n\nHowever, it is important to note that this coverage specifically excludes paid drivers or cleaners. This means that while the insured and other named persons are protected under IMT 15, any professional drivers or individuals employed to clean the vehicle do not qualify for this personal accident coverage. The conditions set forth in IMT 15 serve to clarify the scope and limitations of the insurance protection provided to individuals against personal accidents related to the insured vehicle. \n\nIn summary, IMT 15 details the personal accident coverage available for named insured persons while engaging with the vehicle, specifically during mounting, dismounting, and travel, but it does not extend coverage to paid drivers or cleaners.                       2        True
14   76           PERSONAL ACCIDENT COVER                                                                                                                                                                                                                                                                                                                                                                                                                                                                                                                                                                                                                   Personal Accident Cover is an insurance provision designed to offer compensation for bodily injuries incurred by specific individuals linked to the insured vehicle, adhering to the particular conditions delineated in the policy. This coverage primarily focuses on providing financial support to those who sustain injuries while operating or riding in the insured vehicle.\n\nThe coverage applies to the insured individual, which may include the owner-driver and potentially other designated passengers within the vehicle at the time of the accident. It encompasses a range of benefits aimed at addressing the repercussions of accidents that result in bodily harm. \n\nOverall, Personal Accident Cover serves as an essential safety net for policyholders, ensuring that they receive assistance in the event of personal injuries sustained during vehicle-related incidents, depending on the terms outlined within their individual policy agreements.                       7        True
15   30                  DEDUCTION AMOUNT                                                                                                                                                                                                                                                                                                                                                                                                                                                                                                                                                                                                                                                                                                                                                                                                                                                                                                                                                                                                                                                                                                                                                                                                                                                                                                                                                                                                                                                                         Deduction amount is the specified sum the insurance company will not cover for each claim made under the insurance policy.                       1        True
16  397                            IMT 22                                                                                                                                                                                                                                                                                                                                                                                                                                                                                                                                                                                                                                                                                                                                                                                                                                                                                                                                                                                                                                                                                                                                                                                                                                                                                                                                                                                                                                                 A specific endorsement related to vehicle insurance indicating the deductible amount for certain claims, relevant for policyholders during events.                       1        True
17  116  WORKMEN’S COMPENSATION ACT, 1923  The Workmen’s Compensation Act of 1923 is a significant legal framework in India that governs the provision of compensation for workers who sustain injuries while performing their employment duties. This comprehensive legislation ensures that workers who are injured during their work are provided with financial compensation, thereby safeguarding their rights and supporting their recovery.\n\nThis act specifically addresses cases involving personal injuries that workers might incur in the course of their employment. It is particularly relevant to individuals employed in vehicle operations, including paid drivers and conductors, who may face unique risks in their line of work. The legislation establishes a system of indemnification for these workers, ensuring they receive appropriate financial support in instances of injury.\n\nThrough the Workmen’s Compensation Act, injured workers can claim compensation for their medical expenses, loss of wages, and various other financial needs that arise due to their inability to work as a result of their injuries. This act underscores the societal obligation to protect and compensate workers, thus fostering a safer working environment and promoting overall workforce welfare.\n\nIn summary, the Workmen’s Compensation Act of 1923 not only serves as a critical legal safeguard for workers in India, especially those involved in vehicle operations, but also highlights the importance of financial support systems in promoting the welfare of employees who encounter workplace injuries.                       4        True

===== SOURCES =====

   id                                                                                                                                                                                                                                                                                                                                                                                                                                                                                                                                                                                                                                                                                                                                                                                                                                                                                                                                                                                                                                                                                                                                                                                                                                                                                                                                                                                                                                                                                                                                                                                                                                                                                                                                                                                                                                                                                                                                                                                                                                                                                                                                                                                                                                                                                                                                                                                                                                                                                                                                                                                                                                                                                                                                                                                                                                                                                                                                                                                                                                                                                                                                                                                                                                                                                                                                                                                                                                                                                                                                                                                                                                                                                                                                                                                                                                                                                                                                                                                                                                                                                                                                                                                                                                                                                                                                                                                                                                                                                                                                                                                                                                                                                                                                                                                                                                                                                                                                                                                                                                                                                                                                                                                                                                                                                                                                                                                                                                                                                                                                                                                                                                                                                                                                                                                                                                                                                                                                                                                                                                                                                                                       text
0  61   compensation shall be payable only with the\n        approval of the insured named in the policy and directly\n         to the injured person or his/her legal representative(s)\n       whose receipt shall be a full discharge in respect of\n        the injury of such person.\n        Subject otherwise to the terms exceptions conditions\n       and limitations of this policy.\n       *The Capital Sum Insured (CSI) per person is to be\n         inserted.\n17. IMT. 18. PERSONAL ACCIDENT TO UNNAMED HIRER\n   AND UNNAMED PILLION PASSENGERS (Applicable to\n    Motorised Two wheelers with or without side Car)\n     In consideration of the payment of an additional premium\n       it  is hereby understood and agreed that the insurer\n    undertakes to pay compensation to any unnamed hirer/\n    driver/any unnamed  pillion/sidecar passenger* on the\n    scale provided below for bodily injury caused by violent,\n    accidental, external and visible means whilst mounting\n    into/onto and/or dismounting from or traveling in/on the\n    vehicle insured which independently of any other cause\n     shall within three calendar months of the occurrence of\n    such injury results in:\n\n                                         Scale of    Nature of injury                                     Compensation\n        (i) Death                     100%\n         (ii) Loss of two limbs or sight of two\n       eyes or one Limb and sight of one   100%\n        eye.\n         (iii) Loss of one limb or sight of one eye 50%\n       (iv) Permanent total disablement from                               100%          injuries other than named above.\n\n    Provided always that:\n        I.   Compensation shall be payable under only one of the\n        items (i) to (iv) above in respect of any such person\n         arising out of any one occurrence and total liability of\n        the insurer shall not in the aggregate exceed the sum\n         of `............** during any one period of insurance in\n        respect of any such person.\n        II.  No compensation shall be payable in respect of death\n         or injury directly or indirectly wholly or in part arising\n         or resulting from or traceable to (a) intentional self\n         injury suicide or attempted suicide physical defect\n         or infirmity or (b) an accident happening whilst such\n        person is under the influence of intoxicating liquor or\n        drugs.\n        III.  Such compensation shall be payable only with the\n        approval of the insured named in the policy and directly\n         to the injured person or his/her legal representative(s)\n       whose receipt shall be a full discharge in respect of\n        the injury of such person.\n     IV.  Not more than persons/passengers are in the vehicle\n        insured at the time of occurrence of such injury.\n        Subject otherwise to the terms exceptions conditions\n       and limitations of this policy.\n        *Delete  if P.A. cover for unnamed pillion/side car\n       passenger is not taken.\n        **The Capital Sum Insured (CSI) per passenger is to\n       be inserted.\n18. IMT. 19. COVER FOR VEHICLES IMPORTED WITHOUT\n   CUSTOMS DUTY\n    Notwithstanding anything  to  the  contrary contained\n     in this policy it is hereby understood and agreed that in\n    the event of loss or damage to the vehicle insured and/\n    or its accessories necessitating the supply of a part not\n    obtainable from stocks held in the country in which the\n    vehicle insured is held for repair or in the event of the\n    insurer exercising the option under, * to pay in cash the\n   amount of the loss or damage the liability of the insurer in\n    respect of any such part shall be limited to :-\n        I.   a)  The price quoted in the latest catalogue or the\n             price list issued by the Manufacturer or his Agent\n              for the country in which the vehicle insured is\n            held for repair less depreciation applicable; OR\n         b)    If no such catalogue or price list exists the price\n                  list obtaining at the Manufacturer’s Works plus\n            the reasonable cost of transport otherwise than\n           by air to the country in which the vehicle insured\n                is held for repair and the amount of the relative\n            import duty less depreciation applicable under\n            the Policy; and\n        II.  The reasonable cost of fitting such parts.\n        Subject otherwise to the terms conditions limitations\n       and exceptions of this Policy.\n         *Insert ‘Condition 3’ in the case of the Private Car and\n        Motorsied Two Wheeler Policies and ‘Condition 4’ in\n        the case of Commercial Vehicles Policy.\n19. IMT. 20. REDUCTION IN THE LIMIT OF LIABILITY FOR\n   PROPERTY DAMAGE\n       It is hereby understood and agreed that notwithstanding\n    anything to the contrary contained  in the policy the\n    insurers liability is limited to ` 6000/- (Rupees six thousand\n    only) for damage to property other than the property\n    belonging to the insured or held in trust or in custody or\n    control of the insured. In consideration of this reduction in\n    the limit of liability a reduction in premium of `............*\n     is hereby made to the insured. Subject otherwise to the\n    terms conditions limitations and exceptions of the policy.\n    *To insert ` 100 for Private car, Per year\n20. IMT. 21. SPECIAL EXCLUSIONS AND COMPULSORY\n   DEDUCTIBLE (Applicable to  all Commercial Vehicles\n    excluding taxis and motorized two wheelers carrying\n    passengers for hire or reward.)\n    Notwithstanding anything  to  the  contrary contained\n    herein it is hereby understood and agreed that\n        I.   Special Exclusions Except in the case of Total Loss\n         of the vehicle insured, the insurer
1  87                                                                                                                                                                                                                                                                                                                                                                                                                                                                                                                                                                                                                                                                               nationalistic, political, racial, religious or\n      other ends.\n\n\nIII.     BENEFITS COVERED UNDER THE\nPOLICY SECTION A\nThe Company hereby agrees, subject to the\nterms,  exclusions  and  conditions  herein\ncontained or otherwise expressed hereon, to\npay to the Insured Person (or his Nominee/\nlegal heir, as the case may be) a sum as\ncompensation on occurrence of any Insured\nEvent, as  specifically described hereunder,\nunder different Benefit(s) (and Extensions -  if\nany) arising due to an Injury sustained by the\nInsured Person during the Policy Period but not\nexceeding the Sum Insured as specified under\nthe respective Benefits (and Extensions  -  if\nany) under Section A.\nBenefit 1: Insured Event - Death resulting\nfrom Accident\nThe Company hereby agrees, subject to the\nterms, conditions and exclusions applicable to\nthis Section 2.1 and the terms, conditions,\ngeneral exclusions stated in the Policy, to pay\nsuch Sum  Insured  as  mentioned  against\nBenefit 1 under Section A of Part  I of the\nSchedule to this Policy, on the occurrence of\ndeath of the Insured Person, provided such\ndeath results solely and directly from an Injury,\nwithin twelve months from the date of Accident\nresulting in such Injury. Provided that the date\nof occurrence of the Accident falls within the\nPolicy Period\nBenefit 2: Insured Event - Permanent Total\nDisablement (PTD) resulting from Accident\nThe Company hereby agrees, subject to the\nterms, conditions and exclusions applicable to\nthis Section 2.2 and the terms, conditions,\ngeneral exclusions stated in the Policy, to pay\nsuch Sum Insured, in the manner indicated\nbelow, on the occurrence of any of the following\nlosses, provide such losses to the Insured\nPerson  are  total and  irrecoverable  losses\nwhich result solely and directly from an Injury,\nwithin twelve months from the date of Accident\nresulting in such Injury. Provided that the date\nof occurrence of the Accident falls within the\nPolicy Period/Policy Year:\n     i)  Loss of Use of both eyes, or Physical\n      Separation/ Loss of Use of two entire\n     hands or two entire feet, or one entire\n     hand and one entire foot, or of such Loss\n      of Use of one eye and such Physical\n      Separation/ Loss of Use of one entire\n     hand or one entire foot, then the Sum\n     Insured  as  stated  under  Benefit  2,\n     Section A in the Part I of the Schedule to\n       this Policy hereto as applicable to such\n     Insured Person.\n     ii)  Physical Separation/ Loss of Use of two\n     hands or two feet, or of one hand and one\n       foot, or of Loss of Use of one eye and\n     Loss of Use of one hand or one foot, then\n      the Sum Insured as stated under Benefit\n      2, Section A in Part I of the Schedule to\n       this Policy hereto as applicable to such\n     Insured Person.\n      iii)   If  such   Injury   shall  as  a   direct\n     consequence thereof, permanently, and\n       totally, disable the Insured Person from\n     engaging   in  any  employment   or\n     occupation     of    any    description\n     whatsoever, then the Sum Insured as\n      stated under Benefit 2, Section A in Part\n         I of the Schedule to this Policy hereto as\n      applicable to such Insured Person.\nBenefit 3: Insured Event - Permanent Partial\nDisablement (PPD) resulting from Accident\nThe Company hereby agrees, subject to the\nterms, conditions and exclusions applicable to\nthis Section and the terms, conditions, general\nexclusions stated in the Policy, to pay such\nSum Insured as mentioned against Benefit 3\nunder Section A of Part I of the Schedule to this\nPolicy as applicable to such Insured Person in\nthe manner indicated below, on the occurrence\nof any of the following losses, provided such\nlosses to the Insured Person are irrecoverable\nlosses and result in Loss of Use or Physical\nSeparation which arises solely and  directly\nfrom an Injury, within twelve months from the\ndate of Accident resulting in such Injury.\nProvided that the date of occurrence of the\nAccident falls within the Policy Period/Policy\nYear.  : Losses covered Percentage of Sum\nInsured\n Sr Losses covered                  Percenta\n   .                                ge of\nNo                         Sum\n   .                                      Insured\n 1. Loss of Use/ Physical Separation:\n   One entire hand                   5\n                                   0\n   One entire foot                    5\n                                   0\n 2. Loss of Use of one eye             5\n                                   0\n 3. Loss of toes – all                  2\n                                   0\n    Great both phalanges              5\n 4. Loss of Use of both ears            50\n 5. Loss of Use of one ear             20\n 6. Loss of four fingers and thumb of    40\n   one hand\n 7. Loss of four fingers                35\n 8. Loss of thumb - both phalanges      25\n   One phalanx                     10\n 9. Loss   of  Index   finger-   three    10\n    phalanges\n   Two phalanges                    8\n   One phalanx                      4\n10. Loss  of  middle  finger   -  three    6\n    phalanges\n   Two phalanges
2  33                                                                                                                                                                                                                                                                                                                                                                                                                                                                                                                                                                                                                                                                                     ;\n-   must conform to the professional standards widely\n    accepted in international medical practice or by the\n    medical community in India.\nPre-existing diseases means any condition, ailment, injury or\ndisease:\na)  That is/are diagnosed by a physician within 48 months\n     prior to the effective date of the policy issued by the insurer\n    or its reinstatement or\nb)  For which medical advice or treatment was recommended\n     by, or received from, a physician within 48 months prior to\n    the effective date of the policy issued by the insurer or its\n    reinstatement.\n“Telephonic/Virtual Consultation” shall mean any consultations\nprovided by Medical Practitioners/Healthcare Professionals\nthrough a virtual mode of communication, such as via audio,\nvideo, online portal, chat or mobile application for routine health\nquery or second opinion.\nSpeciﬁc Exclusions:\na.  Any expenses related to a sickness, disease or medical\n    disorder not directly consequential to accident.\nb.  Any expenses related to pre-existing diseases or medical\n     disorders, except for Tele consultation service\nc.  Any physiotherapy treatment.\nd.  Any expense not supported by an original and valid bill /\n     receipt and related prescription of the attending Medical\n     Practitioner / Hospital / Nursing Home.\ne.  Any expenses for treatment commenced after 3 days from\n    the date of accident.\nf.   Not more than sum-insured as mentioned in the schedule\n    during per policy tenure.\ng.  Any expense arising or resulting from or traceable to\n    intentional self- injury, suicide or attempted suicide\n    physical defect or inﬁrmity.\nh.  Any expense arising or resulting from or traceable to an\n    accident happening due to the inﬂuence of intoxicating\n     liquor or drugs.\nSubject otherwise to the terms exceptions condition &\nlimitations of the policy.\n13. Motor Floater\nUIN: IRDAN115RP0017V01200102/A0009V01202223\nIn consideration of the payment of `........................ by the\nInsured, it is hereby agreed and declared that notwithstanding\nanything to the contrary contained in the Policy, the Company\nhereby undertakes to offer below mentioned beneﬁts:\nBeneﬁt offered\n•   To offer a single policy irrespective of the number of\n    vehicles owned by proposer* and an option to have\n     different sub-limits/IDV for each vehicle.\n•   Different vehicle may have different risk start date, based\n   on the respective due dates of insurance of each vehicle.\n    However, the risk end date of all the vehicles would be\n    aligned with the risk end date of the vehicle which has the\n     earliest risk start date.\n\n Components       PVT 01  PVT 02   TW 01\n\n Previous Year Policy    8-Jul-22  10-Aug-22  15-Sep-22\n End date\n\n Floater Policy Risk     9-Jul-22  11-Aug-22  16-Sep-22\n Start Date\n\n Floater Policy Risk     8-Jul-23   8-Jul-23     8-Jul-23\n End Date\n\n•  As shown above, the risk end date of all the 3 vehicles are\n    aligned which will help insured to have similar risk start\n    date during next renewal.\n•   For aligning the risk start dates the premiums are\n    calculated on pro rata basis, wherever the risk period of the\n    vehicle is less than 12 months.\nExplanation & deﬁnitions of Add on features-\n•   *Proposer for Motor Floater is deﬁned as an individual who\n    can pool their-own or their family member's vehicles in a\n    single policy using the Motor Floater add-on.\n•   Family shall mean & include the proposer and any one or\n   more of the family members as mentioned below:\n       (I)  Legally wedded spouse.\n       (ii)  Parents and Parents-in-law.\n       (iii) Children (i.e. natural or legally adopted)\n      (iv) And siblings of the proposer\n•  Sum Insured for the purpose of Motor Floater Add-on\n   would mean-\n   Summation of Insured declared value (IDV) of each of the\n    vehicles covered in the ﬂoater policy will be the Motor\n    Floater Sum-Insured**.\n*IDV is deﬁned as the amount which is determined and agreed\nupon between the insurer and the proposer/insured with\nrespect to any insured vehicle at the inception of the policy\nperiod, up to which indemniﬁcation shall be allowed in case of\nloss in any single incidence/event.\n**Motor Floater Sum-Insured  is deﬁned as the maximum\namount in case of any single incidence/event, available to be\nutilised by any/all the vehicles covered under the Floater Policy\nsubject to the individual vehicle IDV. The Sum Insured can\nchange on renewal or with mid-term inclusion & exclusion of a\nvehicle.\n•   Mid Term inclusion of vehicles-\n    Proposer/ insured can add a new vehicle to the motor ﬂoater\n    during the currency of the policy provided that it falls under\n    the preview of the add-on. Premium for such vehicle\n    included shall be paid by proposer/ insured as a separate\n    charge calculated on pro rata basis for the remaining period\n     of the policy. The ﬂoater sum insured would get increased to\n    the extent of IDV of new vehicles added.\n•   Mid Term exclusion of vehicles-\n    Mid Term exclusion may be necessitated by total loss/ Cash\n    Loss/Constructive Total Loss (CTL)/ total-theft of a vehicle\n    or
3   9                                                                                                                                                                                                                                                                                                                     ... ** persons/passengers are in the\n     vehicle insured at the time of occurrence of such injury.\nSubject otherwise to the terms exceptions conditions and\nlimitations of this policy.\n* The Capital Sum Insured (CSI) per passenger is to be inserted.\n** The registered sitting capacity of the vehicle insured is to be\ninserted.\n\n17.  IMT. 17. PERSONAL ACCIDENT COVER TO PAID\nDRIVERS, CLEANERS AND CONDUCTORS: (Applicable to all\nclasses of vehicles)\n\nIn consideration of the payment of an additional premium, it is\nhereby understood and agreed that the insurer undertakes to\npay compensation on the scale provided below for bodily injury\nas hereinafter deﬁned sustained by the paid driver/\ncleaner/conductor in the employ of the insured in direct\nconnection with the vehicle insured whilst mounting into\ndismounting from or traveling in the insured vehicle and caused\nby violent accidental external and visible means which\nindependently of any other cause shall within six calendar\nmonths of the occurrence of such injury result in :\n Nature of injury                          Scale of\n                              CompensaƟon\n (I)  Death                         100%\n (ii) Loss of two limbs or sight of two       100%\n    eyes or one limb and sight of one eye\n  (iii) Loss of one limb or sight of one eye     50%\n (iv) Permanent total disablement from     100%\n     injuries other than named above\n\nProvided always that\nI.   Compensation shall be payable under only one of the items\n       (I) to (iv) above in respect of any such person arising out of\n    any one occurrence and total liability of the insurer shall not\n     in the aggregate exceed the sum of `____* during any one\n    period of insurance in respect of any such person.\nII.  No compensation shall be payable in respect of death or\n     injury directly or indirectly wholly or in part arising or\n     resulting from or traceable to\n     (a) intentional self injury suicide or attempted suicide\n        physical defect or inﬁrmity or (b) an accident\n       happening whilst such person is under the inﬂuence of\n         intoxicating liquor or drugs.\nIII.  Such compensation shall be payable only with the\n    approval of the insured named in the policy and directly to\n    the injured person or his/ her legal representative(s) whose\n     receipt shall be a full discharge in respect of the injury of\n    such person.\nSubject otherwise to the terms exceptions conditions and\nlimitations of this policy.\n* The Capital Sum Insured (CSI) per person is to be inserted.\n18. IMT. 18. PERSONAL ACCIDENT TO UNNAMED HIRER\nAND UNNAMED PILLION PASSENGERS (Applicable to\nMotorised Two wheelers with or without side Car)\nIn consideration of the payment of an additional premium it is\nhereby understood and agreed that the insurer undertakes to\npay compensation to any unnamed hirer/driver/any unnamed\npillion/sidecar passenger* on the scale provided below for\nbodily injury caused by violent, accidental, external and visible\nmeans whilst mounting into/onto and/or dismounting from or\ntraveling in/on the vehicle insured which independently of any\nother cause shall within three calendar months of the\noccurrence of such injury results in :\n\n Nature of injury                          Scale of\n                              CompensaƟon\n (I)  Death                         100%\n (ii) Loss of two limbs or sight of two       100%\n    eyes or one limb and sight of one eye\n  (iii) Loss of one limb or sight of one eye     50%\n (iv) Permanent total disablement from     100%\n     injuries other than named above\nProvided always that:\nI.   Compensation shall be payable under only one of the items\n        (i) to (iv) above in respect of any such person arising out of\n    any one occurrence and total liability of the insurer shall not\n     in the aggregate exceed the sum of `______** during any\n    one period of insurance in respect of any such person.\nII.  No compensation shall be payable in respect of death or\n     injury directly or indirectly wholly or in part arising or\n     resulting from or traceable to (a) intentional self injury\n     suicide or attempted suicide physical defect or inﬁrmity or\n     (b) an accident happening whilst such person is under the\n    inﬂuence of intoxicating liquor or drugs.\nIII.  Such compensation shall be payable only with the\n    approval of the insured named in the policy and directly to\n     the injured person or his/her legal representative(s) whose\n     receipt shall be a full discharge in respect of the injury of\n    such person.\nIV.  Not more than ...................... persons/passengers are in the\n     vehicle insured at the time of occurrence of such injury.\nSubject otherwise to the terms exceptions conditions and\nlimitations of this policy.\n* Delete if P.A. cover for unnamed pillion/side car passenger is\nnot taken.\n** The Capital Sum Insured (CSI) per passenger is to be inserted.\n19.  IMT. 19. COVER FOR VEHICLES IMPORTED WITHOUT\nCUSTOMS DUTY\nNotwithstanding anything to the contrary contained in this\npolicy it is hereby understood and agreed that in the event of\nloss or damage to the vehicle insured and/or its accessories\nnecessitating the supply of a part not obtainable from stocks\nheld in the country in which the vehicle insured is held for repair\nor in the event of the insurer exercising the option under\n...................... * to pay in cash the amount of the loss or damage the\nliability of the insurer in respect of any such part shall","## Understanding Capital Sum Insured and Compensation

When an injury qualifies for 50% compensation under a policy with a Capital Sum Insured (CSI) of ₹15 lakh, the total potential compensation amount for that claim is calculated as follows:

- **Capital Sum Insured (CSI):** ₹15,00,000
- **Compensation Qualification:** 50%

### Calculation of Paid and Unpaid Compensation

1. **Total Compensation for the Injury:**
   \[
   \text{Total Compensation} = \text{CSI} \times \text{Compensation Qualification} = ₹15,00,000 \times 0.50 = ₹7,50,000
   \]

2. **Remaining Unpaid Compensation:**
   Since the total value of the qualification is ₹7,50,000, the unpaid compensation would consist of the remaining 50% of the CSI:
   \[
   \text{Unpaid Compensation} = \text{CSI} - \text{Total Compensation} = ₹15,00,000 - ₹7,50,000 = ₹7,50,000
   \]

3. **Percentage of Unpaid Compensation:**
   The percentage of total compensation that remains unpaid can be calculated as follows:
   \[
   \text{Percentage of Unpaid Compensation} = \left( \frac{\text{Unpaid Compensation}}{\text{CSI}} \right) \times 100 = \left( \frac{₹7,50,000}{₹15,00,000} \right) \times 100 = 50\%
   \]

### Conclusion

In this scenario, since the injury qualifies for 50% compensation, **50% of the total compensation remains unpaid** under the policy. The monetary value of this unpaid portion amounts to **₹7,50,000**. 

This situation illustrates how insurance policies allocate compensatory amounts based on the terms and conditions of the contract and the nature of the injury sustained. Understanding these calculations is crucial for policyholders to know their coverage and potential out-of-pocket costs in the event of a claim.",8197.92,,,
"A policyholder suffers two independent injuries during different policy periods: one resulting in the loss of one limb (50%) and another later resulting in permanent total disablement (100%) and the total cover is 18 Lacs. Based on the compensation percentages alone, what total compensation would be paid across both claims if each claim is covered separately under its respective policy period? Show the calculation.","First claim = 50% × ₹15,00,000 = ₹7,50,000. Second claim = 100% × ₹15,00,000 = ₹15,00,000. Total compensation across both separate claims = ₹22,50,000.",,"===== REPORTS =====

  id                                     title                                                                                                                                                                                                                                                                                                                                                                                                                                                                                                                                                                                                                                                                                                                                                                                                                                                                                                                                                                                                                                                                                                                                                                                                                                                                                                                                                                                                                                                                                                                                                                                                                                                                                                                                                                                                                                                                                                                                                                                                                                                                                                                                                                                                                                                                                                                                                                                                                                                                                                                                                                                                                                                                                                                                                                                                                                                                                                                                                                                                                                                                                                                                                                                                                                                                                                                                                                                                                                                                                                                                                                                                                                                                                                                                                                                                                                                                                                                                                                                                                                                                                                                                                                                                                                                                                                                                                                                                                                                                                                                                                                                                                                                                                                                                                                                                                                                                                                                                                                                                                                                                                                                                                                                                                                                                                                                                                                                                                                                                                                                                                                                                                                                                                                                                         content
0  0  Motor Vehicle Insurance Community Report  # Motor Vehicle Insurance Community Report\n\nThe report encompasses the interrelated entities forming the Motor Vehicle Insurance community, including various aspects such as vehicle coverage, compensation mechanisms, and documentation required for claims. The entities are connected through insurance policies that dictate the terms under which risks are covered and claims can be processed, highlighting both legal and operational frameworks in motor insurance.\n\n## Vehicle Coverage under Insurance Policies.\n\nThe primary entity, Vehicle Insured, denotes any automobile covered under an insurance policy, safeguarding against risks associated with accidents and damages. Insurance policies can vary widely, stipulating individual terms and conditions including premium payments and coverage limits, which create a structured approach for compensating policyholders in case of incidents. The relationships indicate that each vehicle insured is linked to an insurer that evaluates the risks before issuing a policy, emphasizing the importance of thorough risk assessment in this community [Data: Entities (82); Relationships (469)].\n\n## Importance of Compensation Mechanisms.\n\nThe community utilizes a structured compensation framework that outlines financial payments for losses arising from vehicular incidents. The Compensation entity encapsulates payments for bodily injuries, damages, and legal liabilities that may occur with insured vehicles, providing essential financial support to affected parties. This mechanism ensures that victims of accidents are reimbursed, thus enforcing a balance between operational safety and financial responsibility, underlined by explicit claims provisions within insurance policies [Data: Entities (16, 72); Relationships (410)].\n\n## Diverse Types of Insurance Claims.\n\nClaims in this community can stem from various events, including bodily injury, vehicle damage, and even incidents leading to death. Each type of claim is governed by specific guidelines defined in insurance policies, influencing how claimants can seek financial restitution. As highlighted, the need for supporting documents such as Medical Certificates and Disability Certificates underlines the rigorous substantiation needed for each type of insurance claim, promoting responsible and fair processing of claims amidst diverse circumstances [Data: Entities (23, 359, 685); Relationships (393, 409)].\n\n## Role of Alternative Fuel Technologies.\n\nThe inclusion of equipment like the CNG/LPG Kit in insured vehicles introduces an environmentally friendly dimension to the community. Policies extending coverage to such kits further highlight the increased emphasis on sustainable practices within vehicular insurance. This aspect caters to a growing segment of vehicle owners who prioritize cleaner fuel options, thus expanding the insurance landscape to adapt to ecological concerns while ensuring adequate coverage against potential damages [Data: Entities (95); Relationships (91)].\n\n## Legal and Regulatory Compliance.\n\nThe interplay between various entities such as insurance policies and national standards showcases the legal framework safeguarding motor vehicle insurance practices. The stipulations defined under the policies ensure compliance with relevant legislative requirements, including those related to the Ministry of Defence, ensuring protection for drivers employed in contexts that involve state support. This relationship underscores the necessity for insurers to align with regulatory bodies, thus reinforcing accountability and legal adherence to best practices in insurance [Data: Entities (86); Relationships (112)].\n\n## Documentation Challenges in Claim Processing.\n\nThe efficiency of claim processing is heavily reliant on the submission of complete and accurate documentation, as outlined in claims protocols. Instances of missing documents can significantly delay the approval of claims, emphasizing the importance of thoroughness in the claims process. The requirement for items such as PAN Cards, NEFT Mandate Forms, and Treatment Papers further complicates the landscape, where claimant compliance directly influences claim outcomes [Data: Entities (517, 700); Relationships (696, 684)].\n\n## Impact of Violent Accidents.\n\nViolent Accidents, defined as incidents resulting in bodily injury or death due to clear external causes, trigger specific discussions around insurance compensation. The community must account for these incidents distinctly, given their serious implications for policyholders. The insurance policies incorporated often include stipulations that outline how such cases are managed financially, which is crucial for maintaining public trust and ensuring that obligations are met promptly in dire situations [Data: Entities (354); Relationships (377)].\n\n## Interconnection with the Motor Trade.\n\nEntities involved in the Motor Trade, including dealers and service providers, interact closely with the motor vehicle insurance community by facilitating purchases and servicing of insured vehicles. This interrelationship enhances the overall value of motor vehicle insurance, as service providers ensure that vehicles remain compliant and functional under the respective insurance policies. Furthermore, the alignment of motor vehicle insurance with industry trends in vehicle sales and repairs plays a pivotal role in maintaining competitive and responsive market conditions [Data: Entities (133, 141); Relationships (152)].
1  4         ICICI Lombard Insurance Community                                                                                                                                                                                                                                                                                                                                                                                                                                                                                                                                                                                                                                                                                                                                                                                                                                                                                                                                                                                                                                                                                                                                                                                                                   # ICICI Lombard Insurance Community\n\nThe ICICI Lombard Insurance community encompasses various entities that are deeply interconnected through insurance policies and coverage provisions. Primary entities include the Insured Person, ICICI Lombard General Insurance Company, hospitals, and various benefit extensions such as Daily Cash and Ambulance Cover. The community functions with contractual relationships and obligations, where the insured individuals maintain rights and responsibilities under their policies, which are crucial in ensuring proper insurance coverage and claims processing.\n\n## Critical Role of Insured Persons\n\nInsured Persons are at the core of the ICICI Lombard Insurance community, representing individuals who are covered under insurance policies. These individuals have the right to claim benefits for a range of medical expenses, including hospitalization and ambulance services due to accidents. Under the insurance policy, the Insured Person also has the responsibility to report any claims or changes in their risk profile to the company to maintain coverage validity. This relationship defines the fundamental purpose of insurance: to provide financial security during unforeseen medical incidents [Data: Entities (212); Relationships (230, 617)].\n\n## Significance of ICICI Lombard General Insurance Company\n\nICICI Lombard General Insurance Company is the main entity providing insurance coverage to the Insured Persons within this community. As a prominent provider in India, the company outlines specific terms in insurance policies, enabling Insured Persons to receive financial protection against medical expenses and accidents. The company facilitates the claims process, which is essential for ensuring that the Insured Persons can navigate their recovery and financial obligations effectively following incidents covered under the policy [Data: Entities (466); Relationships (617)].\n\n## Role of Hospitals in Healthcare Access\n\nHospitals are vital in the ICICI Lombard community as they are the institutions where Insured Persons receive treatment following accidents or medical emergencies. The relationship between hospitals and Insured Persons is founded on the need for medical care and the need to process insurance claims for hospitalization. The involvement of hospitals underscores the importance of complying with quality standards and regulations outlined in the Clinical Establishments Act, which ensures trust in the healthcare provision within the community [Data: Entities (173); Relationships (223)].\n\n## Hospitalization Benefits and Coverage\n\nHospitalization is a critical aspect for Insured Persons, as it triggers various claims to be filed with ICICI Lombard for financial support against medical expenses incurred during inpatient care. Provisions such as Hospital Daily Cash and Post-Hospitalization Medical Expenses reflect the need for comprehensive coverage, offering financial relief to Insured Persons during their recovery phase. These aspects of the policy are designed to alleviate the economic burden of medical care following unexpected accidents [Data: Entities (496, 258); Relationships (286, 677)].\n\n## Claim Procedures and Documentation\n\nThe community is structured around explicit procedures that Insured Persons must follow to successfully submit insurance claims. This includes filling out the Claim Form and adhering to the Claim Procedure, necessary for processing requests for reimbursement of medical expenses. A clear understanding and compliance with these protocols are crucial for effective claims management, ensuring that Insured Persons receive timely financial support for their medical needs arising from accidents [Data: Entities (153, 598); Relationships (167)].\n\n## Implications of Cancellations and Fraudulent Claims\n\nThe cancellation of policies and the presence of fraudulent claims represent critical challenges within the ICICI Lombard community. Fraudulent claims can lead to penalties and a forfeiture of benefits under an insurance policy, emphasizing the need for honesty and transparency in all dealings with the insurer. Such measures ensure that the sustainability of the insurance model remains intact, protecting both the company and the insured individuals from losses [Data: Entities (38); Relationships (43, 720)].

===== RELATIONSHIPS =====

     id                            source                                   target                                                                                                                                                                                                                                                                                                                                                                                                                                                                                                                                                                                                                                                                                                                                                                                                                                                                                                                                                                                                                                                                                                                                                  description weight links  in_context
0   410                     BODILY INJURY                             COMPENSATION                                                                                                                                                                                                                                                                                                                                                                                                                                                                                                                                                                                                                                                                                                                                                                                                                                                                                                                                                                                                                                                    Compensation is available for losses due to bodily injury claims under the terms of the insurance policy.    7.0     2        True
1   450                       DISABLEMENT                             COMPENSATION                                                                                                                                                                                                                                                                                                                                                                                                                                                                                                                                                                                                                                                                                                                                                                                                                                                                                                                                                                                                                                                   Permanent total disablement is a condition under which compensation is paid based on the policy provisions    1.0     1        True
2   796                             LIMBS                            BODILY INJURY                                                                                                                                                                                                                                                                                                                                                                                                                                                                                                                                                                                                                                                                                                                                                                                                                                                                                                                                                                                                                                                  Loss of limbs is a specific example of a bodily injury eligible for compensation under the insurance policy    9.0     2        True
3    95                           INSURER                                   PERSON                                                                                                                                                                                                                                                                                                                                                                                                                                                                                                                                                                                                                                                                                                                                                                                                                                                                                                                                                                                                                                        The insurer has responsibilities in providing coverage for the liabilities of paid drivers, conductors, and cleaners.    8.0     5        True
4   452                           INSURER                             COMPENSATION                                                                                                                                                                                                                                                                                                                                                                            The insurer plays a crucial role in providing financial protection and peace of mind to policyholders. In the event of an accident covered by the insurance policy, the insurer is responsible for paying compensation to the insured or their legal representatives. This ensures that individuals or their beneficiaries receive the necessary support to recover from the financial burdens that may arise due to the accident. The compensation process is a fundamental aspect of the insurer's obligations, highlighting their commitment to safeguarding the interests of those they have contracted to protect. Ultimately, the insurer's responsibility to provide compensation underscores the importance of having an insurance policy in place for unforeseen events.   16.0     5        True
5    65                           INSURER                  PERSONAL ACCIDENT COVER                                                                                                                                                                                                                                                                                                                                                                                                                                                                                                                                                                                                                                                                                                                                                                                                                                                                                                                                                                                                                                            The insurer provides personal accident cover as part of the insurance policy for those using the insured vehicle.    5.0     5        True
6   520                     BODILY INJURY                                  INSURER                                                                                                                                                                                                                                                                                                                                                                                                                                                                                                                                                                                                                                                                                                                                                                                                                                                                                                                                                                                                                                                              Claims for Bodily Injury can lead to liabilities that the Insurer must address under the policy    7.0     5        True
7   457                COMPENSATION LIMIT                                  INSURER                                                                                                                                                                                                                                                                                                                                                                                                                                                                                                                                                                                                                                                                                                                                                                                                                                                                                                                                                                                                                                                            The insurer sets a compensation limit within which claims must be settled according to the policy    1.0     5        True
