question,expected_answer,source,retrieved_context,generated_answer,total_latency_ms,prompt_tokens,completion_tokens,total_tokens,cost
"What is the total liability cap for the owner-driver personal accident cover bundled with a private car's own-damage and third-party cover, and what percentage of that sum is paid for accidental death?","The total liability of the insurer is capped at Rs. 15 lakhs during any one period of insurance, and 100% of the sum is payable on death.","private-car-package-policy-wording.txt — Section III, Personal Accident Cover for Owner-Driver, Proviso I","===== REPORTS =====
   id                                         title                                                                                                                                                                                                                                                                                                                                                                                                                                                                                                                                                                                                                                                                                                                                                                                                                                                                                                                                                                                                                                                                                                                                                                                                                                                                                                                                                                                                                                                                                                                                                                                                                                                                                                                                                                                                                                                                                                                                                                                                                                                                                                                                                                                                                                                                                                                                                                                                                                                                                                                                                                                                                                                                                                                                                                                                                                                                                                                                                                                                                                                                                                                                                                                                                                                                                                                                                                                                                                                                                                                                                                                                                                                                                                                                                                                                                                                                                                                                                                                                                                                                                                                                                                                                                                                                                                                                                                                                                                                                                                                                                                                                                                                                                                                                                                                                                                                                                                                                                                                                                                                                                                                                                                                                                                                                                                                                                                                                                                                                                                                                                                                                                                                                                                                                                                                                   content
0   5  Insurance Regulation and Liability Framework                                                                                                                                                                                                                                                                                                                                                                                                                                                                                                                                                                                                                                                                                                                                                                                                                                                                                                                                                                                                                                                                                                                                                                                                                                                                                                                                                                                                                                                                                                                                                                            # Insurance Regulation and Liability Framework\n\nThis community consists primarily of the Insurer, the Motor Vehicles Act, 1988, and the Workmen’s Compensation Act, with their interrelations defining vehicle insurance and employee liability coverage in India. The Insurer provides foundational services under these regulatory frameworks, ensuring compliance with various legal obligations while managing risks related to motor vehicle operations and workplace injuries.\n\n## Insurer's Role in Vehicle Coverage\n\nThe Insurer plays a fundamental role by offering comprehensive insurance coverage for vehicles against various risks such as theft, accidents, and environmental damages. This coverage is detailed in policies that specify liability terms, ensuring vehicle owners are adequately protected and any claims are managed efficiently. The insurer is obliged to follow the regulations specified in the Motor Vehicles Act, 1988, which governs the operational standards, ensuring their services align with legal requirements [Data: Entities (57); Relationships (56, 100)].\n\n## Motor Vehicles Act, 1988's Impact on Insurance\n\nThe Motor Vehicles Act, 1988 establishes the legal framework within which the Insurer operates. It necessitates compliance from insurers regarding vehicle registration, insurance requirements, and liability coverage. By imposing specific standards and regulations, this Act ensures that insurers fulfill their responsibilities towards policyholders, promoting road safety and minimizing risks associated with vehicle use. The Act also addresses the obligations of both vehicle operators and insurers, effectively integrating their responsibilities [Data: Entities (96); Relationships (100, 122)].\n\n## Workmen’s Compensation Act and Employment Liabilities\n\nThe Workmen’s Compensation Act provides critical legal guidelines for employee compensation in the event of workplace injuries. It outlines the Insurer's responsibility to cover liabilities under this Act, ensuring that workers are compensated without needing to prove employer negligence. This regulatory framework is vital in protecting workers' rights and promoting a safe working environment, making the insurer's role pivotal in managing these liabilities effectively [Data: Entities (75, 383); Relationships (126, 449)].\n\n## Compliance with Regulatory Requirements\n\nThe Insurer is bound to comply with various legal requirements established by regulations such as the Motor Vehicles Act and the Workmen's Compensation Act. This compliance not only ensures that the insurer operates within legal boundaries but also protects the interests of policyholders, enforcing standards that guarantee adequate compensation for vehicle damages and workplace injuries. Such regulatory adherence is fundamental in maintaining public trust in the insurance landscape [Data: Relationships (100, 449)].\n\n## Potential Risks and Their Impact\n\nVarious risks are recognized by the insurer, including damage due to explosions, theft, and environmental factors such as storms and inundation. These risks are delineated in the insurance policy, which outlines specific coverage areas. Understanding these risks is critical, as they directly affect the insurer's liability and the financial protection offered to policyholders. The insurer's approach to managing these risks significantly influences its operational strategy and policy effectiveness [Data: Entities (65, 68, 70, 76); Relationships (763, 774)].\n\n## Claims Management Process\n\nThe claims management process is a vital aspect of the insurer's responsibilities, particularly in the context of the Motor Vehicles Act and the Workmen's Compensation Act. Efficient claims processing ensures that policyholders receive compensation timely for losses incurred, reinforcing the insurer's credibility in the market. This process is guided by specific policy stipulations and regulatory compliance, highlighting the importance of a streamlined approach to managing claims [Data: Entities (57); Relationships (449, 100)].
1  10   Vehicle Insurance Community - ICICI Lombard  # Vehicle Insurance Community - ICICI Lombard\n\nThe community centers around ICICI Lombard, an insurance provider specializing in vehicle-related coverage and services. Key entities within this community include the Company, Owner-Driver, Customer, and various insurance products such as Motor Third Party Liability Insurance. The relationships among these entities highlight the comprehensive support offered to clients, particularly regarding accident coverage, claims management, and compliance with legal standards.\n\n## ICICI Lombard's role as a leading insurance provider\n\nICICI Lombard serves as a pivotal entity in the vehicle insurance sector, providing a wide range of insurance products aimed at protecting vehicle owners. This organization not only offers liability and indemnity coverage but also additional services such as roadside assistance and accommodation for clients in distress. This comprehensive portfolio ensures that the Company meets diverse client needs, thereby significantly improving customer reliance and trust in its services. Furthermore, it facilitates numerous claims and insurances supporting various scenarios, such as accidents and theft. [Data: Entities (0); Relationships (3, 17, 330, 38, 19, +more)]\n\n## The Owner-Driver's responsibilities under the insurance policy\n\nThe Owner-Driver is defined as an individual who owns and operates a vehicle, thus must meet specific obligations set forth by the insurance policy held with ICICI Lombard. The Owner-Driver's designation is critical since they are entitled to compensation under the policy for damages incurred in accidents. Their role extends beyond ownership as they must ensure compliance with legal requirements, such as maintaining a valid driver's license and understanding the terms of the indemnity policy. This dual responsibility underlines the significance of the Owner-Driver's role in mitigating risks and ensuring the effective use of insurance coverage. [Data: Entities (19); Relationships (17)]\n\n## Consumer insights into the insurance products\n\nCustomers of ICICI Lombard engage with a spectrum of insurance products tailored to vehicle protection, highlighting the essential inclusion of Motor Third Party Liability Insurance. This insurance is mandated by law, ensuring vehicle owners can fulfill legal obligations pertaining to damages caused by their vehicles. It demonstrates the company’s adherence to regulatory standards and commitment to public safety while offering financial protection to clients. Additionally, the acquisition of ancillary services, such as accommodation and roadside assistance, reflects ICICI Lombard’s responsive customer service ethos. [Data: Entities (289); Relationships (17, 38)]\n\n## Liability coverage enhancing road safety\n\nMotor Third Party Liability Insurance is a stand-alone product that underscores the legal framework governing vehicle insurance in the community. This provision ensures that vehicle owners can cover damages to third parties, significantly contributing to road safety and accountability. By mandating this coverage, ICICI Lombard promotes financial responsibility among drivers and mitigates potential financial repercussions from accidents involving their insured vehicles. The establishment of these coverage requirements illustrates the delicate balance maintained between facilitating vehicle ownership and ensuring public safety. [Data: Entities (36); Relationships (38)]\n\n## Ongoing support through post-accident services\n\nIn the aftermath of accidents, ICICI Lombard provides critical assistance, including accommodation, legal advice, and emergency services. This support infrastructure demonstrates the Company’s commitment to not only handling claims but facilitating a conducive environment for clients to recover. Clients receive accommodation services when their vehicles are immobilized, which underscores the importance of customer care in the insurance process. Effective management of these services enhances satisfaction and encourages client loyalty within the community. [Data: Entities (176, 174); Relationships (194, 192)]\n\n## Technological integration in service delivery\n\nICICI Lombard employs technology-driven solutions, including mobile applications and a dedicated call center, to streamline customer interactions and claims processing. The application 'IL TakeCare' assists customers in managing vehicle services, while the 1800 2666 call center provides direct access to assistance when needed. This integration of technology not only enhances operational efficiency but also provides clients with 24/7 support, ensuring rapid response during emergencies and reinforcing the organization's commitment to client accessibility. [Data: Entities (181, 180); Relationships (201, 202)]\n\n## Legal frameworks influencing insurance operations\n\nIndian Laws significantly shape the operations and obligations of ICICI Lombard, particularly in relation to the enforcement of vehicle insurance policies. Such legal aspects include requirements for documentation like the Pollution Under Control (PUC) certificate and adherence to statutory provisions governing insurance claims. Understanding the legal framework allows ICICI Lombard to navigate its responsibilities while providing necessary coverage, mitigating risks associated with legal disputes, and ensuring compliance with government regulations. This framework becomes essential in understanding the operational landscape of vehicle insurance in India. [Data: Entities (354, 265); Relationships (717)]
===== RELATIONSHIPS =====
     id                            source                                 target                                                                                                                                                                                                                                                                                                                                                                                                                                                                       description weight links  in_context
0    95                           INSURER                                 PERSON                                                                                                                                                                                                                                                                                                                                                             The insurer has responsibilities in providing coverage for the liabilities of paid drivers, conductors, and cleaners.    8.0     7        True
1    65                           INSURER                PERSONAL ACCIDENT COVER                                                                                                                                                                                                                                                                                                                                                                 The insurer provides personal accident cover as part of the insurance policy for those using the insured vehicle.    5.0     7        True
2   124                           INSURER                              LIABILITY  The insurer is responsible for covering liabilities faced by the insured in accordance with the terms outlined in the insurance policy. Specifically, the insurer provides liability coverage for any claims related to the vehicle. This coverage is designed to protect the insured against financial obligations arising from accidents or incidents involving their vehicle, ensuring that the insured is supported in times of need as stipulated in the policy agreements.   18.0     7        True
3   520                     BODILY INJURY                                INSURER                                                                                                                                                                                                                                                                                                                                                                                   Claims for Bodily Injury can lead to liabilities that the Insurer must address under the policy    7.0     7        True
4   412                           INSURER  MOTOR THIRD PARTY LIABILITY INSURANCE                                                                                                                                                                                                                                                                                                                                                             The insurer is responsible for providing statutory Motor Third Party Liability insurance coverage as mandated by law.    1.0     7        True
5   447                           INSURER                                 IMT 15                                                                                                                                                                                                                                                                                                                                                                                        The insurer provides personal accident coverage details in IMT 15 for insured individuals.    8.0     7        True
6   860          DEATH, INJURY, OR DAMAGE                                INSURER                                                                                                                                                                                                                                                                                                                                                                           The insurer outlines specific liabilities concerning death, injury, or damage in relation to the policy    8.0     7        True
7   433           PERSONAL ACCIDENT COVER                                INSURED                                                                                                                                                                                                                                                                                                                                                                              The Personal Accident Cover applies to the Insured as the owner-driver under the terms of the policy    1.0     5        True
8   495                         LIABILITY                                INSURED                                                                                                                                                                                                                                                                                                                                The insured has legal liability towards third parties for accidents occurring while using a motor vehicle under the terms of the insurance policy.    7.0     5        True
9   125                           INSURED                              LIABILITY                                                                                                                                                                                                                                                                                                                                                                                             The insured must address their liability through the indemnification from the insurer    8.0     5        True
10   23                           INSURED                          BODILY INJURY                                                                                                                                                                                                                                                                                                                                                                The Insured may become legally liable for Bodily Injury to others as a result of an accident involving the Vehicle    6.0     5        True
11   39                           INSURED  MOTOR THIRD PARTY LIABILITY INSURANCE                                                                                                                                                                                                                                                                                                                                                               The Insured is required to maintain Motor Third Party Liability insurance as part of their vehicle insurance policy    1.0     5        True
12  252                           INSURED                     OWN-DAMAGE PREMIUM                                                                                                                                                                                                                                                                                                                                                                                  The Insured pays the Own-Damage Premium as part of their policy to cover losses to their vehicle    8.0     5        True
13   38                           COMPANY  MOTOR THIRD PARTY LIABILITY INSURANCE                                                                                                                                                                                                                                                                                                                                                            The Company provides Motor Third Party Liability insurance as a mandatory coverage according to the legal requirements    8.0     2        True
14  738                LIMIT OF LIABILITY                                COMPANY                                                                                                                                                                                                                                                                                                                                                                                       The Company sets a limit of liability for compensation payouts under its insurance policies    6.0     2        True
15  852                            DAMAGE                              LIABILITY                                                                                                                                                                                                                                                                                                                                                                                         Damage resulting from an event may lead to liability claims as per insurance policy terms    5.0     2        True
16   79                LIMIT OF LIABILITY                                 DAMAGE                                                                                                                                                                                                                                                                                                                                                                   The limit of liability defines the maximum payout the insurer is liable for in the event of damage to property.    1.0     2        True
17  442                           VEHICLE                                 PERSON                                                                                                                                                                                                                                                                                                          The vehicle is designed or configured for use by persons including those who may require mobility assistance due to disabilities such as blindness or mental challenges.    5.0     1        True
18  120                            PERSON                          MOTOR VEHICLE                                                                                                                                                                                                                                                                                                                                                                                   A person driving the Motor Vehicle carries responsibilities under the contract with the insurer    6.0     1        True
19   68           PERSONAL ACCIDENT COVER                        INSURED VEHICLE                                                                                                                                                                                                                                                                                                                          Personal Accident Cover is specifically related to the insured vehicle as it outlines the compensation terms for injuries occurring during its operation    8.0     1        True
20  378                  INSURANCE POLICY                          BODILY INJURY                                                                                                                                                                                                                                                                                                                                                                                        The Insurance Policy outlines compensation for BODILY INJURY sustained by the owner-driver    8.0     1        True
21  795                     BODILY INJURY                        VEHICLE INSURED                                                                                                                                                                                                                                                                                                                                                                           Bodily injury resulting from an event involving the vehicle insured may lead to claims under the policy    8.0     1        True
22  789           PERSONAL ACCIDENT COVER                                  HIRER                                                                                                                                                                                                                                                                                                                                             The Personal Accident Cover applies to unnamed hirers, providing compensation for injuries sustained while using the insured vehicle.    8.0     1        True
23  410                     BODILY INJURY                           COMPENSATION                                                                                                                                                                                                                                                                                                                                                                         Compensation is available for losses due to bodily injury claims under the terms of the insurance policy.    7.0     1        True
24  119                          EMPLOYEE                                 PERSON                                                                                                                                                                                                                                                                                                                                                                                       The Employee is defined under the policy provisions as potentially having legal liabilities    4.0     1        True
25  164                  CUSTOMER SUPPORT                                 PERSON                                                                                                                                                                                                                                                                                                                                                                      Individuals can reach out to customer support through various channels for assistance with insurance claims.    7.0     1        True
26  818                         LIABILITY                    MINISTRY OF DEFENCE                                                                                                                                                                                                                                                                                                                                         Liability refers to the Ministry of Defence's regulations concerning soldiers driving insured vehicles, impacting the insurance indemnity    6.0     1        True
27  163                            PERSON                       TOLL-FREE NUMBER                                                                                                                                                                                                                                                                                                                                                                              Individuals or drivers should use the toll-free number to communicate with ICICI Lombard for claims.    5.0     1        True
28  165                            PERSON                       CLAIM INTIMATION                                                                                                                                                                                                                                                                                                                                                                                 Individuals must engage in claim intimation to process their insurance claims with ICICI Lombard.    6.0     1        True
29  166                            PERSON                                    FIR                                                                                                                                                                                                                                                                                                                                                                            The involved individuals in an accident need to file an FIR for legal acknowledgement of the incident.    6.0     1        True
30  443                            PERSON            MENTALLY CHALLENGED PERSONS                                                                                                                                                                                                                                                                                                                                                              Policies may provide coverage for risks affecting mentally challenged persons using the specially designed vehicles.    6.0     1        True
31  444                            PERSON                          BLIND PERSONS                                                                                                                                                                                                                                                                                                                                                                 Coverage is provided within the policy for risks associated with blind persons using specially modified vehicles.    1.0     1        True
32  509           MOTOR VEHICLE ACT, 1988                              LIABILITY                                                                                                                                                                                                                                                                                                                                                  The Motor Vehicle Act, 1988 governs aspects of liability concerning motor vehicles, thus creating a relationship between the two    6.0     1        True
33  817                         LIABILITY                                TRAILER                                                                                                                                                                                                                                                                                                                                                     Liability is directly related to the use of trailers under the insurance coverage and outlines the insurer's responsibilities    7.0     1        True
34   70  UNNAMED HIRER/PILLION PASSENGERS                PERSONAL ACCIDENT COVER                                                                                                                                                                                                                                                                                                                                                                       Unnamed hirers and pillion passengers are included in the terms of Personal Accident Cover for compensation    1.0     1        True
35  790           PERSONAL ACCIDENT COVER                      PILLION PASSENGER                                                                                                                                                                                                                                                                                                                                                   The Personal Accident Cover is applicable to unnamed pillion passengers for injuries incurred while riding the insured vehicle.    8.0     1        True
36  791                        ANY PERSON                PERSONAL ACCIDENT COVER                                                                                                                                                                                                                                                                                                                                                      Any person involved with the insured vehicle is entitled to the Personal Accident Cover for injuries sustained during usage.    1.0     1        True
37  854                         EXCLUSION                              LIABILITY                                                                                                                                                                                                                                                                                                                                                          Exclusions in insurance policies clarify situations where liability may not apply, impacting coverage for various events    7.0     1        True
38   63                            IMT 15             WORKMEN'S COMPENSATION ACT                                                                                                                                                                                                                                                                                                                          IMT 15 references the Workmen's Compensation Act, indicating the coverage of those employed and specifies conditions for compensation based on this Act.    4.0     1        True
39  796                             LIMBS                          BODILY INJURY                                                                                                                                                                                                                                                                                                                                                                       Loss of limbs is a specific example of a bodily injury eligible for compensation under the insurance policy    9.0     1        True
===== ENTITIES =====
     id                                 entity                                                                                                                                                                                                                                                                                                                                                                                                                                                                                                                                                                                                                                                                                                                                                                                                                                                                                                                                                                                                                                                                                                                                                                                                                                                                                                                                                                                                                                                                                                                                                                                                description number of relationships  in_context
0    76                PERSONAL ACCIDENT COVER                                                                                                                                                                                                                                                                                                                                                                                                                                                                                                                                                                                                                           Personal Accident Cover is an insurance provision designed to offer compensation for bodily injuries incurred by specific individuals linked to the insured vehicle, adhering to the particular conditions delineated in the policy. This coverage primarily focuses on providing financial support to those who sustain injuries while operating or riding in the insured vehicle.\n\nThe coverage applies to the insured individual, which may include the owner-driver and potentially other designated passengers within the vehicle at the time of the accident. It encompasses a range of benefits aimed at addressing the repercussions of accidents that result in bodily harm. \n\nOverall, Personal Accident Cover serves as an essential safety net for policyholders, ensuring that they receive assistance in the event of personal injuries sustained during vehicle-related incidents, depending on the terms outlined within their individual policy agreements.                       7        True
1    36  MOTOR THIRD PARTY LIABILITY INSURANCE                                                                                                                                                                                                                                                                                                                                                                                                                                                                                                                                                                                                                                                                                                                                                                                                                                                                                                                                Motor Third Party Liability Insurance is a statutory insurance mandated by law that provides coverage for damages or liabilities arising from the use of a motor vehicle. This insurance specifically protects against claims for damages caused to third parties by an insured vehicle. It serves as a financial safeguard for vehicle owners, ensuring that they can fulfill their legal obligations in the event they cause harm or damage to others while operating their vehicle. This form of insurance is essential for maintaining road safety and promotes accountability among drivers by requiring them to have coverage in place to protect others on the road.                       3        True
2   595               DEATH, INJURY, OR DAMAGE                                                                                                                                                                                                                                                                                                                                                                                                                                                                                                                                                                                                                                                                                                                                                                                                                                                                                                                                                                                                                                                                                                                                                                                                                                                                                                                                                                                                                                                                                                 Refers to liabilities covered or excluded in the insurance policy related to incidents involving vehicles.                       1        True
3   379                                 PERSON                                                                                                                                                                                                                                                                                                                                                                                                                                                                                                                                                                                                                                                                                                                                                                                                                                                                            The term ""PERSON"" refers to individuals who are entitled to compensation for injuries resulting from vehicle incidents. While the descriptions indicate that the discussions involve references to these individuals, no specific names are provided in the text. The coverage includes any named individual who may be insured under the relevant policy. This specifically encompasses those who have been affected by personal accidents related to the vehicle in question. In summary, the entity ""PERSON"" is associated with unnamed individuals eligible for injury compensation in the context of vehicle-related accidents, emphasizing the importance of coverage for all insured parties involved in such incidents.                      10        True
4   113                              LIABILITY                                                                                                                                                                                                                                                                                                                                            Liability refers to the legal obligations and responsibilities that the insured or an organization holds to provide compensation for death or bodily injury to individuals who are not excluded under specific insurance policies. This term encompasses several aspects, including the obligation to compensate for injuries or damages that may arise from the use of motor vehicles.\n\nIn the context of insurance, liability signifies the legal responsibilities that the insurer must address concerning various risks associated with motor vehicle incidents. Specifically, it underscores the duty of the insured to cover compensation in cases of injury or death resulting from such vehicle use. These responsibilities are guided by the standards set forth in the respective insurance policies and legal frameworks.\n\nEssentially, liability implies that an individual or organization can be held accountable for not meeting established safety standards or causing harm to others, hence necessitating compensation. This legal obligation is fundamental to the operation of insurance policies, particularly those related to motor vehicle coverage, ensuring that victims of accidents or incidents can receive financial redress.                       7        True
5    23                          BODILY INJURY                                                                                                                                                                                                                                                                                                                                    Bodily Injury refers to physical harm inflicted on individuals, which can arise from various circumstances, particularly in the context of accidents. This term encompasses injuries sustained by individuals, including owner-drivers involved in vehicle accidents. Such injuries may lead to liability claims under an insurance policy, positioning the insured potentially liable for compensation associated with the harm caused.\n\nSpecifically, Bodily Injury pertains not only to the direct physical injuries experienced but also to the implications of these injuries concerning legal and insurance liabilities. When an individual suffers bodily harm, it can result in claims for compensation, indicating the financial repercussions tied to the injury and the insured party's obligation under the insurance agreement.\n\nIn summary, Bodily Injury embodies the concept of physical harm to a person, which may invoke legal liability and elicit compensation demands under applicable insurance policies. This notion underscores the interconnectedness of physical injuries, legal accountability, and insurance coverage, highlighting its significance in managing and mitigating the implications of accidents and harm to individuals.                       6        True
6   234                     OWN-DAMAGE PREMIUM                                                                                                                                                                                                                                                                                                                                                                                                                                                                                                                                                                                                                                                                                                                                                                                                                                                                                                                                                                                                                                                                                                                                                                                                                                                                                                                                                                                                                                                       Own-Damage Premium is a part of the motor insurance policy that covers damages to the insured vehicle, distinct from third-party liability coverage.                       1        True
7    85                     LIMIT OF LIABILITY                                                                                                                                                                                                                                                                                                                                                                                                                                                                                                                                                                                                                                                                                                                                                                                                                                                                                                          The term ""LIMIT OF LIABILITY"" refers to the specified maximum amount that an insurer is responsible for in the event of a loss or damage to property, excluding the insured vehicle. This limit is crucial in the context of an insurance policy, as it clearly delineates the maximum financial obligation the insurer will fulfill following an accident. Essentially, the limit of liability serves as a financial cap on the coverage provided by the insurance company for various losses or damages. Therefore, it is an integral concept within insurance agreements, helping both insurers and insured parties understand the extent of coverage in the unfortunate event of an accident.                       2        True
8    73                                 IMT 15                                                                                                                                                                                                                                                                                                                                 IMT 15 is a specific insurance policy that delineates the conditions under which personal accident coverage is applicable for the insured individuals. This coverage is activated during several scenarios, including the mounting and dismounting from the insured vehicle as well as while traveling in it. The policy is designed to offer protection to the insured or named individuals specified in the policy, ensuring they receive personal accident cover in the outlined situations.\n\nHowever, it is important to note that this coverage specifically excludes paid drivers or cleaners. This means that while the insured and other named persons are protected under IMT 15, any professional drivers or individuals employed to clean the vehicle do not qualify for this personal accident coverage. The conditions set forth in IMT 15 serve to clarify the scope and limitations of the insurance protection provided to individuals against personal accidents related to the insured vehicle. \n\nIn summary, IMT 15 details the personal accident coverage available for named insured persons while engaging with the vehicle, specifically during mounting, dismounting, and travel, but it does not extend coverage to paid drivers or cleaners.                       2        True
9    19                           OWNER-DRIVER                                                                                                                                                                                                                                                                                                                                                                                                                                                                                                     The Owner-Driver is defined as the individual who is the registered owner of a vehicle and possesses a valid driving license. This designation refers to a person who not only owns the vehicle but also actively operates it. As the registered owner of the vehicle, the Owner-Driver is entitled to compensation under the terms of the insurance policy in the event of an accident.\n\nFurthermore, the Owner-Driver holds personal liability, meaning they are responsible for any accidents that occur while operating the insured vehicle. This responsibility underscores the importance of the Owner-Driver being both the owner and operator of the vehicle in question. By holding a valid driving license, the Owner-Driver confirms their legal ability to drive, which is a requirement for eligibility under insurance policies that cover personal accidents.\n\nIn summary, the Owner-Driver is an individual fully accountable for the vehicle and eligible for specific insurance benefits, clearly linking ownership, operation, and legal driving capacity under one definition.                      12        True
10  123                     LIABILITY POLICIES                                                                                                                                                                                                                                                                                                                                                                                                                                                                                                                                                                                                                                                                                                                                                                                                                                                                                                                                                                                                                                                                                                                                                                                                                                                                                                                                                                                                                                                                                                         Refers to categories of insurance policies that govern liability coverage regarding motor vehicles                       6        True
11  573                      ACCIDENTAL DAMAGE                                                                                                                                                                                                                                                                                                                                                                                                                                                                                                                                                                                                                                                                                                                                                                                                                                                                                                                                                                                                                                                                                                                                                                                                                                                                                                                                                                                                                                                                      Accidental damage refers to unintentional harm to the vehicle that is covered under insurance, as mentioned in the policy conditions.                       1        True
12   27                               ACCIDENT                                                                                                                                                     An ""Accident"" is defined as an unforeseen or unexpected event that occurs while a vehicle is being used, which can result in damage or injury. This is particularly significant in the context of insurance, as accidents potentially trigger coverage for repairs, personal property losses, and medical expenses for the Insured Person. The term encompasses incidents caused by external, visible, and violent means, underscoring that these occurrences are typically abrupt and involuntary. \n\nWhen an accident involves the insured vehicle, it may entail the need for assistance from the insurance company, which can provide various support services, including repairs and medical aid. The implications of such incidents are critical, as they may lead to insurance claims that must be processed in accordance with the terms outlined in the policy. These claims could cover hospitalization or injury-related expenses, as well as damages to the vehicle or third-party property.\n\nIn summary, an accident, within the framework of motor insurance, is identified as any unforeseen incident linked to the insured vehicle that can result in bodily injury, property damage, and other related losses. Such events are central to the claims process under the insurance policy, emphasizing the need for coverage and support from the insurance provider in addressing the consequences of these unexpected occurrences.                      31        True
13  387                     COMPENSATION LIMIT                                                                                                                                                                                                                                                                                                                                                                                                                                                                                                                                                                                                                                                                                                                                                                                                                                                                                                                                                                                                                                                                                                                                                                                                                                                                                                                                                                                                                                                                Compensation limit refers to the maximum amount an insurer is liable to pay for injuries or damages, as stipulated in the policy.)(""entity""                       1        True
14  389                           PRIVATE CARS                                                                                                                                                                                                                                                                                                                                                                                                                                                                                                                                                                                                                                                                                                                                                                                                                                                                                                                                                                                                                                                                                                                                                                                                                                                                                                                                                                                                                                                                                          Private cars are personal vehicles outlined in the IMT guidelines and are subject to specific insurance policies.                       7        True
15  577                 DEATH OR BODILY INJURY                                                                                                                                                                                                                                                                                                                                                                                                                                                                                                                                                                                                                                                                                                                                                                                                                                                                                                                                                                                                                                                                                                                                                                                                                                                                                                                                                                                                                                                      Legal scenarios that are excluded from certain indemnities provided by the insurance policy, specifically when related to passengers of the vehicles.                       1        True
16  582               FATAL ACCIDENTS ACT 1855                                                                                                                                                                                                                                                                                                                                                                                                                                                                                                                                                                                                                                                                                                                                                                                                                                                                                                                                                                                                                                                                                                                                                                                                                                                                                                                                                                                                                                                                                                                               A legal framework that addresses liability in relation to accidental deaths.                       1        True
17   20                       INDEMNITY POLICY                                                                                                                                                                                                                                                                                                                                                                                                                                                                                                                                                                                                                                                                                                                                                                                                                                                                                                                                                                                                                                                                                                                                                                                                                                                                                                                                                                                                                                                                  The indemnity policy is an insurance agreement detailing the coverage and liabilities related to accidents involving the insured vehicle.                       1        True
18   98              FATAL ACCIDENTS ACT, 1855  The Fatal Accidents Act of 1855 is a significant piece of legislation in India that provides a framework for compensation in cases where individuals die due to the negligence of others, particularly in workplace accidents and other specific scenarios. This law establishes the legal liability of individuals or entities responsible for fatal accidents, ensuring that families and dependents of deceased persons are entitled to financial compensation.\n\nSpecifically, the Act allows the relatives of individuals who have been killed as a result of negligence to claim damages. This includes cases related to workplace incidents and extends to various situations, including motor vehicle accidents. It emphasizes the responsibility of employers and other parties to provide a safe environment for workers, outlining their obligations in the event of tragic circumstances leading to fatalities.\n\nBy validating the claims of dependents affected by fatal accidents, the Fatal Accidents Act of 1855 plays a crucial role in providing financial security to families who may suffer from the loss of their primary breadwinners. The legislation not only addresses the immediate financial needs but also reflects a broader legal principle that prioritizes the protection of individuals from negligence.\n\nOverall, the Fatal Accidents Act, 1855 encompasses a comprehensive approach to legal liability and compensation, contributing to the welfare of victims' families and the establishment of accountability among employers and other responsible parties.                       8        True
===== SOURCES =====
   id                                                                                                                                                                                                                                                                                                                                                                                                                                                                                                                                                                                                                                                                                                                                                                                                                                                                                                                                                                                                                                                                                                                                                                                                                                                                                                                                                                                                                                                                                                                                                                                                                                                                                                                                                                                                                                                                                                                                                                                                                                                                                                                                                                                                                                                                                                                                                                                                                                                                                                                                                                                                                                                                                                                                                                                                                                                                                                                                                                                                                                                                                                                                                                                                                                                                                                                                                                                                                                                                                                                                                                                                                                                                                                                                                                                                                                                                                                                                                                                                                                                                                                                                                                                                                                                                                                                                                                                                                                                                                                                                                                                                                                                                                                                                                                                                                                                                                                                                                                                                                                                                                                                                                                                                                                                                                                                                                                                                                                                                                                                                                                                                                                                                                                                                                                                                                                                                                                                                                                                                                                                      text
0   9                                                                                                                                                                                                                                                    ... ** persons/passengers are in the\n     vehicle insured at the time of occurrence of such injury.\nSubject otherwise to the terms exceptions conditions and\nlimitations of this policy.\n* The Capital Sum Insured (CSI) per passenger is to be inserted.\n** The registered sitting capacity of the vehicle insured is to be\ninserted.\n\n17.  IMT. 17. PERSONAL ACCIDENT COVER TO PAID\nDRIVERS, CLEANERS AND CONDUCTORS: (Applicable to all\nclasses of vehicles)\n\nIn consideration of the payment of an additional premium, it is\nhereby understood and agreed that the insurer undertakes to\npay compensation on the scale provided below for bodily injury\nas hereinafter deﬁned sustained by the paid driver/\ncleaner/conductor in the employ of the insured in direct\nconnection with the vehicle insured whilst mounting into\ndismounting from or traveling in the insured vehicle and caused\nby violent accidental external and visible means which\nindependently of any other cause shall within six calendar\nmonths of the occurrence of such injury result in :\n Nature of injury                          Scale of\n                              CompensaƟon\n (I)  Death                         100%\n (ii) Loss of two limbs or sight of two       100%\n    eyes or one limb and sight of one eye\n  (iii) Loss of one limb or sight of one eye     50%\n (iv) Permanent total disablement from     100%\n     injuries other than named above\n\nProvided always that\nI.   Compensation shall be payable under only one of the items\n       (I) to (iv) above in respect of any such person arising out of\n    any one occurrence and total liability of the insurer shall not\n     in the aggregate exceed the sum of `____* during any one\n    period of insurance in respect of any such person.\nII.  No compensation shall be payable in respect of death or\n     injury directly or indirectly wholly or in part arising or\n     resulting from or traceable to\n     (a) intentional self injury suicide or attempted suicide\n        physical defect or inﬁrmity or (b) an accident\n       happening whilst such person is under the inﬂuence of\n         intoxicating liquor or drugs.\nIII.  Such compensation shall be payable only with the\n    approval of the insured named in the policy and directly to\n    the injured person or his/ her legal representative(s) whose\n     receipt shall be a full discharge in respect of the injury of\n    such person.\nSubject otherwise to the terms exceptions conditions and\nlimitations of this policy.\n* The Capital Sum Insured (CSI) per person is to be inserted.\n18. IMT. 18. PERSONAL ACCIDENT TO UNNAMED HIRER\nAND UNNAMED PILLION PASSENGERS (Applicable to\nMotorised Two wheelers with or without side Car)\nIn consideration of the payment of an additional premium it is\nhereby understood and agreed that the insurer undertakes to\npay compensation to any unnamed hirer/driver/any unnamed\npillion/sidecar passenger* on the scale provided below for\nbodily injury caused by violent, accidental, external and visible\nmeans whilst mounting into/onto and/or dismounting from or\ntraveling in/on the vehicle insured which independently of any\nother cause shall within three calendar months of the\noccurrence of such injury results in :\n\n Nature of injury                          Scale of\n                              CompensaƟon\n (I)  Death                         100%\n (ii) Loss of two limbs or sight of two       100%\n    eyes or one limb and sight of one eye\n  (iii) Loss of one limb or sight of one eye     50%\n (iv) Permanent total disablement from     100%\n     injuries other than named above\nProvided always that:\nI.   Compensation shall be payable under only one of the items\n        (i) to (iv) above in respect of any such person arising out of\n    any one occurrence and total liability of the insurer shall not\n     in the aggregate exceed the sum of `______** during any\n    one period of insurance in respect of any such person.\nII.  No compensation shall be payable in respect of death or\n     injury directly or indirectly wholly or in part arising or\n     resulting from or traceable to (a) intentional self injury\n     suicide or attempted suicide physical defect or inﬁrmity or\n     (b) an accident happening whilst such person is under the\n    inﬂuence of intoxicating liquor or drugs.\nIII.  Such compensation shall be payable only with the\n    approval of the insured named in the policy and directly to\n     the injured person or his/her legal representative(s) whose\n     receipt shall be a full discharge in respect of the injury of\n    such person.\nIV.  Not more than ...................... persons/passengers are in the\n     vehicle insured at the time of occurrence of such injury.\nSubject otherwise to the terms exceptions conditions and\nlimitations of this policy.\n* Delete if P.A. cover for unnamed pillion/side car passenger is\nnot taken.\n** The Capital Sum Insured (CSI) per passenger is to be inserted.\n19.  IMT. 19. COVER FOR VEHICLES IMPORTED WITHOUT\nCUSTOMS DUTY\nNotwithstanding anything to the contrary contained in this\npolicy it is hereby understood and agreed that in the event of\nloss or damage to the vehicle insured and/or its accessories\nnecessitating the supply of a part not obtainable from stocks\nheld in the country in which the vehicle insured is held for repair\nor in the event of the insurer exercising the option under\n...................... * to pay in cash the amount of the loss or damage the\nliability of the insurer in respect of any such part shall
1   8                                                                                                                                                                                                                                            Vehicles)\nIt is hereby understood and agreed that the insurer shall not be\nliable in respect of the vehicle insured while it is being used\nelsewhere than on site to which the public have no general right\nof access and the vehicle is not required to be registered under\nthe Motor Vehicles Act, 1988.\n15.  IMT. 15. PERSONAL ACCIDENT COVER TO THE INSURED\nOR ANY NAMED PERSON OTHER THAN PAID DRIVER OR\nCLEANER (Applicable to private cars including three wheelers\nrated as private cars and motorized two wheelers with or\nwithout side car [not for hire or reward)\n\nIn consideration of the payment of an additional premium it is\nhereby agreed and understood that the Company undertakes to\npay compensation on the scale provided below for bodily injury\nas hereinafter deﬁned sustained by the insured person in direct\nconnection with the vehicle insured or whilst mounting and\ndismounting from or traveling in vehicle insured and caused by\nviolent accidental external and visible means which\nindependently of any other cause shall within six calendar\nmonths of the occurrence of such injury result in:-\n\n Nature of injury                          Scale of\n                              CompensaƟon\n (I)  Death                         100%\n (ii) Loss of two limbs or sight of two       100%\n    eyes or one limb and sight of one eye\n  (iii) Loss of one limb or sight of one eye     50%\n (iv) Permanent total disablement from     100%\n     injuries other than named above\n\nProvided always that\n\nI.    Compensation shall be payable under only one of the\n     items (i) to (iv) above in respect of any such person arising\n     out of any one occurrence and total liability of the insurer\n      shall not in the aggregate exceed the sum of `.......* during\n     any one period of insurance in respect of any such person.\n\nII.   No compensation shall be payable in respect of death or\n      injury directly or indirectly wholly or in part arising or\n      resulting from or traceable to (a) intentional self injury\n      suicide or attempted suicide physical defect or inﬁrmity or\n      (b) an accident happening whilst such person is under the\n     inﬂuence of intoxicating liquor or drugs.\n\nIII.   Such compensation shall be payable only with the\n     approval of the insured named in the policy and directly to\n     the injured person or his/her legal representative(s) whose\n      receipt shall be a full discharge in respect of the injury of\n     such person.\n\nSubject otherwise to the terms exceptions conditions and\nlimitations of this policy.\n\n* The Capital Sum Insured (CSI) per passenger is to be inserted.\n\n16.  IMT. 16. PERSONAL ACCIDENT TO UNNAMED\nPASSENGERS OTHER THAN INSURED AND THE PAID\nDRIVER AND CLEANER (For vehicles rated as Private cars\nand Motorised two wheelers (not for hire or reward) with or\nwithout side car)\n\nIn consideration of the payment of an additional premium it is\nhereby understood and agreed that the insurer undertakes to\npay compensation on the scale provided below for bodily\ninjuries hereinafter deﬁned sustained by any passenger other\nthan the insured and/or the paid driver attendant or cleaner\nand/or a person in the employ of the insured coming within the\nscope of the Workmen’ Compensation Act, 1923 and\nsubsequent amendments of the said Act and engaged in and\nupon the service of the insured at the time such injury is\nsustained whilst mounting into, dismounting from or traveling in\nthe insured motor car and caused by violent, accidental,\nexternal and visible means which independently of any other\ncause shall within three calendar months of the occurrence of\nsuch injury result in :\n\n    Nature of injury                          Scale of\n                                 CompensaƟon\n        (I)  Death                         100%\n        (ii) Loss of two limbs or sight of two       100%\n       eyes or one limb and sight of one eye\n        (iii) Loss of one limb or sight of one eye     50%\n      (iv) Permanent total disablement from     100%\n         injuries other than named above\n\nProvided always that:-\nI.   Compensation shall be payable under only one of the items\n        (i) to (iv) above in respect of any such person arising out of\n    any one occurrence and total liability of the insurer shall not\n     in the aggregate exceed the sum of `____* during any one\n     period of insurance in respect of any such person.\nII.  No compensation shall be payable in respect of death or\n     injury directly or indirectly wholly or in part arising or\n     resulting from or traceable to (a) intentional self injury\n     suicide or attempted suicide physical defect or inﬁrmity or\n     (b) an accident happening whilst such person is under the\n    inﬂuence of intoxicating liquor or drugs.\nIII.  Such compensation shall be payable only with the\n    approval of the insured named in the policy and directly to\n     the injured person or his/her legal representative(s) whose\n     receipt shall be a full discharge in respect of the injury of\n    such person.\nIV.  Not more than................... ** persons/passengers are in the\n     vehicle insured at the time of occurrence of such injury.\nSubject otherwise to the terms exceptions conditions and\nlimitations of this policy.\n* The Capital Sum Insured (CSI) per passenger is to be inserted.\n** The registered sitting capacity of the vehicle insured is to be\ninserted.\n\n17.  IMT. 17. PERSONAL ACCIDENT COVER TO PAID\nDRIVERS, CLEANERS AND CONDUCTORS: (Applicable to all\nclasses
2  57                                                                                                                                         EMENT\n       It  is hereby understood and agreed that (hereinafter\n    referred to as the Lessors) are the Owners of the vehicle\n    insured and that the vehicle insured is the subject of a Lease\n    Agreement made between the Lessor on the one part and\n    the insured on the other part and it is further understood\n   and agreed that the Lessors are interested in any monies\n    which but for this Endorsement would be payable to the\n    insured under this policy in respect of such loss or damage\n    to the vehicle insured as cannot be made good by repair\n    and/or replacement of parts and such monies shall be\n    paid to the Lessors as long as they are the Owners of the\n    vehicle insured and their receipt shall be a full and final\n    discharge to the insurer in respect of such loss or damage.\n       It is also understood and agreed that notwithstanding any\n    provision in the Leasing Agreement to the contrary, this\n    policy is issued to the insured namely  as the principal\n    party and not as agent or trustee and nothing herein\n    contained shall be construed as constituting the insured\n   an agent or trustee for the Lessors or as an assignment\n    (whether legal or equitable) by the insured to the Lessors,\n    of his rights benefits and claims under this policy and\n    further nothing herein shall be construed as creating or\n    vesting any right in the Owner/Lessor to sue the insurer\n     in any capacity whatsoever for any alleged breach of its\n    obligations hereunder.\n       It is further declared and agreed that for the purpose\n    of the Personal Accident Cover  for the owner-driver\n    granted under this policy, the insured named in the policy\n     will continue to be deemed as the owner-driver subject\n    to compliance of provisions of the policy relating to this\n    cover.\n   Save as by this Endorsement expressly agreed nothing\n    herein shall modify or affect the rights and liabilities of the\n    insured or the insurer respectively under or in connection\n    with this Policy. Subject otherwise to the terms exceptions\n    conditions and limitations of this policy.\n7.  IMT. 7. Vehicles subject to Hypothecation Agreement\n       It is hereby declared and agreed that the vehicle insured\n     is pledged to/hypothecated with. (hereinafter referred to\n    as the Pledgee) and it is further understood and agreed\n    that the Pledgee is interested in any monies which but\n     for this Endorsement would be payable to the insured\n    under this policy in respect of such loss or damage to the\n    vehicle insured as cannot be made good by repair and/\n    or replacement of parts and such monies shall be paid to\n    the Pledgee as long as they are the Pledgee of the vehicle\n    insured and their receipt shall be a full and final discharge\n    to the insurer in respect of such loss or damage.\n       It is further declared and agreed that for the purpose\n    of the Personal Accident Cover  for the owner-driver\n    granted under this policy, the insured named in the policy\n     will continue to be deemed as the owner-driver subject\n    to compliance of provisions of the policy relating to this\n    cover.\n   Save as by this Endorsement expressly agreed that nothing\n    herein shall modify or affect the rights or liabilities of the\n    Insured or the Insurer respectively under or in connection\n    with this Policy or any term, provision or condition thereof.\n    Subject otherwise to the terms exceptions conditions and\n     limitations of this policy.\n8.  IMT. 8. DISCOUNT FOR MEMBERSHIP OF RECOGNISED\n   AUTOMOBILE ASSOCIATIONS (PRIVATE CARS AND\n   MOTORISED TWO WHEELERS ONLY)\n       It is hereby understood and agreed that in consideration\n    of insured’s membership of ......** a discount in premium\n    of `............* is allowed to the insured hereunder from\n         ...  /...  /....... It is further understood and agreed that if the\n    insured ceases to be a member of the above mentioned\n    association during the currency of this Policy the insured\n     shall immediately notify the insurer accordingly and refund\n    to the insurer a proportionate amount of the discount\n    allowed on this account for the unexpired period of the\n    cover.\n    Subject otherwise to the terms exceptions conditions and\n     limitations of the policy\n    *For full policy period, the full tariff discount to be inserted.\n    For mid-term membership, prorata proportion of the tariff\n    discount for the unexpired policy period is to be inserted.\n     **Insert name of the concerned Automobile Association.\n9.  IMT. 9. DISCOUNT FOR VINTAGE CARS (Applicable to\n    Private Cars only)\n       It is hereby understood and agreed that in consideration\n    of the insured car having been certified as a Vintage Car\n    by the Vintage and Classic Car Club of India, a discount\n    of ` ......................* is allowed to the insured from ......../.........\n         /...........\n    Subject otherwise to the terms exceptions conditions and\n     limitations of the policy\n   *Amount  calculated as per  tariff  provision  is  to be\n     inserted. For mid-term certification as Vintage Car pro-\n    rata proportion of tariff discount for the unexpired period\n     is to be inserted.\n10. IMT. 10. INSTALLATION OF ANTI-THEFT DEVICE (Not\n    applicable to Motor Trade Policies)\n     In consideration of certification by *that an Anti-Theft\n    device approved by Automobile Research Association\n    of India (ARAI), Pune has been installed  in the  vehicle\n    insured  herein a premium  discount  of `............** is\n    hereby
3   3  \n    event of any claim and thereafter the insured shall give all such\n     information and assistance as the Company shall require.\n    Every letter claim writ summons and/or process or copy\n     thereof shall be forwarded to the Company immediately on\n     receipt by the insured. Notice shall also be given in writing to\n     the Company immediately the insured shall have knowledge\n     of any impending prosecution, inquest or fatal inquiry in\n     respect of any occurrence which may give rise to a claim under\n     this Policy. In case of theft or criminal act which may be the\n     subject of a claim under this Policy the insured shall give\n    immediate notice to the police and cooperate with the\n    Company in securing the conviction of the offender. Wherever\n     details pertaining to any incident which results in a claim, are\n    conveyed by the insured to the insurer after reasonable period,\n     insured shall provide the reasons of such delay to the insurer\n    and insurer may on analysis of reasons provided by insured,\n    condone the delay in intimation of claim or delay in providing\n     the required information/documents to the insurer.\nII.  No admission offer promise payment or indemnity shall be\n   made or given by or on behalf of the insured without the\n     written consent of the Company which shall be entitled if it so\n     desires to take over and conduct in the name of the insured the\n    defence or settlement of any claim or to prosecute in the name\n     of the insured for its own beneﬁt any claim for indemnity or\n    otherwise and shall have full discretion in the conduct of any\n    proceedings or in the settlement of any claim and the insured\n     shall give all such information and assistance as the Company\n   may require.\nIII.  The Company may at its own option repair reinstate or replace\n     the vehicle or part thereof and/or its accessories or may pay in\n    cash the amount of the loss or damage and the liability of the\n    Company shall not exceed:\n     a.   For total loss/constructive total loss/Cash Loss of the\n          vehicle-the Insured’s Declared Value (IDV) of the vehicle\n         (including accessories thereon) as speciﬁed in the\n        Schedule less the value of the wreck,  if opted by the\n         customer.\n   b  For partial losses,  i.e. losses other than Total\n         Loss/Constructive Total Loss/Cash Loss of the vehicle\n        actual and reasonable costs of repair and/or\n       replacement of parts lost/damaged subject to\n         depreciation as per limits speciﬁed.\nIV.  The insured shall take all reasonable steps to safeguard the\n     vehicle from loss or damage and to maintain it in efﬁcient\n     condition and the Company shall have at all times free and\n      full access to examine the vehicle or any part thereof or any\n     driver or employee of the insured. In the event of any\n    accident or breakdown, the vehicle shall not be  left\n    unattended without proper precautions being taken to\n    prevent further damage or loss and if the vehicle be driven\n    before the necessary repairs are effected any extension of\n    the damage or any further damage to the vehicle shall be\n     entirely at the Insured’s own risk.\nV.  The policyholder can cancel the policy at any time during\n    the term, by informing the insurer. In case the Policyholder\n    cancels the policy, he/ she is not required to give reasons for\n     cancellation. In such case of cancelation, the insurer will\n    refund proportional premium for unexpired policy period, if\n    the term of the policy is upto one year and there is no\n     claim(s) made during the policy period.\nIn case the term of the policy is more than 12 months, the insurer\nwill refund premium for the unexpired policy period, in respect of\npolicy with the term more than one year and the risk coverage\nfor such policy years has not commenced. The insurer can\ncancel the policy only on the grounds of established fraud, by\ngiving minimum notice of 7 days to the retail policyholder.\nUnder no circumstances can the insurer cancel statutory Motor\nThird Party Liability insurance or any other compulsory\ninsurance mandated by law except in case of double insurance\nor total loss/Cash loss.\nCancellation due to Total Loss/Cash LossTotal Theft of Vehicle/\nDouble insurance\n•    In the event of lodgement and settlement of a total loss\n    claim of any nature including theft and constructive total\n     loss/ cash loss, the company will refund the Own damage\n    and liability section premium in full for the unexpired years\n    (where the risk has not yet incepted). There would no\n    refund for the premium related to lapsed years (Risk\n    years/12 month periods which have expired before the\n     Cancellation effective date) and for the current year where\n    the cancellation effective date falls.\n•    In the event of cancellation of policy due to double\n     insurance, the company will refund the Own damage and\n      liability section premium in full for the unexpired years\n     (years for which the Risk has not yet incepted). For the year\n    where policy is in-force (risk has incepted), premium will be\n    refunded as follows:\nVI.   If at the time of occurrence of an event that gives rise to any\n    claim under this policy there is in existence any other\n    insurance covering the same liability, the Company shall\n    not be liable to pay or contribute more than its ratable\n    proportion of any compensation, cost or expense.\n\n SR   Scenarios Same Risk start   Different Risk start date\n No.            date (RSD)       (RSD)\n\n                                               First policy        Later\n                                   cancelled (on request","I don’t know the **total liability cap amount** for the owner-driver personal accident cover when bundled with a private car’s own-damage and third-party cover, because the dataset only states that the insurer’s aggregate liability **does not exceed a capped sum that must be inserted (blank “`____*` / `.......*`”)**—it does not provide the actual numeric cap. [Data: Entities (73, 85); Relationships (447, 738)]

What I *can* determine is the **percentage for accidental death** under the relevant personal accident cover scale: **Death = 100%** of the applicable sum insured/capital sum insured for that item. [Data: Entities (73); Relationships (447)]",8236.69,20783,150,20972,0.00434488
Within how many calendar months of the injury must death or disablement occur for an owner-driver personal accident benefit to be payable under a bundled private car cover?,The death or disablement must occur within six calendar months of the injury for compensation to be payable.,"private-car-package-policy-wording.txt — Section III, Personal Accident Cover for Owner-Driver","===== REPORTS =====
   id                                                       title                                                                                                                                                                                                                                                                                                                                                                                                                                                                                                                                                                                                                                                                                                                                                                                                                                                                                                                                                                                                                                                                                                                                                                                                                                                                                                                                                                                                                                                                                                                                                                                                                                                                                                                                                                                                                                                                                                                                                                                                                                                                                                                                                                                                                                                                                                                                                                                                                                                                                                                                                                                                                                                                                                                                                                                                                                                                                                                                                                                                                                                                                                                                                                                                                                                                                                                                                                                                                                                                                                                                                                                                                                                                                                                                                                                                                                                                                                                                                                                                                                                                                                                                                                                                                         content
0   5                Insurance Regulation and Liability Framework  # Insurance Regulation and Liability Framework\n\nThis community consists primarily of the Insurer, the Motor Vehicles Act, 1988, and the Workmen’s Compensation Act, with their interrelations defining vehicle insurance and employee liability coverage in India. The Insurer provides foundational services under these regulatory frameworks, ensuring compliance with various legal obligations while managing risks related to motor vehicle operations and workplace injuries.\n\n## Insurer's Role in Vehicle Coverage\n\nThe Insurer plays a fundamental role by offering comprehensive insurance coverage for vehicles against various risks such as theft, accidents, and environmental damages. This coverage is detailed in policies that specify liability terms, ensuring vehicle owners are adequately protected and any claims are managed efficiently. The insurer is obliged to follow the regulations specified in the Motor Vehicles Act, 1988, which governs the operational standards, ensuring their services align with legal requirements [Data: Entities (57); Relationships (56, 100)].\n\n## Motor Vehicles Act, 1988's Impact on Insurance\n\nThe Motor Vehicles Act, 1988 establishes the legal framework within which the Insurer operates. It necessitates compliance from insurers regarding vehicle registration, insurance requirements, and liability coverage. By imposing specific standards and regulations, this Act ensures that insurers fulfill their responsibilities towards policyholders, promoting road safety and minimizing risks associated with vehicle use. The Act also addresses the obligations of both vehicle operators and insurers, effectively integrating their responsibilities [Data: Entities (96); Relationships (100, 122)].\n\n## Workmen’s Compensation Act and Employment Liabilities\n\nThe Workmen’s Compensation Act provides critical legal guidelines for employee compensation in the event of workplace injuries. It outlines the Insurer's responsibility to cover liabilities under this Act, ensuring that workers are compensated without needing to prove employer negligence. This regulatory framework is vital in protecting workers' rights and promoting a safe working environment, making the insurer's role pivotal in managing these liabilities effectively [Data: Entities (75, 383); Relationships (126, 449)].\n\n## Compliance with Regulatory Requirements\n\nThe Insurer is bound to comply with various legal requirements established by regulations such as the Motor Vehicles Act and the Workmen's Compensation Act. This compliance not only ensures that the insurer operates within legal boundaries but also protects the interests of policyholders, enforcing standards that guarantee adequate compensation for vehicle damages and workplace injuries. Such regulatory adherence is fundamental in maintaining public trust in the insurance landscape [Data: Relationships (100, 449)].\n\n## Potential Risks and Their Impact\n\nVarious risks are recognized by the insurer, including damage due to explosions, theft, and environmental factors such as storms and inundation. These risks are delineated in the insurance policy, which outlines specific coverage areas. Understanding these risks is critical, as they directly affect the insurer's liability and the financial protection offered to policyholders. The insurer's approach to managing these risks significantly influences its operational strategy and policy effectiveness [Data: Entities (65, 68, 70, 76); Relationships (763, 774)].\n\n## Claims Management Process\n\nThe claims management process is a vital aspect of the insurer's responsibilities, particularly in the context of the Motor Vehicles Act and the Workmen's Compensation Act. Efficient claims processing ensures that policyholders receive compensation timely for losses incurred, reinforcing the insurer's credibility in the market. This process is guided by specific policy stipulations and regulatory compliance, highlighting the importance of a streamlined approach to managing claims [Data: Entities (57); Relationships (449, 100)].
1  36  Insurance Community: Insurer, Policies, and Coverage Risks                                                                 # Insurance Community: Insurer, Policies, and Coverage Risks\n\nThe insurance community encompasses key entities such as insurers, various insurance policies, and notable risks such as strikes and explosions that shape the liability landscape. These entities are interconnected, influencing coverage, claims processing, and legal compliance under frameworks like the Workmen's Compensation Act.\n\n## Role of the Insurer in Coverage\n\nThe Insurer is pivotal in this community, offering coverage against a variety of risks related to vehicles. This includes liabilities stemming from accidents, theft, and various perils such as explosions and strikes, ensuring policyholders are protected financially under specified terms. By managing claims and adhering to comprehensive policies, insurers facilitate the smooth processing of coverage claims for vehicle owners. They also carefully outline exclusions and conditions related to specific risks, which clarifies the overall risks and responsibilities associated with their policies [Data: Entities (57); Relationships (56, 449, 763, 764)].\n\n## Influence of the Workmen’s Compensation Act\n\nThe Workmen's Compensation Act establishes essential legal frameworks regulating employee compensation due to work-related injuries. Insurers play a fundamental role here, providing indemnifications that align with the Act's provisions. This connection enhances workplace safety and supports employee rights, simplifying the process for injured workers to claim benefits. The interplay between insurers and the Act is vital for both compliance and ensuring economic security for workers in case of injuries, further enforcing employer accountability under the Act [Data: Entities (383); Relationships (449)].\n\n## Coverage of Explosions and Strikes\n\nSignificant risk factors within the insurance community are represented by events such as explosions and strikes, both of which can lead to substantial claims. Insurers explicitly cover explosions as a peril in their policies, acknowledging the potential for financial loss. Similarly, strikes can disrupt business operations, potentially leading to claims against the insurer. This dual perspective underscores the insurer's responsibility in a landscape fraught with risks, positioning them as key players in mitigating the financial impact of such events [Data: Entities (65, 68); Relationships (763, 212)].\n\n## Impact of Mobile Plant Insurance\n\nMobile Plant, which includes specialized vehicles and equipment, illustrates a unique aspect of the insurance landscape. Policies must address specific exclusions related to these vehicles, accentuating their operational characteristics. Insurers provide coverage designed to protect against risks associated with the use of mobile plant, thus reinforcing the importance of tailored policies tailored for diverse operational needs in various industries [Data: Entities (408); Relationships (517)].\n\n## The comprehensive nature of Vehicle Insurance Policies\n\nInsurance policies encompass a broad array of emerging risks, ensuring that policyholders have the necessary protections against various perils. Noteworthy inclusions are lightning, theft, and fire risks, all acknowledged within the insurers' coverage terms. This detailed attention to diverse risks not only helps manage potential liabilities but also reassures policyholders regarding their financial safety in different scenarios [Data: Entities (67, 393, 394); Relationships (472, 473)].\n\n## Assessment of Malicious Damage and Coverage\n\nMalicious damage, characterized by intentional acts against property, is explicitly recognized in vehicle insurance policies. This inclusion signals the insurer's commitment to protect policyholders from losses related to such destructive actions that may impact vehicles. Such coverage enhances security for insured parties, enabling them to recover losses resulting from malicious acts effectively [Data: Entities (69); Relationships (771)].
===== RELATIONSHIPS =====
     id                            source                      target                                                                                                                                                                     description weight links  in_context
0    65                           INSURER     PERSONAL ACCIDENT COVER                                                               The insurer provides personal accident cover as part of the insurance policy for those using the insured vehicle.    5.0     9        True
1   520                     BODILY INJURY                     INSURER                                                                                 Claims for Bodily Injury can lead to liabilities that the Insurer must address under the policy    7.0     9        True
2   447                           INSURER                      IMT 15                                                                                      The insurer provides personal accident coverage details in IMT 15 for insured individuals.    8.0     9        True
3   448                           INSURER                      IMT 16                                                                                       The insurer provides personal accident coverage details in IMT 16 for unnamed passengers.    1.0     9        True
4   760                          IMT 11 B                     INSURER  IMT 11 B outlines additional terms concerning the insurer’s liability in scenarios where vehicles are laid up without a declared period, reinforcing the contractual framework    7.0     9        True
5   761                          IMT 11 C                     INSURER                                 IMT 11 C indicates the reinstatement of the insurance after the laid up period and stipulates how the insurer will proceed following this event    1.0     9        True
6   819            DEATH OR BODILY INJURY                     INSURER                                                      The insurer outlines exclusions related to liability for death or bodily injury, impacting coverage provided by the policy    9.0     9        True
7   860          DEATH, INJURY, OR DAMAGE                     INSURER                                                                         The insurer outlines specific liabilities concerning death, injury, or damage in relation to the policy    8.0     9        True
8   104                           INSURER                      IMT 29                                                                                     The insurer provides indemnity coverage according to the stipulations of endorsement IMT 29    7.0     9        True
9   653                    INSURED PERSON                 EXTENSION 5                                                                                      Extension 5 pertains specifically to the Insured Person and limits on claims they can make    6.0     4        True
10  658                         BENEFIT 5              INSURED PERSON                                                                   Benefit 5 provides compensation to the Insured Person for daily hospital stays related to accidental injuries    1.0     4        True
11  287                    INSURED PERSON             AMBULANCE COVER                                                                           The Insured Person may utilize Ambulance Cover for transportation to a hospital following an Accident    1.0     4        True
12  656                    INSURED PERSON                 EXTENSION 8                                                                                                Extension 8 is applicable to the Insured Person's survivors for funeral expenses    6.0     4        True
13  433           PERSONAL ACCIDENT COVER                     INSURED                                                                            The Personal Accident Cover applies to the Insured as the owner-driver under the terms of the policy    1.0     2        True
14   23                           INSURED               BODILY INJURY                                                              The Insured may become legally liable for Bodily Injury to others as a result of an accident involving the Vehicle    6.0     2        True
15  646                            POLICY                 EXTENSION 5                                                                                           Extension 5 outlines the benefits for Permanent Partial Disablement under the Policy.    1.0     2        True
16  645                            POLICY                 EXTENSION 4                                                                                   Extension 4 specifies coverage for Permanent Total Disablement as a benefit under the Policy.    8.0     2        True
17  410                     BODILY INJURY                COMPENSATION                                                                       Compensation is available for losses due to bodily injury claims under the terms of the insurance policy.    7.0     2        True
18  450                       DISABLEMENT                COMPENSATION                                                                      Permanent total disablement is a condition under which compensation is paid based on the policy provisions    1.0     2        True
19   63                            IMT 15  WORKMEN'S COMPENSATION ACT                        IMT 15 references the Workmen's Compensation Act, indicating the coverage of those employed and specifies conditions for compensation based on this Act.    4.0     2        True
20   64                            IMT 16  WORKMEN'S COMPENSATION ACT                                        IMT 16 references the Workmen's Compensation Act to clarify the scope of coverage for unnamed passengers relating to employment context.    1.0     2        True
21   68           PERSONAL ACCIDENT COVER             INSURED VEHICLE                        Personal Accident Cover is specifically related to the insured vehicle as it outlines the compensation terms for injuries occurring during its operation    8.0     1        True
22  378                  INSURANCE POLICY               BODILY INJURY                                                                                      The Insurance Policy outlines compensation for BODILY INJURY sustained by the owner-driver    8.0     1        True
23  795                     BODILY INJURY             VEHICLE INSURED                                                                         Bodily injury resulting from an event involving the vehicle insured may lead to claims under the policy    8.0     1        True
24  789           PERSONAL ACCIDENT COVER                       HIRER                                           The Personal Accident Cover applies to unnamed hirers, providing compensation for injuries sustained while using the insured vehicle.    8.0     1        True
25   70  UNNAMED HIRER/PILLION PASSENGERS     PERSONAL ACCIDENT COVER                                                                     Unnamed hirers and pillion passengers are included in the terms of Personal Accident Cover for compensation    1.0     1        True
26  790           PERSONAL ACCIDENT COVER           PILLION PASSENGER                                                 The Personal Accident Cover is applicable to unnamed pillion passengers for injuries incurred while riding the insured vehicle.    8.0     1        True
27  791                        ANY PERSON     PERSONAL ACCIDENT COVER                                                    Any person involved with the insured vehicle is entitled to the Personal Accident Cover for injuries sustained during usage.    1.0     1        True
28  796                             LIMBS               BODILY INJURY                                                                     Loss of limbs is a specific example of a bodily injury eligible for compensation under the insurance policy    9.0     1        True
===== ENTITIES =====
     id                    entity                                                                                                                                                                                                                                                                                                                                                                                                                                                                                                                                                                                                                                                                                                                                                                                                                                                                                                                                                                                                                                                                                                                                                                                                                                                                 description number of relationships  in_context
0    76   PERSONAL ACCIDENT COVER                                                                                                                                                                                                                                                                                            Personal Accident Cover is an insurance provision designed to offer compensation for bodily injuries incurred by specific individuals linked to the insured vehicle, adhering to the particular conditions delineated in the policy. This coverage primarily focuses on providing financial support to those who sustain injuries while operating or riding in the insured vehicle.\n\nThe coverage applies to the insured individual, which may include the owner-driver and potentially other designated passengers within the vehicle at the time of the accident. It encompasses a range of benefits aimed at addressing the repercussions of accidents that result in bodily harm. \n\nOverall, Personal Accident Cover serves as an essential safety net for policyholders, ensuring that they receive assistance in the event of personal injuries sustained during vehicle-related incidents, depending on the terms outlined within their individual policy agreements.                       7        True
1   481               EXTENSION 4                                                                                                                                                                                                                                                                                                                                                                                                                                                                                                                                                                                                                                                                                                                                                                                                                                                                                                                                                                                                                                                                                                                                                      Extension 4 details benefits for Permanent Total Disablement as part of the insurance coverage for the Insured Person.                       1        True
2   577    DEATH OR BODILY INJURY                                                                                                                                                                                                                                                                                                                                                                                                                                                                                                                                                                                                                                                                                                                                                                                                                                                                                                                                                                                                                                                                                                                       Legal scenarios that are excluded from certain indemnities provided by the insurance policy, specifically when related to passengers of the vehicles.                       1        True
3   492                 BENEFIT 5                                                                                                                                                                                                                                                                                                                                                           Benefit 5 is a provision that delineates the Company’s maximum liability concerning hospitalization for an Insured Person. It explicitly specifies the limits of coverage applicable to days of hospital confinement. Additionally, Benefit 5 encompasses the Accidental Hospital Confinement Allowance, which stipulates that the Insured Person will receive daily payments during hospitalization specifically due to injuries sustained from accidents. This benefit ensures financial support for individuals confined to a hospital as a direct result of accidental injuries, reinforcing the Company’s commitment to providing adequate coverage for medical needs arising from such incidents. The dual focus of Benefit 5 on liability limitations and financial assistance highlights its importance in safeguarding the health and well-being of insured individuals during unforeseen circumstances.                       1        True
4   595  DEATH, INJURY, OR DAMAGE                                                                                                                                                                                                                                                                                                                                                                                                                                                                                                                                                                                                                                                                                                                                                                                                                                                                                                                                                                                                                                                                                                                                                                  Refers to liabilities covered or excluded in the insurance policy related to incidents involving vehicles.                       1        True
5   259           AMBULANCE COVER                                                                                                                                                                                                                                                                                                                                                                                                                                                                                                                                                                                                                                                                                                                                                                                                                                                                                                                                                                                                                                                                                                                                                  A benefit under the insurance policy for arranging and reimbursing transportation to a medical facility after an accident.                       1        True
6   482               EXTENSION 5                                                                                                                                                                                                                                                                                                                                                                Extension 5 is a specific provision that caters to the benefits associated with Permanent Partial Disablement for the Insured Person under the policy. This extension outlines the financial support and advantages accessible to individuals who qualify for coverage due to partial disability resulting from covered events. Furthermore, Extension 5 stipulates the sum insured applicable for claims made under particular circumstances related to the Insured Person. Thus, it provides clarity on the fiscal limits and conditions under which claims can be filed, ensuring that the Insured Person understands their entitlements and the associated coverage they possess in the event of a qualifying incident. Overall, Extension 5 serves to enhance the policy by clearly delineating benefits and financial protections available to the Insured Person facing permanent partial disability.                       2        True
7    73                    IMT 15  IMT 15 is a specific insurance policy that delineates the conditions under which personal accident coverage is applicable for the insured individuals. This coverage is activated during several scenarios, including the mounting and dismounting from the insured vehicle as well as while traveling in it. The policy is designed to offer protection to the insured or named individuals specified in the policy, ensuring they receive personal accident cover in the outlined situations.\n\nHowever, it is important to note that this coverage specifically excludes paid drivers or cleaners. This means that while the insured and other named persons are protected under IMT 15, any professional drivers or individuals employed to clean the vehicle do not qualify for this personal accident coverage. The conditions set forth in IMT 15 serve to clarify the scope and limitations of the insurance protection provided to individuals against personal accidents related to the insured vehicle. \n\nIn summary, IMT 15 details the personal accident coverage available for named insured persons while engaging with the vehicle, specifically during mounting, dismounting, and travel, but it does not extend coverage to paid drivers or cleaners.                       2        True
8    23             BODILY INJURY     Bodily Injury refers to physical harm inflicted on individuals, which can arise from various circumstances, particularly in the context of accidents. This term encompasses injuries sustained by individuals, including owner-drivers involved in vehicle accidents. Such injuries may lead to liability claims under an insurance policy, positioning the insured potentially liable for compensation associated with the harm caused.\n\nSpecifically, Bodily Injury pertains not only to the direct physical injuries experienced but also to the implications of these injuries concerning legal and insurance liabilities. When an individual suffers bodily harm, it can result in claims for compensation, indicating the financial repercussions tied to the injury and the insured party's obligation under the insurance agreement.\n\nIn summary, Bodily Injury embodies the concept of physical harm to a person, which may invoke legal liability and elicit compensation demands under applicable insurance policies. This notion underscores the interconnectedness of physical injuries, legal accountability, and insurance coverage, highlighting its significance in managing and mitigating the implications of accidents and harm to individuals.                       6        True
9   552                  IMT 11 B                                                                                                                                                                                                                                                                                                                                                                                                                                                                                                                                                                                                                                                                                                                                                                                                                                                                                                                                                                                                                                                                                                              IMT 11 B pertains to the policy clause for vehicles laid up without a declared period, outlining the conditions and liabilities that apply during this status.                       1        True
10  101                    IMT 29                                                                                                                                                                                                                                                                                                                                                                                                                                                                                                                                                                                                                                                                                                                                                                                                                                                                                                                                                                                                                                                                                                          A specific endorsement related to the liabilities of employees who may be traveling in or driving the insured vehicle, particularly private cars and two-wheelers.                       1        True
11  384               DISABLEMENT                                                                                                                                                                                                                                                                                                                                                                                                                                                                                                                                                                                                                                                                                                                                                                                                                                                                                                                                                                                                                                                                                                                              Permanent total disablement refers to serious injuries resulting in the inability to work, triggering compensation under the insurance policy.                       1        True
12  490               EXTENSION 8                                                                                                                                                                                                                                                                                                                                                                                                                                                                                                                                                                                                                                                                                                                                                                                                                                                                                                                                                                                                                                                                                                                                                             Extension 8 includes provisions for covering the funeral expenses of the Insured Person if a claim is admitted.                       1        True
13  553                  IMT 11 C                                                                                                                                                                                                                                                                                                                                                                                                                                                                                                                                                                                                                                                                                                                                                                                                                                                                                                                                                                                                                                                                                                                                   IMT 11 C describes the terms for the termination of the undeclared period of a vehicle being laid up and how the insurance is reinstated.                       1        True
14   74                    IMT 16                                                                                                                                                                                                                                                                                                                                                                                                                                                                                                                                              IMT 16 pertains to the provisions regarding personal accident coverage specifically for unnamed passengers involved in incidents that affect their safety. This document categorically specifies that the coverage is applicable to passengers who are not classified as the insured, nor do they include any paid staff such as the driver or cleaner. Essentially, IMT 16 delineates the terms under which personal accident insurance is provided, ensuring that it covers individuals who are aboard a vehicle but do not fall into the categories of either the policyholder or employed personnel. The scope of IMT 16 is focused on safeguarding the interests of these unnamed passengers in the event of an accident.                       2        True
===== SOURCES =====
   id                                                                                                                                                                                                                                                                                                                                                                                                                                                                                                                                                                                                                                                                                                                                                                                                                                                                                                                                                                                                                                                                                                                                                                                                                                                                                                                                                                                                                                                                                                                                                                                                                                                                                                                                                                                                                                                                                                                                                                                                                                                                                                                                                                                                                                                                                                                                                                                                                                                                                                                                                                                                                                                                                                                                                                                                                                                                                                                                                                                                                                                                                                                                                                                                                                                                                                                                                                                                                                                                                                                                                                                                                                                                                                                                                                                                                                                                                                                                                                                                                                                                                                                                                                                                                                                                                                                                                                                                                                                                                                                                                                                                                                                                                                                                                                                                                                                                                                                                                                                                                                                                                                                                                                                                                                                                                                                                                                                                                                                                                                                                                                                                                                                                                                                                                                                                                                                                                                               text
0   9                                                                                                             ... ** persons/passengers are in the\n     vehicle insured at the time of occurrence of such injury.\nSubject otherwise to the terms exceptions conditions and\nlimitations of this policy.\n* The Capital Sum Insured (CSI) per passenger is to be inserted.\n** The registered sitting capacity of the vehicle insured is to be\ninserted.\n\n17.  IMT. 17. PERSONAL ACCIDENT COVER TO PAID\nDRIVERS, CLEANERS AND CONDUCTORS: (Applicable to all\nclasses of vehicles)\n\nIn consideration of the payment of an additional premium, it is\nhereby understood and agreed that the insurer undertakes to\npay compensation on the scale provided below for bodily injury\nas hereinafter deﬁned sustained by the paid driver/\ncleaner/conductor in the employ of the insured in direct\nconnection with the vehicle insured whilst mounting into\ndismounting from or traveling in the insured vehicle and caused\nby violent accidental external and visible means which\nindependently of any other cause shall within six calendar\nmonths of the occurrence of such injury result in :\n Nature of injury                          Scale of\n                              CompensaƟon\n (I)  Death                         100%\n (ii) Loss of two limbs or sight of two       100%\n    eyes or one limb and sight of one eye\n  (iii) Loss of one limb or sight of one eye     50%\n (iv) Permanent total disablement from     100%\n     injuries other than named above\n\nProvided always that\nI.   Compensation shall be payable under only one of the items\n       (I) to (iv) above in respect of any such person arising out of\n    any one occurrence and total liability of the insurer shall not\n     in the aggregate exceed the sum of `____* during any one\n    period of insurance in respect of any such person.\nII.  No compensation shall be payable in respect of death or\n     injury directly or indirectly wholly or in part arising or\n     resulting from or traceable to\n     (a) intentional self injury suicide or attempted suicide\n        physical defect or inﬁrmity or (b) an accident\n       happening whilst such person is under the inﬂuence of\n         intoxicating liquor or drugs.\nIII.  Such compensation shall be payable only with the\n    approval of the insured named in the policy and directly to\n    the injured person or his/ her legal representative(s) whose\n     receipt shall be a full discharge in respect of the injury of\n    such person.\nSubject otherwise to the terms exceptions conditions and\nlimitations of this policy.\n* The Capital Sum Insured (CSI) per person is to be inserted.\n18. IMT. 18. PERSONAL ACCIDENT TO UNNAMED HIRER\nAND UNNAMED PILLION PASSENGERS (Applicable to\nMotorised Two wheelers with or without side Car)\nIn consideration of the payment of an additional premium it is\nhereby understood and agreed that the insurer undertakes to\npay compensation to any unnamed hirer/driver/any unnamed\npillion/sidecar passenger* on the scale provided below for\nbodily injury caused by violent, accidental, external and visible\nmeans whilst mounting into/onto and/or dismounting from or\ntraveling in/on the vehicle insured which independently of any\nother cause shall within three calendar months of the\noccurrence of such injury results in :\n\n Nature of injury                          Scale of\n                              CompensaƟon\n (I)  Death                         100%\n (ii) Loss of two limbs or sight of two       100%\n    eyes or one limb and sight of one eye\n  (iii) Loss of one limb or sight of one eye     50%\n (iv) Permanent total disablement from     100%\n     injuries other than named above\nProvided always that:\nI.   Compensation shall be payable under only one of the items\n        (i) to (iv) above in respect of any such person arising out of\n    any one occurrence and total liability of the insurer shall not\n     in the aggregate exceed the sum of `______** during any\n    one period of insurance in respect of any such person.\nII.  No compensation shall be payable in respect of death or\n     injury directly or indirectly wholly or in part arising or\n     resulting from or traceable to (a) intentional self injury\n     suicide or attempted suicide physical defect or inﬁrmity or\n     (b) an accident happening whilst such person is under the\n    inﬂuence of intoxicating liquor or drugs.\nIII.  Such compensation shall be payable only with the\n    approval of the insured named in the policy and directly to\n     the injured person or his/her legal representative(s) whose\n     receipt shall be a full discharge in respect of the injury of\n    such person.\nIV.  Not more than ...................... persons/passengers are in the\n     vehicle insured at the time of occurrence of such injury.\nSubject otherwise to the terms exceptions conditions and\nlimitations of this policy.\n* Delete if P.A. cover for unnamed pillion/side car passenger is\nnot taken.\n** The Capital Sum Insured (CSI) per passenger is to be inserted.\n19.  IMT. 19. COVER FOR VEHICLES IMPORTED WITHOUT\nCUSTOMS DUTY\nNotwithstanding anything to the contrary contained in this\npolicy it is hereby understood and agreed that in the event of\nloss or damage to the vehicle insured and/or its accessories\nnecessitating the supply of a part not obtainable from stocks\nheld in the country in which the vehicle insured is held for repair\nor in the event of the insurer exercising the option under\n...................... * to pay in cash the amount of the loss or damage the\nliability of the insurer in respect of any such part shall
1   8                                                                                                     Vehicles)\nIt is hereby understood and agreed that the insurer shall not be\nliable in respect of the vehicle insured while it is being used\nelsewhere than on site to which the public have no general right\nof access and the vehicle is not required to be registered under\nthe Motor Vehicles Act, 1988.\n15.  IMT. 15. PERSONAL ACCIDENT COVER TO THE INSURED\nOR ANY NAMED PERSON OTHER THAN PAID DRIVER OR\nCLEANER (Applicable to private cars including three wheelers\nrated as private cars and motorized two wheelers with or\nwithout side car [not for hire or reward)\n\nIn consideration of the payment of an additional premium it is\nhereby agreed and understood that the Company undertakes to\npay compensation on the scale provided below for bodily injury\nas hereinafter deﬁned sustained by the insured person in direct\nconnection with the vehicle insured or whilst mounting and\ndismounting from or traveling in vehicle insured and caused by\nviolent accidental external and visible means which\nindependently of any other cause shall within six calendar\nmonths of the occurrence of such injury result in:-\n\n Nature of injury                          Scale of\n                              CompensaƟon\n (I)  Death                         100%\n (ii) Loss of two limbs or sight of two       100%\n    eyes or one limb and sight of one eye\n  (iii) Loss of one limb or sight of one eye     50%\n (iv) Permanent total disablement from     100%\n     injuries other than named above\n\nProvided always that\n\nI.    Compensation shall be payable under only one of the\n     items (i) to (iv) above in respect of any such person arising\n     out of any one occurrence and total liability of the insurer\n      shall not in the aggregate exceed the sum of `.......* during\n     any one period of insurance in respect of any such person.\n\nII.   No compensation shall be payable in respect of death or\n      injury directly or indirectly wholly or in part arising or\n      resulting from or traceable to (a) intentional self injury\n      suicide or attempted suicide physical defect or inﬁrmity or\n      (b) an accident happening whilst such person is under the\n     inﬂuence of intoxicating liquor or drugs.\n\nIII.   Such compensation shall be payable only with the\n     approval of the insured named in the policy and directly to\n     the injured person or his/her legal representative(s) whose\n      receipt shall be a full discharge in respect of the injury of\n     such person.\n\nSubject otherwise to the terms exceptions conditions and\nlimitations of this policy.\n\n* The Capital Sum Insured (CSI) per passenger is to be inserted.\n\n16.  IMT. 16. PERSONAL ACCIDENT TO UNNAMED\nPASSENGERS OTHER THAN INSURED AND THE PAID\nDRIVER AND CLEANER (For vehicles rated as Private cars\nand Motorised two wheelers (not for hire or reward) with or\nwithout side car)\n\nIn consideration of the payment of an additional premium it is\nhereby understood and agreed that the insurer undertakes to\npay compensation on the scale provided below for bodily\ninjuries hereinafter deﬁned sustained by any passenger other\nthan the insured and/or the paid driver attendant or cleaner\nand/or a person in the employ of the insured coming within the\nscope of the Workmen’ Compensation Act, 1923 and\nsubsequent amendments of the said Act and engaged in and\nupon the service of the insured at the time such injury is\nsustained whilst mounting into, dismounting from or traveling in\nthe insured motor car and caused by violent, accidental,\nexternal and visible means which independently of any other\ncause shall within three calendar months of the occurrence of\nsuch injury result in :\n\n    Nature of injury                          Scale of\n                                 CompensaƟon\n        (I)  Death                         100%\n        (ii) Loss of two limbs or sight of two       100%\n       eyes or one limb and sight of one eye\n        (iii) Loss of one limb or sight of one eye     50%\n      (iv) Permanent total disablement from     100%\n         injuries other than named above\n\nProvided always that:-\nI.   Compensation shall be payable under only one of the items\n        (i) to (iv) above in respect of any such person arising out of\n    any one occurrence and total liability of the insurer shall not\n     in the aggregate exceed the sum of `____* during any one\n     period of insurance in respect of any such person.\nII.  No compensation shall be payable in respect of death or\n     injury directly or indirectly wholly or in part arising or\n     resulting from or traceable to (a) intentional self injury\n     suicide or attempted suicide physical defect or inﬁrmity or\n     (b) an accident happening whilst such person is under the\n    inﬂuence of intoxicating liquor or drugs.\nIII.  Such compensation shall be payable only with the\n    approval of the insured named in the policy and directly to\n     the injured person or his/her legal representative(s) whose\n     receipt shall be a full discharge in respect of the injury of\n    such person.\nIV.  Not more than................... ** persons/passengers are in the\n     vehicle insured at the time of occurrence of such injury.\nSubject otherwise to the terms exceptions conditions and\nlimitations of this policy.\n* The Capital Sum Insured (CSI) per passenger is to be inserted.\n** The registered sitting capacity of the vehicle insured is to be\ninserted.\n\n17.  IMT. 17. PERSONAL ACCIDENT COVER TO PAID\nDRIVERS, CLEANERS AND CONDUCTORS: (Applicable to all\nclasses
2  57  EMENT\n       It  is hereby understood and agreed that (hereinafter\n    referred to as the Lessors) are the Owners of the vehicle\n    insured and that the vehicle insured is the subject of a Lease\n    Agreement made between the Lessor on the one part and\n    the insured on the other part and it is further understood\n   and agreed that the Lessors are interested in any monies\n    which but for this Endorsement would be payable to the\n    insured under this policy in respect of such loss or damage\n    to the vehicle insured as cannot be made good by repair\n    and/or replacement of parts and such monies shall be\n    paid to the Lessors as long as they are the Owners of the\n    vehicle insured and their receipt shall be a full and final\n    discharge to the insurer in respect of such loss or damage.\n       It is also understood and agreed that notwithstanding any\n    provision in the Leasing Agreement to the contrary, this\n    policy is issued to the insured namely  as the principal\n    party and not as agent or trustee and nothing herein\n    contained shall be construed as constituting the insured\n   an agent or trustee for the Lessors or as an assignment\n    (whether legal or equitable) by the insured to the Lessors,\n    of his rights benefits and claims under this policy and\n    further nothing herein shall be construed as creating or\n    vesting any right in the Owner/Lessor to sue the insurer\n     in any capacity whatsoever for any alleged breach of its\n    obligations hereunder.\n       It is further declared and agreed that for the purpose\n    of the Personal Accident Cover  for the owner-driver\n    granted under this policy, the insured named in the policy\n     will continue to be deemed as the owner-driver subject\n    to compliance of provisions of the policy relating to this\n    cover.\n   Save as by this Endorsement expressly agreed nothing\n    herein shall modify or affect the rights and liabilities of the\n    insured or the insurer respectively under or in connection\n    with this Policy. Subject otherwise to the terms exceptions\n    conditions and limitations of this policy.\n7.  IMT. 7. Vehicles subject to Hypothecation Agreement\n       It is hereby declared and agreed that the vehicle insured\n     is pledged to/hypothecated with. (hereinafter referred to\n    as the Pledgee) and it is further understood and agreed\n    that the Pledgee is interested in any monies which but\n     for this Endorsement would be payable to the insured\n    under this policy in respect of such loss or damage to the\n    vehicle insured as cannot be made good by repair and/\n    or replacement of parts and such monies shall be paid to\n    the Pledgee as long as they are the Pledgee of the vehicle\n    insured and their receipt shall be a full and final discharge\n    to the insurer in respect of such loss or damage.\n       It is further declared and agreed that for the purpose\n    of the Personal Accident Cover  for the owner-driver\n    granted under this policy, the insured named in the policy\n     will continue to be deemed as the owner-driver subject\n    to compliance of provisions of the policy relating to this\n    cover.\n   Save as by this Endorsement expressly agreed that nothing\n    herein shall modify or affect the rights or liabilities of the\n    Insured or the Insurer respectively under or in connection\n    with this Policy or any term, provision or condition thereof.\n    Subject otherwise to the terms exceptions conditions and\n     limitations of this policy.\n8.  IMT. 8. DISCOUNT FOR MEMBERSHIP OF RECOGNISED\n   AUTOMOBILE ASSOCIATIONS (PRIVATE CARS AND\n   MOTORISED TWO WHEELERS ONLY)\n       It is hereby understood and agreed that in consideration\n    of insured’s membership of ......** a discount in premium\n    of `............* is allowed to the insured hereunder from\n         ...  /...  /....... It is further understood and agreed that if the\n    insured ceases to be a member of the above mentioned\n    association during the currency of this Policy the insured\n     shall immediately notify the insurer accordingly and refund\n    to the insurer a proportionate amount of the discount\n    allowed on this account for the unexpired period of the\n    cover.\n    Subject otherwise to the terms exceptions conditions and\n     limitations of the policy\n    *For full policy period, the full tariff discount to be inserted.\n    For mid-term membership, prorata proportion of the tariff\n    discount for the unexpired policy period is to be inserted.\n     **Insert name of the concerned Automobile Association.\n9.  IMT. 9. DISCOUNT FOR VINTAGE CARS (Applicable to\n    Private Cars only)\n       It is hereby understood and agreed that in consideration\n    of the insured car having been certified as a Vintage Car\n    by the Vintage and Classic Car Club of India, a discount\n    of ` ......................* is allowed to the insured from ......../.........\n         /...........\n    Subject otherwise to the terms exceptions conditions and\n     limitations of the policy\n   *Amount  calculated as per  tariff  provision  is  to be\n     inserted. For mid-term certification as Vintage Car pro-\n    rata proportion of tariff discount for the unexpired period\n     is to be inserted.\n10. IMT. 10. INSTALLATION OF ANTI-THEFT DEVICE (Not\n    applicable to Motor Trade Policies)\n     In consideration of certification by *that an Anti-Theft\n    device approved by Automobile Research Association\n    of India (ARAI), Pune has been installed  in the  vehicle\n    insured  herein a premium  discount  of `............** is\n    hereby
3  89                                                                                                                                                                                                                                                                                                                                                                                                                              that  the\ndetailed account  of  the expenses  incurred\nalong  with   all  the  supporting   bills  and\ndocuments,  substantiating  such  expenses,\nshall be submitted to and approved by the\nCompany.\nExtension 2: Medical Benefits Extension\nIn consideration of the payment of additional\npremium, the Company hereby agrees, subject\nto  the  terms,  conditions  and  exclusions\napplicable  to  this  Section and  the  terms,\nconditions, general exclusions stated  in the\nPolicy to extend the cover available under\nSection A to reimburse the Medical Expenses\nincurred during Hospitalisation, subject to a\nmaximum of Rs.    (as    specified   under\nbenefit  amount   against   Extension    2),\nreasonably  and  necessarily  incurred  and\nexpended,  during  the  Policy  Period/Policy\nYear, for the treatment of the Insured Person\non  the   written  advice   of  the  Medical\nPractitioner,  in connection with any Insured\nEvent covered under Section A of Part I of the\nmade by the Insured Person and admitted by\nthe Company.\nNotwithstanding anything to the contrary stated\nherein the Company shall be liable to make\npayment  under  this  extension  only   if  the\nHospitalisation commences within 7 days of\noccurrence of such Accident and the Insured\nPerson  undergoes  Hospital  Confinement,\nexceeding consecutive days.\nFurther,   it  is a condition precedent  to the\npayment of such Medical Expenses that the\nMedical Practitioner's detailed account shall be\nsubmitted to and is approved by the Company.\nHowever the Company's total  liability, under\nthis extension, for payment of  all claims in\naggregate for the Policy Period/Policy Year\nshall not exceed the Sum Insured as stated\nagainst Extension 2 in Part I of the Schedule as\napplicable to such Insured Person.\nExtension  3:  Hospital  Daily  Allowance\nExtension\nIn consideration of the payment of additional\npremium, the Company hereby agrees, subject\nto  the  terms,  conditions  and  exclusions\napplicable  to  this  Section and  the  terms,\nconditions, general exclusions stated  in the\nPolicy to extend the cover available under\nSection A to pay an allowance as mentioned,\nin Extension 3 of Part  I to the Schedule, for\neach day  of  Hospital Confinement as an\ninpatient   in  a   Hospital  consequent   to\nPermanent   Total   Disablement/Permanent\nPartial     Disablement/Temporary     Total\nDisablement as covered under Section A of\nPart I of the Schedule to this Policy for which a\nclaim  is made by the Insured Person and\nadmitted by the Company.\nNotwithstanding anything to the contrary stated\nherein the Company shall not be liable to pay\nfor any claim arising under this Extension 3\nwithin the first __consecutive days of Hospital\nconfinement  (as  specified  under  benefit\namount against this Extension),\nProvided the Company shall be liable to make\npayment under this Extension 3 only  if such\nHospital Confinement occurs within 7 days of\noccurrence of such Accident.\nHowever the Company's maximum liability for\npayment of a claim under this Extension 3\narising out of an Accident resulting in Hospital\nConfinement   shall  not  e ceed  da s   of\nHospital  Confinement.  (as  specified  under\nbenefit amount against this Extension).\n.\nExtension 4: Permanent Total Disablement\nImprovement Benefit Extension\nIn consideration of the payment of additional\npremium, the Company hereby agrees, subject\nto  the  terms,  conditions  and  exclusions\napplicable  to  this  Section and  the  terms,\nconditions, general exclusions stated  in the\nPolicy to extend the cover available under\nSection A to pay such an additional amount\nwhich  is equal to the amount as indicated\nagainst Extension 4 in Part I of Schedule, to the\nInsured  Person  for  any  Permanent  Total\nDisablement suffered by the Insured Person as\ncovered under Section A  of Part  I  of the\nSchedule to this Policy for which a claim is\nmade by the Insured Person and admitted by\nthe Company. However the Company's liability\nfor payment of all claims under this extension\nin aggregate for Policy Period/Policy Year in no\ncase shall exceed the Sum Insured as stated\nagainst Extension 4 in Part I of the Schedule\nhereto as applicable to such Insured Person.\nExtension     5:    Permanent     Partial\nDisablement    Improvement     Benefit\nExtension\nIn consideration of the payment of additional\npremium, the Company hereby agrees, subject\nto  the  terms,  conditions  and  exclusions\napplicable  to  this  Section and  the  terms,\nconditions, general exclusions stated  in the\nPolicy to extend the cover available under\nSection A to pay such an additional amount\nwhich  is equal to the amount as indicated\nagainst Extension 5 in Part I of Schedule, to the\nInsured  Person  for  a  Permanent  Partial\nDisablement suffered by the Insured Person as\ncovered under Section A  of Part  I  of the\nSchedule to this Policy for which a claim is\nmade by the Insured Person and admitted by\nthe Company.\nHowever, the Company's liability for payment\nof all claims under this extension in aggregate\nfor Policy Period/Policy Year in no case shall\nexceed the Sum Insured as stated against\nExtension 5 in Part I of the Schedule hereto as\napplicable","For an **owner-driver personal accident benefit under IMT 15 (bundled private car cover)**, the injury must result in the covered **death or disablement within six (6) calendar months** of the occurrence of the bodily injury. [Sources: IMT. 15. PERSONAL ACCIDENT COVER TO THE INSURED OR ANY NAMED PERSON OTHER THAN PAID DRIVER OR CLEANER (15)]",1870.04,17873,84,17988,0.0036802199999999997
